Primary Liable party name,Full Property Address,Current Rateable Value,2010 NDR - Analysis code desc,Account Start date
Blake Henderon Ltd,"Wheatsheaf Hotel, Hindpool Road, Barrow In Furness, Cumbria, LA14 1XZ",8100,Public House,03/10/2015
Centric Office Sols Ltd,"Unit 2, Andrews Court, Andrews Way, Barrow In Furness, Cumbria, LA14 2UE",16750,Warehouse,23/10/2015
City Plumbing Supplies Limited,"Unit 3, Forge Close, Barrow In Furness, Cumbria, LA14 2UF",23250,Workshop,12/10/2015
Euro Garages Limited,"Lakeland Shell, Abbey Road, Barrow In Furness, Cumbria, LA14 4HD",54500,Petrol Filling Station,13/10/2015
J N Murray Ltd,"United Club And Institute, Friars Lane, Barrow In Furness, Cumbria, LA13 9NN",10250,Club (Social),19/10/2015
Multiple Sclerosis Society,"Previously Barrow & District Dial A Ride, Schneider Road, Barrow In Furness, Cumbria, LA14 5DP",1275,Offices,01/10/2015
Mw Scaffolding Limited,"Unit 36, Trinity Enterprise Centre, Furness Business Park, Ironworks Road, Barrow In Furness, Cumbria, LA14 2PN",4550,Workshop,16/10/2015
Northern Trust Co Ltd,"Unit 5b, Furness Business Park, Peter Green Way, Barrow-In-Furness, Cumbria, LA14 2PN",14000,Workshop,26/10/2015
T W & A Pullin Ltd,"Unit 3g, Park Road, Barrow In Furness, Cumbria, LA14 4EQ",15500,Workshop,01/10/2015
