Entity,GL Date,Merchant name,Amount,Description
EA,23/03/2016,ALP ELECTRICAL LTD,1796.11,Repairs to St John's Weir gate number 5 following an electrical fault 
EA,23/03/2016,ALP ELECTRICAL LTD,510,Electrical repairs to Shifford Lock site sewage system.
EA,23/03/2016,Amazon UK Marketplace,1000.75,Increase build specification of five developer laptop with additional hard drive and memory capabilities for a project
EA,23/03/2016,ARCHWAY LAWNMOWERS,2775.08,"Annual servicing of 22 items of plant and lawn mowers from Penton Hook, Bell Weir and Old Windsor locks"
EA,23/03/2016,ARCHWAY LAWNMOWERS,1187.19,Annual servicing of eight items of plant and lawn mowers from Cookham lock
EA,23/03/2016,ATEX GLOBAL LTD,4368,Four ATEX cameras to be used inside Dangerous Substance and Explosive Atmosphere zones for National Anaerobic Digestion Safety audits
EA,23/03/2016,BALLYCLARE LTD,534.04,Four waterproof jackets and three pairs waterproof trousers for Clyst Honiton stores.
EA,23/03/2016,BORDER AGGREGATES,912,Sand for filling sand bags for use during winter floods 2015-16.
EA,23/03/2016,BPP PROF EDUCATION,528.6,"Association of Chartered Certified Accountants governance, risk and ethics online tuition course and course learning materials."
EA,23/03/2016,BVSC ENTERPRISE LIMITE,705.6,One day room hire for 15 people with lunch to hold a Senior Environmental Crime officer meeting in Birmingham
EA,23/03/2016,CASTLE GREEN HOTEL,2080,Accommodation for mutual aid staff working during the winter floods 2015-16
EA,23/03/2016,CASTLE GREEN HOTEL,1360,Accommodation for mutual aid staff working during the winter floods 2015-16
EA,23/03/2016,CASTLE GREEN HOTEL,800,Accommodation for mutual aid staff working during the winter floods 2015-16
EA,23/03/2016,CIVILS STORE SITTINGBO,604.56,Ten kegs of tar for the use of filling expansion joints along Sheerness seawall where the old joints needed to be replaced.
EA,23/03/2016,DEAFBLIND.ORG.UK,652.8,"One day room hire for 32 people, including lunch and refreshments, for an Estuarine and Coastal Monitoring and Assessment Service team meeting."
EA,23/03/2016,DORMAR PRODUCTS,983.94,Two replacement drag rakes for ones damaged during winter floods 2015-16
EA,23/03/2016,DORMAR PRODUCTS,677.65,Two sets of extending drag forks to be kept in the smaller Clyst Honiton field services vehicles which aren't long enough to house a full size drag fork.
EA,23/03/2016,DRURYS TRANSPORT LTD,525.6,Two skips of mixed municipal waste from Egmere Depot.
EA,23/03/2016,EB COASTAL FUTURES 20,558,Registration fees for three people to attend the Coastal futures conference 2016.
EA,23/03/2016,EM SUPPLIES,850.37,Sample poles and attachments for the Sampling and Collection team to be used when at specified depth in bathing waters
EA,23/03/2016,GLOBAL TELESAT COMMUNI,516.6,Six satellite phone cases and six phone chargers
EA,23/03/2016,GOUGH & KELLY,2846.4,160 hours of uniformed guarding services for deployment at Foss Barrier during the Winter floods 2015-16
EA,23/03/2016,GUOMAN TOWER HOTEL,722.8,Accommodation for one person for five nights whilst attending a foundation certificate in business change training course in London
EA,23/03/2016,H BOWERS LIMITED,524.28,Ten flood beam work lamps for use in vehicles
EA,23/03/2016,Hilti (Gt. Britain) Lt,898.79,Impact gun kit and a combi drill kit to be kept at Clyst Honiton depot.
EA,23/03/2016,HYDROKIT,559.6,Water level measuring field use kit
EA,23/03/2016,INDUSTRIAL ENG SPPLS L,720,Layflat hose for pumps
EA,23/03/2016,KENWICK PARK HOTEL,1216,"Two days room hire for eight people, including lunch, refreshments, evening meal and overnight accommodation, for a Lincolnshire operations leadership team meeting."
EA,23/03/2016,LONGHAM GARDEN MAC,771.21,"Service and repairs  for small plant such as chainsaws, strimmers and pole saws."
EA,23/03/2016,MASSON SEELEY & CO,3666,Eight site safety signs with all safety rules for site for High Eske bank scheme to reinstate some flood banks 
EA,23/03/2016,MORGAN MARINE LTD,502.8,Small instrument kiosk for Twyford gauging station
EA,23/03/2016,OAKLEIGH MANOR LTD,4218,Planting of borders at the South Bank nThames barrier to reduce flood risk 
EA,23/03/2016,OAKLEIGH MANOR LTD,4218,Planting of hardy trees on the raised banks at the Thames Barrier to reduce flood risk 
EA,23/03/2016,R SLEEP LTD.,685.6,"Chainsaw bars and chain, trailer plugs, and repairs to saw and water pump for field services West team area"
EA,23/03/2016,RICHARD ALLITT ASSOCIA,1186.93,Survey of the River Ingrebourne carried out by an unmanned aerial vehicle.
EA,23/03/2016,ROBBINS LTD,547.2,Thirty sheets of 18MM oriented strand board to be used as tracking mats on various field services projects in South Devon.
EA,23/03/2016,SILVERTON AGGREGATES,2344.67,97.94 tonnes of limestone granite used to top off the sea wall level at Langenhoe Hall.
EA,23/03/2016,SILVERTON AGGREGATES,1621.8,159 tonnes of crushed hardcore used to fill low ways on the top of the ea defence at Hythe Marsh.
EA,23/03/2016,STAFFORDSHIRE UNI,1590.05,"Final payment for the development of river pollution diagnostic system, a piece of software that allows the diagnosis of morphological impacts on river biology."
EA,23/03/2016,T H WIGGANS IRONMONGER,567.37,Ten brass padlocks for securing flood defence gates and man hole covers on a new flood defence scheme at Appleby
EA,23/03/2016,TECHNIQUE PROJECTS,1800,Temporary staff cost
EA,23/03/2016,TECHNIQUE PROJECTS,1800,Temporary staff cost
EA,23/03/2016,TECHNIQUE PROJECTS,1440,Temporary staff cost
EA,23/03/2016,TECHNIQUE PROJECTS,1440,Temporary staff cost
EA,23/03/2016,TECHNOLOG LTD,961.2,Replacement groundwater monitoring logger
EA,23/03/2016,THE WISHINGWELL,2947.5,Accommodation for members of staff providing mutual aid during winter floods 2015-16
EA,23/03/2016,TRAVIS PERKINS,516,Ducting and inspection chambers for new electric cable being installed at Draycott Depot
EA,23/03/2016,WALTER BAILEY (PAR)LTD,1095.84,288 metres timber and twenty timber posts for use on Yealmpton Bank Repair Scheme
EA,23/03/2016,WALTER BAILEY (PAR)LTD,840,Five hundred filled sandbags for use on flood incident response work
EA,23/03/2016,WORK PLACE,556.8,"Half day room hire for 22 people, including lunch, refreshments and equipment, for an EU funded life integrated water framewrork project meeting "
EA,23/03/2016,WWW.ACTIVATEEVENTS.COM,504,Registration fee for one person to attend the flood and coastal conference in Telford.
EA,23/03/2016,WWW.ADEYELECTRONICS.CO,628.2,Two digital radio modems for telemetry upgrade at Twyford gauging station.
EA,23/03/2016,WWW.ARCO.CO.UK,3081.6,Two MSA 4X Altair gas detectors and six MSa GX2 base stations and ancillary equipment for calibrating gas detectors.
EA,23/03/2016,WWW.CIMAGLOBAL/BPP,646.8,"One day training course for one person, including lunch and course materials, entitled 'The accountant as strategic influencer and advisor'."
EA,23/03/2016,WWW.CIMAGLOBAL/BPP,646.8,One person attending a one day training course for Chartered Institute of Management Accountants in London including lunch
EA,23/03/2016,WWW.PRACADEMY.CO.U,1925,Six month online diploma for one person in communications during emergencies.
EA,23/03/2016,XMA LTD,521.44,Sixteen printer cartridges for use at various depots.
EA,23/03/2016,XYLEM WATER SOLUTIONS,547.2,Mechanical repairs to St John's Lock site sewage pump.
EA,23/03/2016,ZIPPI LTD,503.92,Eight canvases for use during Chairman's visit and then to be used for highlighting and promotion of incident response work.
EA,24/03/2016,ACLAND PLANT HIRE LTD,1056,"Three day hire of HIAB lorry to transport of small plant between sites at Bodmin, Millbrook and Par and to move pump hoses from Tolgus Depot to Hayle."
EA,24/03/2016,ACLAND PLANT HIRE LTD,708,One day hire of a HIAB lorry to delivery sandbags to Portreath during flooding incident response.
EA,24/03/2016,ACTION FOR BLIND P,845.4,"One day room hire for 22 people, including lunch and refreshments, for an operations finance business partners team meeting."
EA,24/03/2016,ACTION FOR BLIND P,616,"One day room hire with, data projector, screen and flipchart, with refreshments and lunch for 19 attendees for a National Ecology Group meeting "
EA,24/03/2016,ADUR DISTRICT COUNCIL,896.22,Expert witness from East Worthing Council's Environmental Heath Department giving evidence at a trial for pollution incident at East Worthing sewage treatment works 
EA,24/03/2016,ARKTIS LTD,752.4,One non badged jacket and two sets of waterproof lined enforcement pants for one person
EA,24/03/2016,CALOR GAS ACCOUNT PAYM,571.58,Heating gas and fuel for Tonbridge site
EA,24/03/2016,CURRYS,524.79,48 SD cards required to download video footage for court action 
EA,24/03/2016,DESURVEY PLC,1838.14,Temporary staff cost
EA,24/03/2016,DESURVEY PLC,889.75,Temporary staff cost
EA,24/03/2016,DMA SIGNS LIMITED,1000.08,Six road closed signs for flood gate and four magnetic signs warning of closed flood gate for Wells on sea emergency floodgate closures
EA,24/03/2016,EEF LTD,510,"One day room hire for eleven people, including lunch, refreshments and equipment, for a business management team meeting in London."
EA,24/03/2016,EFE & GB Nets,597.65,"Eight kick sample net holders with pole, eight sampling nets and 14 net covers for collecting macroinvertebrate samples "
EA,24/03/2016,ELECTRO FISHING SERVIC,549.2,Quarterly testing and servicing of the Kent and south London electric fishing equipment needed for use on fish surveys and to aid fish recues
EA,24/03/2016,FLOOD PS WATERGATE 2,2218.73,"Temporary flood barrier for Lacy Avenue, Walsden."
EA,24/03/2016,FRIENDS HOUSE,788.6,"One day room hire for twenty people, including lunch and refreshments, for an employee networks leadership meeting in London."
EA,24/03/2016,HALCROW GROUP LIMI,1935,Annual update to a flood modelling license.
EA,24/03/2016,HONEY BROTHERS LTD,766.51,"Chainsaw safety equipment, including three first aid kit, three pairs gloves, three multi-tools, two combi-gauges, three tool clips, two pairs braces, two hatchets, and two pairs flex trousers."
EA,24/03/2016,INSTITUTION OF CHEMICA,1782,Three day course with refreshments and materials for one person on an external course for scientists to gain a basic understanding of engineering
EA,24/03/2016,JEWSON,4320,One hundred timber posts for operational use at Ely Depot
EA,24/03/2016,JURYS INN,2145,"Two day room hire for 25 people on day one and forty people on day two, including lunch, refreshments and equipment hire, for a national catchment engineer meeting and workshop."
EA,24/03/2016,K INTERNATIONAL PLC,723.6,Translation of evidence from Swedish to English as part of Operation Chromite.
EA,24/03/2016,M & A BROWN ENGRAV,780,Five hundred EA standard Blue ID trailer plates for new fleet assets.
EA,24/03/2016,MASSON SEELEY & CO,556.74,Large public safety sign for bridge crossing River Medway 
EA,24/03/2016,NORTH LAKES HOTEL,1100,Accommodation for staff providing mutual aid during winter floods 2015-16
EA,24/03/2016,NORTH LINDSEY COLLEGE,3000,Tuition fees for third year of electrical installation course.
EA,24/03/2016,STREAMLINE MEASUREMENT,3318,Three glass reinforced plastic kiosks for new rain gauge sites to house telemetry outstations
EA,24/03/2016,SURPLUS & OUTDOORS,3000,Three hundred steel army ammunition boxes for pump accessory storage for National Pumps Bradney Depot
EA,24/03/2016,WWW.BBOFFICESUPPLIES.C,625.2,Ergonomic chair for member of staff with health problems following workplace assessment.
EA,24/03/2016,WWW.ISLEOFSCILLY-TRAVE,601.95,Two return flights for meetings with the Council of the Isles of Scilly and other risk management partners and the emergency responder community on the islands
EA,24/03/2016,WWW.OFFICEFURNITUREONL,528,Electric projector screen for Bridgwater office
EA,24/03/2016,WWW.THOMASTELFORD.ORG.,3288,One day Instituted of Chartered Engineers training course for eight people entitled 'Reinforced concrete design for Eurocodes'
EA,24/03/2016,WWW.WILMINGTON.CO.,780,Annual renewal of Central Law Training membership for national legal team.
EA,29/03/2016,ACORN ENGINEERING,1681.68,Steel tube clamping for essential health and safety repairs to existing debris screens within the Irwell catchment
EA,29/03/2016,ACTION FOR BLIND P,1067.4,"One day room hire for 37 people, including lunch, refreshments and equipment, for a finance business partner meeting."
EA,29/03/2016,ANNA GLOBAL,530,Two rangefinders for use by Norfolk and Essex based electrofishing teams when recording fish habitat
EA,29/03/2016,AQUACULTURE EQUIPMENT,1857.3,Aeration equipment for emergency work following fish kills
EA,29/03/2016,AQUATIC CONTROL ENG LT,600,Photovoltaic cell cabling guards for weir access and repositioning of outlet pipe to improve attraction flow as part of Judas Gap national eel monitoring site works
EA,29/03/2016,ARCO LTD,689.04,Four 3m hoses for six inch pumps 
EA,29/03/2016,AVS FENCING SUPPLIES,2799.6,"Fifty fencing posts and 300 rails around the boundary at Southease yard, Lewes"
EA,29/03/2016,BACA SAFETY & WORKWEAR,720,1000 sand bags to form concrete head wall for pipe overflow at Faxton Brook
EA,29/03/2016,BANNER BUSINESS SERVIC,760.61,"Various items of stationery including pens, pencils, folders and paper etc for Richard Fairclough House"
EA,29/03/2016,BANNER BUSINESS SERVIC,595.18,"Various items of stationery including pens, pencils, folders and paper etc for Richard Fairclough House"
EA,29/03/2016,BANNER BUSINESS SERVIC,795.58,Replenishment of various stationary items for the Solihull office.
EA,29/03/2016,BOC GASES,1516.92,Annual oxygen bottle rental for transportation of fish
EA,29/03/2016,CONFERENCE ASTON LTD,2508,One day room hire for 55 people in Birmingham including lunch for Working with Others Engagement Day
EA,29/03/2016,CUPBOARDS DIRECT L,1686.6,Six 2-door lockers and three sets of canteen seating to be used in the mess room at Sunbury depot.
EA,29/03/2016,DARCY PRODUCTS LTD,3273.1,Service and maintenance of four EA pumps for flooding incident response.
EA,29/03/2016,DENIOS LTD,896.4,"Chemical store for storing methanol at Rivers House, Kelvedon"
EA,29/03/2016,DESURVEY PLC,1211.69,Temporary staff cost
EA,29/03/2016,DESURVEY PLC,924.6,Temporary staff cost
EA,29/03/2016,DESURVEY PLC,685.4,Temporary staff cost
EA,29/03/2016,DESURVEY PLC,610.84,Temporary staff cost
EA,29/03/2016,DHS TOOL SUPPLY CO LTD,510.8,Ten Yale 770 brass padlocks to be used on EA assets.
EA,29/03/2016,DHS TOOL SUPPLY CO LTD,601.34,Ten spare silky saw 390mm blades and three long handled paint stripping blades for Osney stores.
EA,29/03/2016,DMA SIGNS LIMITED,1128.22,Nineteen signs for fence and wall mounting at fish passes as part of public health and safety.
EA,29/03/2016,DORMAR PRODUCTS,1338.36,Weed rakes and attachments for vehicles for clearing screens in flood situations
EA,29/03/2016,DORMAR PRODUCTS,1256.16,Weed rakes and attachments for vehicles for clearing screens in flood situations
EA,29/03/2016,DORMAR PRODUCTS,593.1,Collapsible weed rake for vehicle for response work
EA,29/03/2016,EGBERT H TAYLOR & CO L,2272.32,"Two 1,100 litre containers and four 1,280 litre containers for storage of fishing survey nets."
EA,29/03/2016,ELECTRAFISH LIMITE,540,Quarterly testing of electric fishing equipment at Ladymead.
EA,29/03/2016,F G ADAMSON SON,523.2,Husqvarna pole hedge cutter for use during incident response
EA,29/03/2016,FARNELL INTERNET,570.38,200m of signal and instrument cable for Corsham Screen telemetry installation.
EA,29/03/2016,FORESTRY COMMISSION,610.56,Temporary staff cost
EA,29/03/2016,G CROOK AND SONS,1152,Six loads of muck away from maintenance works for flood defence system in Dorset
EA,29/03/2016,G CROOK AND SONS,1152,Six loads of muck away from maintenance works for flood defence system in Dorset
EA,29/03/2016,G CROOK AND SONS,1152,Six loads of muck away from maintenance works for flood defence system in Dorset
EA,29/03/2016,G CROOK AND SONS,1071,"Fifteen hours hire of a twenty tonne tipper lorry with driver for day work at coach park, Bridport"
EA,29/03/2016,G CROOK AND SONS,960,Five loads of muck away from maintenance works for flood defence system in Dorset
EA,29/03/2016,G CROOK AND SONS,960,Five loads of muck away from maintenance works for flood defence system in Dorset
EA,29/03/2016,G CROOK AND SONS,862.53,36.9 tonnes of screened topsoil for maintenance works on the flood defence system in Dorset.
EA,29/03/2016,G CROOK AND SONS,847.08,36.2 tonnes of screened topsoil for maintenance works on the flood defence system in Dorset.
EA,29/03/2016,G CROOK AND SONS,719.69,49 tonnes of muck away from maintenance works for flood defence system in Dorset
EA,29/03/2016,G CROOK AND SONS,566.1,"Eight hours hire of a twenty tonne tipper lorry with driver for day work at coach park, Bridport"
EA,29/03/2016,GILES RAYMOND AGRICULT,687.96,"Fabricate a 1,000mm x 2,000mm x 6mm steel plate, and brackets to take timbers as part of maintenance work on the flood defence system in Dorset."
EA,29/03/2016,GILES RAYMOND AGRICULT,1311.63,"Replace timber grid supports, fabricate and fit hedgehog ramp, tread plate, and galvanizing for maintenance works for flood defence system in Dorset"
EA,29/03/2016,GILES RAYMOND AGRICULT,962.04,Shot blasting and repainting for piles as part of maintenance work on flood defence system in Dorset.
EA,29/03/2016,HAMMOND DRYSUITS,918,"Replacement heavy duty, industrial dry suit and thermal undersuit layer"
EA,29/03/2016,Hilti (Gt. Britain) Lt,1720.84,"Slitting machine kit, used for cutting channels into stone or concrete, to be kept at Clyst Honiton Depot and used on various sites throughout Devon and Cornwall."
EA,29/03/2016,Hilti (Gt. Britain) Lt,504,Cordless circular saw axe for field team use
EA,29/03/2016,HOLIDAY INN BRISTO,1540,Accommodation for seven people for two nights whilst studying for a rivers and coastal erosion foundation degree and the University of West England.
EA,29/03/2016,HOLIDAY INN BRISTO,750,Accommodation for seven people for two nights whilst studying for a Graduate Diploma and the University of West England.
EA,29/03/2016,HOSES DIRECT LTD,2383.74,Five 8 inch pipe fittings and 'O' ring seals for 8 inch pump stored at Clyst Honiton Depot to be used when required nationally.
EA,29/03/2016,JEWSON LTD,641.52,36 pieces of timber for fence repairs in Hempholme
EA,29/03/2016,JEWSON LTD,1474.8,Overhead power cable goal posts to ensure safe working on site.
EA,29/03/2016,LEEDS BECKETT UNIVERSI,1027.5,One day room hire for 50 people including lunch and refreshments in Leeds for Yorkshire Flood and Coastal Committee meeting
EA,29/03/2016,MAG KITCHENS&BATHROOMS,534,Flap valve replacement Barmston Drain
EA,29/03/2016,MAN TRUCK & BUS UK,705,First road fund licence for new eighteen tonne lorry based at Osney Yard.
EA,29/03/2016,MARWOOD GROUP LTD,859.32,Fourteen 1200mm x 700mm pedestrian walkway matting to provide safe temporary footpath to properties affected by a temporary flood defence installed as part of the post flood recovery work.
EA,29/03/2016,MORTONS MEDIA GROUP LT,2001.6,Six monthly adverts in the Towpath Talk publication to advertise Northampton Marina to maximise its income.
EA,29/03/2016,NORTH LAKES HOTEL,609,Accommodation for one person for seven nights whilst providing mutual aid during winter floods 2015-16
EA,29/03/2016,NORTH LAKES HOTEL,517.25,Accommodation for one person for four nights whilst providing mutual aid during winter floods 2015-16
EA,29/03/2016,PAYPAL  PIXC LTD,1072.56,Three Clarius Infra-Red Illuminators with power supplies and brackets to be used with webcams at operational sites as part of the Carbon Reduction Program in the  Wessex area.
EA,29/03/2016,RACOLIN LTD,2148,Repairs to residents ramp at Sunbury Depot to avoid an incident and risk of injury to public
EA,29/03/2016,READING MUSEUM,864,One day room hire for 20 people with lunch and refreshments for Thames River Basin District Liaison Panel meeting
EA,29/03/2016,RS COMPONENTS,948.91,Two Insys EBW-H100 cellular routers for transmission of webcam images at Avon Mill and Avon Weir Gates for remote asset condition monitoring.
EA,29/03/2016,RS COMPONENTS,508.88,346 small batteries for use in telemetry outstations and flow measuring equipment in the Wessex Area.
EA,29/03/2016,SAFETY-KLEEN UK LTD,1278.24,Disposal of used oil booms
EA,29/03/2016,SERVERPARTS.CO.UK,2880,New physical server for Lateral House telemetry
EA,29/03/2016,TECHNIQUE PROJECTS,1800,Temporary staff cost
EA,29/03/2016,TECHNIQUE PROJECTS,1800,Temporary staff cost
EA,29/03/2016,TECHNIQUE PROJECTS,1440,Temporary staff cost
EA,29/03/2016,THE LGV TRAINING CO LT,2800.92,Large goods vehicle training course for one person
EA,29/03/2016,TNT UK LTD,619.96,Courier fees to transport iPads to various EA locations as part of the National iPad Project
EA,29/03/2016,VAN WALT AGRICULTURAL,4136.7,"Two groundwater dippers, one 150m and one 100 m, for spares and replacements for Worthing and Pevensey office workshops."
EA,29/03/2016,W CLIFFORD WATTS LTD,1057.68,100 tonnes of limestone for the high Eske bank reinstatement scheme to reinforce the bank side to stop the river eroding the banks 
EA,29/03/2016,WESTERN POWER DISTRIBU,783.28,Installation charge for new power supply at Porlock telemetry flood warning site.
EA,29/03/2016,WG/FSB DIRECT,1394.97,Three pumps for Beeleigh and Judas Gap elver monitoring sites
EA,29/03/2016,WORLD OF TRAVEL,678.24,"One day room hire for eighteen people, including lunch, refreshments and equipment, for a flood and coastal risk management strategy and investment team meeting in London."
EA,29/03/2016,WORLD OF TRAVEL,581.62,"One day room hire for fourteen people, including lunch and refreshments, for a waste stream assessment meeting."
EA,29/03/2016,WORLD OF TRAVEL,694.03,"One day room hire for twenty people, including lunch, refreshments and equipment, for a strategic flood and coastal risk management meeting."
EA,29/03/2016,WWW.ACCOUNTS@IIA.ORG.U,930,One day Internal Audit Training Course run by the Institute of Internal Auditors in London including lunch and course materials 
EA,29/03/2016,WWW.ACTIVATEEVENTS.COM,504,Three day’s attendance at the 2016 FCRM conference for one person
EA,29/03/2016,WWW.ACTIVATEEVENTS.COM,584,Registration fee for one person to attend the three day flood and coast conference.
EA,29/03/2016,WWW.ARCO.CO.UK,3099.66,Specialist breathing equipment to protect operatives when working in a hazardous areas where the atmosphere may not support life.
EA,29/03/2016,WWW.CERTASENERGY.C,3557.05,Seven thousand litres of red diesel for plant use at Short Ferry depot.
EA,29/03/2016,WWW.FUCHSLUBRICANTS.CO,1274.17,"Forty litres screen wash, two hundred litres of universal engine oil and 150 kilograms of water-resistant grease for use in pumping stations around Bradney Depot"
EA,29/03/2016,WWW.FUCHSLUBRICANTS.CO,735.12,Four hundred litres of universal engine oil for use in pumping stations around Bradney Depot
EA,29/03/2016,WWW.NEOPOST.CO.UK,1030,Top up for franking machine at Richard Fairclough House.
EA,29/03/2016,WWW.NWSYSTEMSGROUP,4291.2,"Two Axis P5635-E PTZ Webcams for use at telemetry sites for monitoring of river level and asset condition, and three Axis P7214 video encoders for monitoring river levels at flow gauges in the Bristol area."
EA,29/03/2016,WWW.ONLINESTORE.LEEDSM,760,One day training course for two people on graphic design software for internal communications and digital media platforms as part of the governments drive to make communications ‘digital by default’..
EA,29/03/2016,WWW.TATEFREIGHTFORMS.C,768,Two days training course for two people on documentation and customs procedures and completion of dangerous goods notes.
EA,29/03/2016,YARROWS AGGREGATES LIM,1043.22,150 tonnes of  stone was purchased for tophilllow flood elevation scheme to create a hard standing for machines next to a weir.
EA,30/03/2016,ACLE GARDEN MACHIN,605.26,Replacement Stihl pole saw for Haddiscoe.
EA,30/03/2016,ACTION FOR BLIND P,845.4,"Meeting room hire for 30 delegates with tea, coffee and lunch for a service improvement workshop"
EA,30/03/2016,ADT LOUGHTON CC,1307.76,"Annual rent, maintenance and repairs for fire alarm system at West Stockwith pump station."
EA,30/03/2016,BANNER BUSINESS SERVIC,1179.78,"Various items of stationery including recycled paper, notebooks, pens and 250 deed wallets for use of legal department"
EA,30/03/2016,BARNSLEY LOCK/SAFE,676.8,Twelve padlocks and keys for secure access gates on agency owned land
EA,30/03/2016,BIRMINGHAM REP ENTERPR,1200,"One day room hire for forty people, including lunch and refreshments, for an environmental waste team meeting."
EA,30/03/2016,BVSC ENTERPRISE LIMITE,516,"One day room hire for 24 people, including lunch and refreshments, for an operations communications leadership team meeting."
EA,30/03/2016,CARDIFF UNIVERSITY,3600,EA contribution to partnership research project with Cardiff University on Saprolegnia infections in wild and farmed fish
EA,30/03/2016,CREWSAVER,2280,Twenty replacement lifejackets for Operations team members in Shropshire
EA,30/03/2016,ELECTRO FISHING SERVIC,999.6,Quarterly servicing of electric fishing equipment
EA,30/03/2016,EMS CONSOLIDATED LTD,1292.69,Cutters and pressure arms for maintenance on weedcutting baskets used for clearing weed from the rivers
EA,30/03/2016,ENTERPRISE,603.53,One month's vehicle hire for use in Cumbria during winter floods 2015-16
EA,30/03/2016,FLOOD PS WATERGATE,3672.53,Temporary flood barrier for Lacy Avenue Walsden
EA,30/03/2016,FRIENDS HOUSE,864,"One day room hire for sixteen people, including lunch, refreshments and equipment, for a modelling and forecasting meeting on improving leadership and performance."
EA,30/03/2016,G4S SECURE SOLS,684,100 programmable plastic cards for staff to gain entry to Guildbourne House
EA,30/03/2016,IBIS BIRMINGHAM NEW ST,550,Accommodation for ten people for one night whilst attending a face to face programming meeting.
