Entity,GL Date,Merchant name,Amount,Description
EA,03/03/2016,WORLD OF TRAVEL,858.18,"One day room hire for 24 people, including lunch, refreshments and equipment, for a national capital programme management service business team meeting in London."
EA,03/03/2016,WWW.FIRSTFENCE.NET,522.96,Twelve 2m pedestrian safety barriers for fisheries incident management
EA,04/03/2016,ADLER & ALLAN LTD,2767.2,Disposal of used absorbents used to clean up oil spills.
EA,04/03/2016,CLAD SAFETY,828.12,Ten pairs of Gore-Tex boots for the Gloucester field services team.
EA,04/03/2016,CREWSAVER,522.29,Four Ergofit offshore lifejackets and rearm packs for Gloucester field services team
EA,04/03/2016,CSG Ltd Waste Serv,696,Tanker to clean and empty interceptor tank located within wash-down bay at Chichester Depot
EA,04/03/2016,ELECTRAFISH LIMITE,588,"Quarterly servicing of electric fishing equipment at Rivers House, Blandford"
EA,04/03/2016,ELECTRO FISHING SERVIC,830.1,Quarterly servicing of electric fishing equipment.
EA,04/03/2016,ELECTRO FISHING SERVIC,546,Quarterly servicing of electric fishing equipment used on fish population surveys
EA,04/03/2016,ELECTRO FISHING SERVIC,541.8,Quarterly servicing of electric fishing equipment used on fish population surveys
EA,04/03/2016,ERMINE ENGINEERING COM,2277.6,Stoplog for Louth Tilting gate
EA,04/03/2016,FIBRELITE,1086,"Two lightweight manhole covers and associated fixings to replace broken, unsuitable ones covering two groundwater monitoring boreholes at Tyneside House, Newcastle"
EA,04/03/2016,GUILDBOURNE PRINTING S,555.6,Three part driver hours books in accordance with O licence lorry regulations to ensure driver compliance and transparency of agreed rest periods
EA,04/03/2016,HAWKSMERE LTD,1614,Cost for five professional training courses with the Royal Town Planning Institute to be used over the next year.
EA,04/03/2016,HEMSLEY FRASER GROUP L,682.8,One day training course for one person on writing with clarity and purpose
EA,04/03/2016,HIPPODROME LTD,1102,"One day hire of two rooms for 26 people, including lunch and refreshments, for a quarterly meeting of the national health, safety and wellbeing action group."
EA,04/03/2016,M K SCALES LTD,660,Two scales purchased for waste weighing at Depots.
EA,04/03/2016,PEGASUS MECHANICAL,542.78,"Lifting gear equipment consists of strops in various lengths, pulley blocks and bow shackles with the necessary test conformity notes"
EA,04/03/2016,ROBERTS WASTE DISPOSAL,549.6,Skip hire for Bradney Depot waste electrical and electronic equipment
EA,04/03/2016,ROGER YOUNG JAGUAR SAL,3510,39 tail gate damper kits for new Isuzu D-Max badged vehicles as a health and safety requirement.
EA,04/03/2016,ROGER YOUNG JAGUAR SAL,2788.8,Fourteen rolls of fluorescent tape for chevrons to be applied to the rear of new Isuzu D-Max vehicles.
EA,04/03/2016,ROGER YOUNG JAGUAR SAL,2550,Remove and replace decals for 25 vehicles.
EA,04/03/2016,SEALS + DIRECT LTD,1131.6,104 metres of new seals for band screens at Short Ferry pumping station
EA,04/03/2016,SERVERPARTS.CO.UK,1392,"Four 240GB Serial ATA disks to upgrade the disk space of the new telemetry server at Quadrant, Sheffield"
EA,04/03/2016,SGUK LTD,3128.87,Overnight security to ensure safety of plant and equipment on site at the River Trent
EA,04/03/2016,WWW.CHESTER.AC.UK,550,Two days training course for one person on flood modelling.
EA,07/03/2016,A A ELECTRICAL WHOLESA,870,200 fluorescent tubes and ten ballasts/control gears for use in lamps at the EA office in Sheffield
EA,07/03/2016,A.1. ROPES & RIGG,514.01,Three safety harnesses for working on trash screens
EA,07/03/2016,ALLENS WASTE DISPOSAL,1253.04,Removal and replacement of skips at Altmouth pumping station for the automatic weedscreen cleaner.
EA,07/03/2016,ALLENS WASTE DISPOSAL,1015.44,Removal and replacement of skips at Fine Jane depot for routine maintenance debris collected from watercourses.
EA,07/03/2016,AQUARIUS X1 LTD,900,Annual servicing of the Thames Barrier water coolers.
EA,07/03/2016,ASSA ABLOY ENT SYS LTD,640.8,Survey and repairs of automatic doors on level 2 of the Thames Barrier
EA,07/03/2016,BOOLES TOOLS&PIPE FTTN,560.52,Steel to be put around a Hydrometric station to prevent public entering the grounds for health and safety
EA,07/03/2016,BTS GROUP LIMITED,2500,"Three visits to carry out grounds maintenance at Waterside House, Lincoln in July"
EA,07/03/2016,BTS GROUP LIMITED,1800,"Two visits to carry out grounds maintenance at Waterside House, Lincoln in September"
EA,07/03/2016,BTS GROUP LIMITED,1800,"Two visits to carry out grounds maintenance at Waterside House, Lincoln in August"
EA,07/03/2016,CAMPBELL ASSOCIATE,1876.8,"Calibration of Beverley, York and Leeds hand held sound level meter and replacement of Leeds dehumidifier"
EA,07/03/2016,CAMPBELL ASSOCIATE,1876.8,Calibration of seven noise monitoring equipment.
EA,07/03/2016,CARE SIGNS,1980,Replacement eight metre by six metre welcome sign at Camber harbour entrance
EA,07/03/2016,CIVIL SERVICE,875,"One day room hire for 25 people, including lunch and refreshments, for a Defra fleet services launch seminar."
EA,07/03/2016,CIVIL SERVICE COLLEGE,1440,Payment to external facilitator to take an 'effective minute taking' course for fourteen people at an EA office.
EA,07/03/2016,CLAD SAFETY,1915.56,34 pairs of wellington boots for operations team members.
EA,07/03/2016,CRAVEN & NICHOLAS,610,Eight pieces of 5mm thick plate of various sizes with 12mm holes for fixing to concrete required to block openings on two pill boxes to reduce biohazards.
EA,07/03/2016,DORMAR PRODUCTS,1458,"Three lengths of 2 metres rubberised steps 6 metres in total, used for accessing ultrasonic ramps located in the river for health and safety issues because of steepness of the river bank"
EA,07/03/2016,DOTTED EYES LTD,3216,Annual renewal of Feature Manipulation Engine software used as part of geographic information system (GIS).
EA,07/03/2016,ELECTRAFISH LIMITE,600,Quarterly service of electric fishing equipment at Osney Depot.
EA,07/03/2016,ERIKS IND SERVICES,2022.16,Repairs to guide rails in sump pits at the Thames Barrier
EA,07/03/2016,ERIKS IND SERVICES,711.84,Isolation lock removals from panels for sump pumps at the Thames Barrier
EA,07/03/2016,HAHN PLASTICS LTD,2584.56,21 plastic baffles for Izaak Walton fish passes project
EA,07/03/2016,HEWARD & DEAN (BD) LTD,800.8,"Three screw boxes, nuts, bolts, washers, self tappers for current sign fitting, metal protection spray paints, 24 cans de-icer, 49 bags of rock salt, and a three inch vice with soft jaws for chainsaw sharpening."
EA,07/03/2016,HIRE STATION-LTD,2754,Two underground cable and service identification tools for health and safety before breaking ground.
EA,07/03/2016,HOLIDAY INN READIN,604.41,Two nights DB&B for three people attending Analyser service training at Transport Research Laboratory.
EA,07/03/2016,HOLIDAY INNS,1067,Four night accommodation for three people in Solihull whilst on a week long Intelligence Officers course
EA,07/03/2016,JACTONE PRODUCTS LTD,667.68,Eighty various public safety signs across monitoring sites in the West Midlands
EA,07/03/2016,JURYS INN CROYDON,1840,Accommodation for 23 people for one night whilst attending a flood resilience event in Croydon
EA,07/03/2016,JURYS INN CROYDON,1494.8,"One day room hire with lunch, refreshments, equipment hire and evening meal for 28 people for Resilience Team network conference"
EA,07/03/2016,LEE GARTH TOOLS LT,1011.7,"One hammer drill, one impact driver, one handle grinder and socket set to carry out day to day work duties "
EA,07/03/2016,LEICA GEOSYSTEMS LIMIT,1512,Annual SmartNet subscription for GPS levelling equipment.
EA,07/03/2016,MARTIN DAWES OFFIC,977.16,Ten headsets for staff to use as part of new digital phone system.
EA,07/03/2016,MILLENNIUM BAILEYS,519.96,Accommodation for one person for four nights in London during winter flooding event 2015-16
EA,07/03/2016,NPL NEW PIG LTD,629.7,Ten boxes of absorbent matting required for oil spillages and water ingress at the Thames Barrier
EA,07/03/2016,P R ENGINEERING LT,648,Two surveying laser range finders for use when gauging and surveying.
EA,07/03/2016,PROFIX FABRICATIONS LT,1752,Bespoke stainless steel elver trap for use at Market Weighton Lock
EA,07/03/2016,R SLEEP LTD.,4284,Six LED floodlights for incident response work for Tolgus and Wadebridge Depots
EA,07/03/2016,RAWLINS T/A MATS4U,2292,Shelving and racking for use at Leewick Yard
EA,07/03/2016,RENOVOTEC LTD,702.72,Annual maintenance of label printing equipment at the EA office in Sheffield
EA,07/03/2016,ROGER YOUNG JAGUAR SAL,3864,Safety tailgate for vehicle requiring to comply with health and safety needs and side runners for working at height regulations
EA,07/03/2016,SCANPROBE TECHNIQUES,2500,Hire of crawler camera for twelve days to survey five culverted water systems in the Thames area
EA,07/03/2016,SIG,2361.06,Sixty bags of mono mix for concrete wall repair on two flood walls in Great Yarmouth harbour.
EA,07/03/2016,SOLIHULL COLLEGE,1965.9,"Five days room hire for seventeen people, including lunch and refreshments, for a College of Policing training course for members of the national intelligence team."
EA,07/03/2016,SURVITEC EDINBURGH,843.79,"Servicing of 35 life jackets from Staffordshire, Warwickshire and West Midlands"
EA,07/03/2016,TECHNOLOG LTD,1530.49,"Six data loggers for repair and airtime renewal for recording water levels, rainfall data or groundwater levels"
EA,07/03/2016,THE BATTERY CENTRE,1080,Twenty 24Ahr batteries for site kiosks.
EA,07/03/2016,TW SERVICES,1069.2,Removal of waste from the Stour catchments taken to Thanet waste for recycling
EA,07/03/2016,VUE NCS CITB HS&E TEST,1470,"Two days rental of mobile van to test 49 people on Health, safety and environment test for construction skills course"
EA,07/03/2016,WORLD OF TRAVEL,2298.45,One day room hire for 70 people in London including lunch for organisation the Kent and South London leadership day
EA,07/03/2016,WP-HR WALLINGFORD,720,Two days River hydrology and hydraulics course for one person including lunch and dinner on first day
EA,07/03/2016,WWW.ACTIVATEEVENTS.COM,584,Registration fee for one person to attend three day flood and coastal conference.
EA,07/03/2016,WWW.ARCO.CO.UK,1131.46,"Eight tubs of hand wipes, four packs of eighteen paper rolls, twelve boot laces, fifteen work long boot socks, forty short boot socks, 36 pairs Hyd tuff gloves,36 pairs comfort gloves, and forty pairs Skytec coated gloves for Osney stores."
EA,07/03/2016,WWW.CIPS.ORG,648,Distance learning diploma in procurement and supply for one person.
EA,07/03/2016,WWW.GELDERLTD.CO.UK,1423,"Fixed wire electrical testing at Marsh Lane, Boston"
EA,07/03/2016,WWW.IOA.ORG.UK,1930,Part payment for one person to gain a diploma in acoustics and noise control for regulation purposes.
EA,07/03/2016,WWW.REACTEC.COM,1558.8,Hand arm vibration meter and base station to monitor vibration levels.
EA,07/03/2016,XYLEM ANALYTICS UK LTD,1202.4,"Ten packs of dissolved oxygen membrane caps for water quality meters, two pH probes for water quality meters, and two bottles of ammonium calibration solution for calibrating water quality equipment"
EA,08/03/2016,ACORN ENGINEERING,3511.92,Steel toddler proof mesh panels and fixings for the River Irwell telemetry stations at Bury
EA,08/03/2016,ALPHA ELECTRONICS (SOU,1308,One day training course for fourteen people on portable appliance testing.
EA,08/03/2016,ANGEL SPRINGS LTD,789.12,Annual rental and servicing of a mains fed water cooler for Owston Ferry Depot
EA,08/03/2016,AQUATIC CONTROL ENG LT,710.4,Wall mounted flood gate and T key for use on site on the Par River system
EA,08/03/2016,ARCHWAY LAWNMOWERS,3409.15,Lawn mower and equipment servicing for four locks sites from Shepperton to Teddington
EA,08/03/2016,ASHRIDGE TREES LTD,806.7,Trees planted as part mitigation for earthworks undertaken in South Yorkshire in 2015
EA,08/03/2016,BIRMINGHAM REP ENTERPR,540,One day room hire for twelve people to conclude the negotiations for the 2015 pay award
EA,08/03/2016,BRITISH GAS BUSINE,1174.99,Electricity for the period 8th June to 7th September 2015 at a temporary rented unit.
EA,08/03/2016,BURDENS,737.76,Fifteen galvanised brickforce wall tie ladders for use on Launceston and Tolgus new shed schemes
EA,08/03/2016,BURDENS,1107.58,32 boxes of assorted safety wall ties fittings for use on Launceston and Tolgus new shed schemes
EA,08/03/2016,BURLINGTON UNIFORMS LT,574.08,Seventeen pairs of work trousers for use by North Cumbria field teams during outdoor work.
EA,08/03/2016,CENTRAL CONSTRUCTION S,783.82,Hard stone to establish haul route to facilitate construction plant and machinery in order to carry out slit removal works from the River Devon
EA,08/03/2016,CENTRAL CONSTRUCTION S,770.11,Hard stone to establish haul route to facilitate construction plant and machinery in order to carry out silt removal works from River Devon
EA,08/03/2016,CIPD ENTERPRISES,4194,"Five day training course for one person, including lunch, refreshments, course materials and one years membership of the Chartered Institute of Personal Development, entitled 'Understanding and implementing coaching and mentoring'."
EA,08/03/2016,CLAYTON HOTEL LEEDS,1350,"One day room hire for twenty people, including lunch, refreshments, equipment and accommodation for one person, for a Yorkshire regional flood and coastal committee meeting."
EA,08/03/2016,CREWSAVER,3069.12,32 life jackets for use of military personnel whilst carrying out asset condition inspections after the winter floods
EA,08/03/2016,CROWN AND MITRE,582,Accommodation for six people for two nights whilst offering Cumbria flood incident aid
EA,08/03/2016,CUMBRIA WASTE RECYCLIN,3428.69,Removal and disposal of non recyclable materials from Coledale Beck gravel trap in Brathwaite.
EA,08/03/2016,CUMBRIA WASTE RECYCLIN,562.97,Disposal of EA sandbags that were used in floodwater on Eden and Petteril defences in Carlisle
EA,08/03/2016,D AND E ROBERTS,560.22,Removal of wood waste from maintenance activities
EA,08/03/2016,DEAFBLIND.ORG.UK,597,"Meeting room with lunch for 50 duty officers for various essential presentations as part of duty officer training, i.e. forecasting, "
EA,08/03/2016,DORMAR PRODUCTS,646.44,"One 36 inch butt grip, two 36 inch extension poles, one four prong drag rake, one hay fork and two covers for use on area trash screens to clear debris safely."
EA,08/03/2016,EDGE TECHNOLOGY,1155.52,Power testing of Winsford and Bedford depot generators
EA,08/03/2016,EEF WOODLAND GRANGE,763.2,"Three day Managing Successful Programme Foundation training course for seven people including venue hire, study book, exam and refreshments"
EA,08/03/2016,FCC RECYCLING,588.16,Disposal of silt removed at Friston
EA,08/03/2016,FOSTER FABRICATION,4800,Bow top railings and locked access gate for public and operational safety at Trout Beck trash screen Warwick Bridge
EA,08/03/2016,GILES RAYMOND AGRICULT,1887.6,"Fabrication and installation of a metal barrier gate to restrict public access along the beach promenade at Preston, Weymouth."
EA,08/03/2016,GO DIVE,2750,Five dry suits to allow safe access into water during emergency response and whilst carrying out routine maintenance.
EA,08/03/2016,GODFREYS,2520,"Three battery chainsaws, a pole saw and a petrol wood drill for maintenance work in Pevensey catchment"
EA,08/03/2016,H M LAND REGISTRY,2684.4,Submission of a polygon search to the Land Registry for title information in the Totnes area
EA,08/03/2016,H M LAND REGISTRY,704.4,Annual update of Land Registry GIS layer.
EA,08/03/2016,H. ELLIS & SONS(1899),1018.37,24 two inch padlocks for EA access gates and operational structures
EA,08/03/2016,HANNA INSTRUMENTS LTD,1871.86,Four dissolved oxygen meters for Stour and Gipping water quality project.
EA,08/03/2016,HARRISON & HETHERINGTO,2519.55,Subsistence for an average of twenty EA staff during a one month period whilst providing mutual aid during the winter flooding 2015-16
EA,08/03/2016,HEAVYHAUL /CHELMSF,575.28,Haulage of Conver weedrake from site back to Nazeing compound using heavy haul HIAB lorry as only means of launching boat.
EA,08/03/2016,HEAVYHAUL /CHELMSF,563.04,Haulage of Conver weedrake from Waltham Abbey to Nazeing compound using heavy haul HIAB lorry as only means of launching boat.
EA,08/03/2016,HEAVYHAUL /CHELMSF,514.08,Haulage of Conver weedrake localling within Walthan Abbey area using heavy haul HIAB lorry as only means of launching boat.
EA,08/03/2016,HEAVYHAUL /CHELMSF,514.08,Haulage of Conver weedrake from site back to Nazeing compound using heavy haul HIAB lorry as only means of launching boat.
EA,08/03/2016,HIRE STATION-LTD,671.09,Annual service of four sets of confined space breathing apparatus.
EA,08/03/2016,IBIS,565.3,Accommodation for one person for five nights whilst attending a change management course.
EA,08/03/2016,IDEFIGO,1863.89,Operational remote camera for monitoring assets as part of incident response
EA,08/03/2016,IDEFIGO,1863.89,"Two months hosting and data charges for remote camera system in Derbyshire, Nottinghamshire and Leicestershire area"
EA,08/03/2016,IDEFIGO,904.8,"Monthly hosting and data charges for remote camera system in Derbyshire, Nottinghamshire and Leicestershire area"
EA,08/03/2016,IET SERVICES LTD,570,"One day room hire for nineteen people, including lunch and refreshments, for a digital data and technology services team meeting."
EA,08/03/2016,J C GILLESPIE LTD,660,One day hire of a heavy goods vehicle to transport two EA excavators back to Winsford Depot.
EA,08/03/2016,JEWSON LTD,1428,Incident response flooding barriers held at Mablethorpe depot ready for use should a flood incident arise along.
EA,08/03/2016,KILLGERMS CHEMICAL,1532.16,Chemicals for controlling pests on flood defences to ensure they do not become undermined.
EA,08/03/2016,KINGS PARK,789,One day room hire for 50 people with lunch and refreshments for Staffordshire Warwickshire and West Midlands Area Base Controller training
EA,08/03/2016,KOREC,1620,Annual VRS Now subscription for Trimble surveying equipment access.
EA,08/03/2016,LATHAMS RECYCLING,1560.03,"Removal of waste from green level pumping station, dyke dredging and fly tipped rubbish for water courses."
EA,08/03/2016,MARINE MANAGEMENT,700,Marine Management Organisation license for Gosshall Jetty to construct a replacement structure within the tidal range
EA,08/03/2016,MYTHOLMROYD BUILDERS M,549.8,"Bulk bags of sand, shovels, wheelbarrow and empty one tonne bulk bags for temporary defences."
EA,08/03/2016,NMSI ENTERPRISES,2699.52,"One day room hire for sixty people, including lunch and refreshments, for a Yorkshire area leadership group meeting."
EA,08/03/2016,PAYPAL  RRC,760.74,Registration fees for three people to attend the annual River Restoration Centre conference 2016.
EA,08/03/2016,PP C TECH UNIT,2500,"Surveys, repairs and maintenance to Derbyshire, Nottinghamshire and Leicestershire area remote camera system"
EA,08/03/2016,PREMIER INN 44533930,514.96,Four night accommodation in Solihull for a five day Enhanced Intelligence Course at Solihull college
EA,08/03/2016,ROYAL MAIL GROUP,852.98,National Fisheries Services Royal Mail freepost postage costs for 19th Dec 2015 - 16th Jan 2016.
EA,08/03/2016,RS COMPONENTS,2040.02,Ninety legally required signs for display at EA sites and one tachometer to determine pump rotation speed
EA,08/03/2016,RS COMPONENTS,512.93,3G GSM router to be used at Monksleaze as part of the webcam project
EA,08/03/2016,S G BAKER LIMITED,4896,Sandbags for use during the winter flooding 2015-16
EA,08/03/2016,SCREWFIX,684.95,"De-Walt impact driver, battery, jigsaw, and LED work light for operational use on projects and emergency response"
EA,08/03/2016,SEPD PLC,2727.65,Mains electricity connection to Rodden Bridge gauging station hut.
EA,08/03/2016,SETON,666.42,"20 x 30m floating lifeline, 10/30"" lifebuoy with reflective tape after health and safety risk assessment along Jubilee River"
EA,08/03/2016,SMART MAINTENANCE,1152,Sixty tubes of flexi sealant for repairs to flood defence sea walls.
EA,08/03/2016,SOUTHERN MICROSCOPE,943.2,Cleaning and service of microscopes in ecological laboratory
EA,08/03/2016,STANTON HOPE LTD,666,Stihl FS460 strimmer used for maintenance works cutting grass
EA,08/03/2016,STAR SIGNS (DERBY) LIM,924.05,"Four calibrated depth indicators, ten CCTV warning notices and six magnetic pest control notices."
EA,08/03/2016,STAR SIGNS (DERBY) LIM,745.2,Fifty 400mm x 300mm signs reading 'Caution herbicide spraying'.
EA,08/03/2016,TANKERSLEY MANOR,565.4,Three day room hire for a planning inspectorate public enquiry.
EA,08/03/2016,THE OFFICE OF GOVE,2686.8,"Annual associate membership cost for eleven EA economists, plus registration fee for two people to attend the Government Economic and Social Research conference."
EA,08/03/2016,THE REGEN CENTRE,648,"One day room hire for ninety people, including lunch and refreshments, for a public flooding event."
EA,08/03/2016,THOMAS GRAHAM & SO,848.27,"Four hundred M24 bolts, 30mm socket, ear defenders, wet wipes, and a high visibility jacket for use by staff setting up and maintaining pumps and pipes during winter floods 2015-16."
EA,08/03/2016,THOMAS GRAHAM & SO,731.2,"Eighty M24 and M20 nuts and bolts, seven combi spanners, two hammers and miscellaneous other tools for setting up pumps as part of Cumbria flood incident aid"
EA,08/03/2016,TNT UK LTD,1170.85,Delivery of 40 consignments of bottles from the Nottingham laboratory to clients across the UK from the 18/01/16 to the 22/01/16
EA,08/03/2016,TNT UK LTD,1164.25,Delivery of 49 consignments of bottles from the Nottingham laboratory to clients across the UK from the 11/01/16 to the 15/01/16
EA,08/03/2016,TNT UK LTD,846.3,Delivery of 46 consignments of bottles from the Nottingham laboratory to clients across the UK from the 29/01/16 to the 05/02/16
EA,08/03/2016,TRAVIS PERKINS,909.12,Twenty 75mm x 225mm x 4.8m timber rails and twenty 100mm x 100mm x 1.8m timber posts for bank erosion work at Belstead Brook.
EA,08/03/2016,WALNES LTD,639.3,Grass seed for redevelopment of defence wall flood protection works at Walberswick.
EA,08/03/2016,WATER-LINES SOLUTIONS,588,Pre-established coir pallets installed as part mitigation for earthworks undertaken in South Yorkshire in 2015
EA,08/03/2016,WM. ARMSTRONG(LONGTOWN,2166.48,Haulage for transporting two pallet barriers from Carlisle back to Sudbury
EA,08/03/2016,WM. ARMSTRONG(LONGTOWN,2166.48,Transportation of demountable barriers to home depot following deployment in flood event
EA,08/03/2016,WM. ARMSTRONG(LONGTOWN,1083.24,Haulage for transporting pallet barrier from Carlisle back to Sudbury
EA,08/03/2016,WP-HR WALLINGFORD,540,One day training course for one person in Wallingford on river capacity and the effects of vegetation within a watercourse
EA,08/03/2016,WWW.ACTIVATEEVENTS.COM,600,Registration fee for one person to attend the three day flood and coast conference.
EA,08/03/2016,WWW.ACTIVATEEVENTS.COM,504,Registration fees for two people to attend a flood and coast conference.
EA,08/03/2016,WWW.ACTIVATEEVENTS.COM,504,Registration fees for two people to attend a flood and coast conference.
EA,08/03/2016,WWW.AVANTIGAS.COM,785.23,Delivery of 1312 litres of Liquid Petroleum Gas for provision of heating and hot water at Owston Ferry Depot
EA,08/03/2016,WWW.BBOFFICESUPPLIES.C,591.3,Ergonomic chair for member of staff with health problems following workplace assessment.
EA,08/03/2016,WWW.BBOFFICESUPPLIES.C,577.8,Ergonomic chair for member of staff with health problems following workplace assessment.
EA,08/03/2016,WWW.BBOFFICESUPPLIES.C,1254.6,Two ergonomic chairs for both home and office work  for member of staff with ongoing health problems following a workplace health assessment.
EA,08/03/2016,WWW.CRAGGSENERGY,2807.81,Uplift of contaminated gas oil from Draycott tanks.
EA,08/03/2016,WWW.FACELIFT.CO.UK,2887.2,One day scaffold training for sixteen people for improved health and safety.
EA,08/03/2016,WWW.PUMPSUKLTD.COM,846,"Pump controller for eel pass project to be used at Frenchay, Beggern Huish, Compton Dando, Tellisford, Midford"
EA,08/03/2016,WWW.TECNI-CABLE.COM,700.68,Parts and tools for Whitehouse and booms for River Axe
EA,09/03/2016,ACCESS CAMERAS,2187.6,Remote sensing camera for underwater and confined spaces work.
EA,09/03/2016,Amazon UK Marketplace,549.97,"Two cameras, memory cards and one case for flood and coastal risk management emergency response from Lea Marston depot."
EA,09/03/2016,AZTEC CHEMICALS LTD,1352.21,"Multi purpose cleaner, satin black spray paint for tidal flap servicing, plant nappies for new pumps, fluorescent road paint for sites, and moisture displacer for fleet vehicles"
EA,09/03/2016,B & T SKIP HIRE LTD,522,Removal of two loads of demolition waste from the area incident room at Richard Fairclough House
EA,09/03/2016,BANNER BUSINESS SERVIC,660.27,"Stationery order for Apollo Court for plain headed and A3 paper, folders and dividers"
EA,09/03/2016,BURDENS,1913.59,"Materials for Loddiswell project including glass fibre headwall, two lengths of 300mm twin wall pipe with coupler and seals and a 300mm wastop non return valve"
EA,09/03/2016,BVSC ENTERPRISE LIMITE,535.2,One day room hire for 16 people including equipment hire for strategic meeting
EA,09/03/2016,CLAD SAFETY,693.9,Various sized  waders for field team members to use in routine river maintenance work
EA,09/03/2016,CONFINED SPACES TR,818.14,Annual servicing of twenty emergency breathing apparatus sets.
EA,09/03/2016,EB THE CHALLENGE OF S,660,"Three day training course for one person at Plymouth University on Challenge of Science Leadership including training material, lunch and refreshments"
EA,09/03/2016,EFE & GB Nets,1027.8,Twenty crayfish traps to enable long term surveying of Catterick Flood Defence Scheme site
