Entity,GL Date,Merchant name,Amount,Description
EA,09/03/2016,EMS CONSOLIDATED LTD,2029.2,Three roof racks with fitting in order to carry tools and materials to sites
EA,09/03/2016,GEMINI DATA LOGGERS (U,695.94,Six water temperature loggers for use on Saltburn Gill
EA,09/03/2016,GILES RAYMOND AGRICULT,1797.6,Fabricate and fit gate at Bowleaze Cove as part of maintenance work to flood defence system in Dorset.
EA,09/03/2016,Hilti (Gt. Britain) Lt,1274.4,Two drills and an impact driver with drills bits and additional batteries to help with site installations
EA,09/03/2016,IET SERVICES LTD,600,One day room hire for twenty people for meeting on prioritisation of work relating to Agriculture 
EA,09/03/2016,JEWSON LTD,514.8,"1t dumpy bags of sand to be used to create a coffer dam, so a new head wall could be constructed on the side of the river."
EA,09/03/2016,LANES LANDSCAPES,1844.1,"2,500 trees and supports given to Garden Needs in Salford as part of the Salford flood risk management scheme, following a local planning authority condition to replant two trees for every one removed."
EA,09/03/2016,LOADING BAY SPECIA,1557.36,Replacement of pipe ramps and pipe wedges due to previously stolen equipment
EA,09/03/2016,PENTAHOTEL BIRMINGHAM,585,"One day room hire for twelve people, including lunch and refreshments, for a national permitting service business risk and resource planning meeting."
EA,09/03/2016,RESAPOL LTD,3000,One hundred and sixty 380ml tubes of mastic to be used in cracks on seawalls 
EA,09/03/2016,TEMPCON INSTRUMENTATIO,3702.15,Six river level loggers and associated equipment.
EA,09/03/2016,THE ROYAL ANGUS HO,825,One night accommodation including breakfast for eleven people attending personal effectiveness training course
EA,09/03/2016,THE WESLEY,578,"One day room hire for eleven people, including lunch, refreshments and equipment, for an evidence team meeting."
EA,09/03/2016,WWW.ACTIVATEEVENTS.COM,504,Registration fee for one person to attend the flood and coastal conference in Telford.
EA,09/03/2016,WWW.AUTOELECTRICALPART,1553.47,Eighteen rechargeable working lamps to be used two per vehicle for emergency responders
EA,09/03/2016,WWW.BBOFFICESUPPLIES.C,653.76,Ergonomic chair for member of staff with health problems following workplace assessment.
EA,09/03/2016,WWW.NEOPOST.CO.UK,515,Postal top up for Apollo Court franking machine
EA,09/03/2016,WWW.QA.COM,1233.54,Five day training course for one person on project management.
EA,09/03/2016,WWW.REACTEC.COM,1398,Four Hands Arms Vibration Syndrome meters to be attached to vibrating tools
EA,09/03/2016,WWW.TECNI-CABLE.COM,1312.44,Replacement pump lifting chains for Stockmoor pumping station.
EA,09/03/2016,WWW.TECNI-CABLE.COM,746.93,Lifting slings for emergency submersible pumps
EA,10/03/2016,ALPHA LABORATORIES,910.8,Plastic ware for preparation and distribution of diatom preservation buffer
EA,10/03/2016,ARCO LTD,2256.23,Altair GX2 gas alarm calibration station needed to bump test and calibrate Altair 4x gas alarms.
EA,10/03/2016,ARMADA HOUSE,1410,One day room hire for 50 people including equipment and catering for workshop on improving project delivery
EA,10/03/2016,BUILDERS EQUIPMENT,828,Four kilowatt petrol generator to replace unrepairable generator for use on Great Yarmouth Harbour
EA,10/03/2016,BVSC ENTERPRISE LIMITE,599.2,"One day hire of two rooms for sixteen people, including lunch, refreshments and equipment, for a business planning and performance team meeting"
EA,10/03/2016,CIWEMSERVIC,540,Registration fees for two people to attend the annual Chartered Institution of Water and Environmental Management conference 2016
EA,10/03/2016,CK SPECIAL GASES LTD.,552.45,Pure compound for the analytical quantification of contaminants in environmental samples carried out at the EA laboratory in Nottingham
EA,10/03/2016,DAVID MUSSON FENCING,1326.71,168 3.6m x 87mm x 38mm sawn timber rails and 113 2.1m x 125mm x 75mm saw timber planks for fencing in Easthorpe
EA,10/03/2016,DAVID MUSSON FENCING,522.48,Gates and fittings for Easthorpe de-silt
EA,10/03/2016,DYNAMIC EMS LTD,2070,Repairs to five outstations for groundwater sites.
EA,10/03/2016,DYNAMIC EMS LTD,1338,Repairs to five outstations for groundwater sites.
EA,10/03/2016,EEF LTD,888,One day room hire for 25 people in Bristol to discuss and evaluate options for new legal criteria for hazardous property
EA,10/03/2016,ENTERPRISE,526.82,Hire of a vehicle to carry out site visits to various locations within the Yorkshire area as part of the hard defence inspection programme 
EA,10/03/2016,FIRST FENCE LTD,744.15,Twenty 2m lengths of plastic pedestrian safety barriers to be used while EA work is carried out .
EA,10/03/2016,FRIENDS HOUSE,527.6,Two meeting rooms with data projector for four people includes refreshments and lunch for a Senior HR Business Partner assessment held in London. 
EA,10/03/2016,GB HYDRAULICS(S'AM,659.04,"Strip down, repair and retest lock gate sluice ram for Godstow."
EA,10/03/2016,GB HYDRAULICS(S'AM,659.04,"Strip down, repair and retest lock gate sluice ram for Godstow."
EA,10/03/2016,GEORGE HOTEL RECEPTION,1392.25,Accommodation for mutual aid staff during winter floods 2015-16
EA,10/03/2016,GREYHOUND CHROM.,906.15,Pure compounds and standard solutions for the analytical quantification of contaminants in environmental samples carried out at the EA laboratory in Nottingham
EA,10/03/2016,H. ELLIS & SONS(1899),884.4,"SDS drill, battery grinder and a jigsaw for operational use."
EA,10/03/2016,HEALEY TOOL HIRE &SALE,667.49,"Petrol cement mixer, tape measure and rivets for the construction of seawall steps at Skinners Wharf, Manningtree, Essex."
EA,10/03/2016,HI-TECH AUTO SERVICES,930,One month's vehicle hire whilst badged vehicle is in for repairs.
EA,10/03/2016,HSS HIRE,1200,Hire of three portable building dryers for Winterbourne Gunner Depot
EA,10/03/2016,HUMPHRIES AND PARKS,578.37,Replacement spare wheel and tyre for and EA Mitsubishi Outlander.
EA,10/03/2016,INFORM (UK) LTD,1701.6,Mastic and fifteen boxes jointing for Great Yarmouth Harbour works
EA,10/03/2016,JEWSON LTD,598.92,"Concrete used for forming a concrete head wall for pipe overflow from Lake to Faxton Brook, Northampton, Northamptonshire"
EA,10/03/2016,JOHN LEWIS,1436.85,"Three 48 inch televisions, plus wall mounting brackets, for installation of video conferencing facilities at Dragonfly House as is more efficient than alternative of expensive travel to other locations for meetings"
EA,10/03/2016,LANTERN RENTAL SER,1710,"Two days hire of a mobile crane lorry for removing obstructions blocking channel on trash collecting pins that stop waste entering at Houghton Brook, Luton."
EA,10/03/2016,LINCS LIFTING LIMITED,658.8,150 metres of galvanised steel chain for watercourse
EA,10/03/2016,MARTIN DAWES OFFIC,1376,Eighteen headsets for staff to use in conjunction with new digital phone system.
EA,10/03/2016,MARTIN DAWES OFFIC,1155.17,Twelve headsets for members of staff following introduction of a new digital telephony system.
EA,10/03/2016,NORTH LAKES HOTEL,1610.8,Accommodation for mutual aid staff during winter floods 2015-16
EA,10/03/2016,PAYPAL  ASPIRELEADE,504,One day Influencing Skills training course in London for one person including training materials and lunch
EA,10/03/2016,PHENOMENEX LTD,562.79,Gas chromatography analytical column for the analysis of the chemical composition of environmental samples carried out at the EA laboratory in Nottingham
EA,10/03/2016,PRIORY ROOMS (BULL STR,565.2,One day room hire for 32 people in Birmingham with lunch and refreshments for Fisheries Partnership workshop
EA,10/03/2016,PROFIX FABRICATIONS LT,1008,Bespoke bracket for installation of flow measuring instrument at Dalton flow site
EA,10/03/2016,SNUGPAK LTD,918,Twenty extreme weather waterproof tops for hydrometry and telemetry field team.
EA,10/03/2016,STUART J DAWS & CO,833.34,Annual service and repairs for six items strimmers and hedge cutter used in the clearing of foliage from watercourses
EA,10/03/2016,SUPARULE SYSTEMS LTD,900,"Service and calibration of two cable height meters, and purchase of one cable height meter"
EA,10/03/2016,THE PRESS ASSOCIATION,1142.4,Eleven high resolution photos of flooding for use in reports and presentations
EA,10/03/2016,TRAVIS PERKINS,1579.89,"Materials for  safety rail replacement at Boveney Lock and install new safety rail around bridge on tow path both sides, required for public health and safety "
EA,10/03/2016,VILLAGE HT WARRINGTON,700,Two days room hire for ten people for craft of communication training in Warrington
EA,10/03/2016,WILLGEN,815.46,Six solar panels for remote flood warning sensors
EA,10/03/2016,WWW.ACTIVATEEVENTS.COM,756,Registration fee for three people too attend the flood and coastal conference in Telford.
EA,10/03/2016,WWW.BARRIERSDIRECT.CO.,1103.64,Steel barrier for Humber bank as replacement for damaged barrier
EA,10/03/2016,WWW.BOSTONSEEDS.CO,1740,Purchase of mixed grass seed to reduce flood risk at Kickles Drain after existing grass area damaged during flood defence works
EA,10/03/2016,WWW.DFSALES.CO.UK,504,Bio and compostable bin liners for Horizon House.
EA,10/03/2016,WWW.PMGLTD.CO.UK,594,One day training course for one person in data visualisation and reporting techniques.
EA,10/03/2016,WWW.QA.COM,565.2,One day training course for one person on the use of AutoCAD.
EA,10/03/2016,WWW.REACTEC.COM,1236,Van cable and charger for hand and arm vibration equipment.
EA,10/03/2016,WWW.VEOLIA.CO.UK,645.6,Safe disposal of hazardous chemicals used during post mortem investigations of fish.
EA,10/03/2016,XMA LTD,649.47,Full set of toner cartridges for Incident room required due to high volume of printing during incident
EA,11/03/2016,A & W CUSHION LTD,2571.82,"One hundred and fifty 3.6m, one hundred 2.4m and twenty 4.8m timber posts, and ten sheets of plywood for fencing works from Happisburgh to Winterton Beach"
EA,11/03/2016,ACTION FOR BLIND P,1034,"One day room hire for 43 people, including lunch and refreshments, for a waste regulation workshop."
EA,11/03/2016,AINSCOUGH CRANE HIRE L,3351.6,Hire of 150 tonne crane to move two 24 inch pumps at Mawdesley.
EA,11/03/2016,Amazon EU,1368,36 torches for environment officers required for health and safety as part of their incident response roles
EA,11/03/2016,ARTHUR IBBETT LTD,2160,Five litres of Biactive Roundup for spraying on invasive floating Pennywort.
EA,11/03/2016,AUS,1073.04,"29 tools and tool attachments, including tree hooks, saws, drag forks and various adapters for Birmingham and Black Country field team use."
EA,11/03/2016,AUTO ELECTRICS,1338.43,Sixteen sets of jump leads with sockets for pumps for use during winter flooding event 2015-16
EA,11/03/2016,BALLYCLARE LTD,932.98,Six Gore-Tex jackets for use in adverse weather.
EA,11/03/2016,BIRMINGHAM REP ENTERPR,609.3,"Meeting room hire for fifteen people, included refreshments and lunch for dispersed waste team leaders in National Permitting  to discuss key issues and strategy plans. "
EA,11/03/2016,BRINDLEY CHAINS LTD,1881.89,Replacement lashing chains for stolen items whilst on incident response
EA,11/03/2016,CHRIS GOODHEAD,1818.85,"Seven wireless cameras for remote control use in low light, including memory card and rugged case for use during incidents."
EA,11/03/2016,COLLINS NETS LIMITED,1162.8,Four 5m x 1m Seine nets and three life jackets for use whilst performing fish monitoring surveys.
EA,11/03/2016,COLLINS NETS LIMITED,698.4,Dry suit to be used by environmental crime team.
EA,11/03/2016,CREWSAVER,1753.44,Thirteen lifejackets and servicing of twenty more for Staffordshire field team.
EA,11/03/2016,DEBORAH SERVICE MOTO,578.85,"Thirty fence couplers, sixteen fence rubber blocks and fifteen fence post tops for project in Birmingham and Black Country field team"
EA,11/03/2016,DISPLAY GRAPHICS,992.16,Various emergency site closed signs for sites around the area due to safety issues
EA,11/03/2016,DORMAR PRODUCTS,1598.88,Weed rakes to clear weed screens during winter flooding 2015-16
EA,11/03/2016,E.S.T.S. LTD,684,Three 2.5m galvanised steel posts for erecting public safety signs on Groynes
EA,11/03/2016,EAST RIDING OF YORKSHI,550.07,Council tax payment on Barmby Barrage bungalow.The property is an EA owned building and at the time was vacant. We do not generally pay these type of payments on the card.
EA,11/03/2016,EEF LTD,768,Half-day venue hire for 32 people in London for Flood and Coastal Risk Management business plan workshop
EA,11/03/2016,ELECTRAFISH LIMITE,612,Quarterly service of electric fishing equipment.
EA,11/03/2016,ENTERPRISE,703.2,Five day hire of a Land Rover for use in Yorkshire during winter flooding 2015-16 to visit various affected sites.
EA,11/03/2016,ENTERPRISE,521.28,One month car hire for carrying out environmental waste monitoring
EA,11/03/2016,EXTRONICS LTD,1156.8,Intrinsically safe camera for use on control of major accident hazards site visits and other chemical or fuel sites where standard cameras are not permitted
EA,11/03/2016,FAHEYS CONCRETE LTD,898.8,7.25 metres concrete for use on site at Ladock flood recovery scheme
EA,11/03/2016,GRAHAM  BIDLE TOOL,536.83,Three rechargeable Milwalkie batteries and one charger for drill.
EA,11/03/2016,GRIFFIN VIDEO COMMS LT,2053.2,"Two plasma TVs, one 48 inch and one 58 inch, used for conferencing facilities in the new meeting rooms at Sapphire East as is more efficient than alternative of expensive travel to other locations for meetings"""
EA,11/03/2016,GRIFFIN VIDEO COMMS LT,759.6,Transportation of communications TV and removal of projector and screen for old incident room.
EA,11/03/2016,HAMMOND DRYSUITS,2300,Four chest waders with chainsaw boots attached to the bottom for chainsaw protection whilst working in water
EA,11/03/2016,HY-TEX (UK) LTD,1940.4,Replacement of Geotextiles as part of French Drain works at the Leigh Barrier
EA,11/03/2016,IET SERVICES LTD,1008,"One day room hire for 25 people, including lunch and refreshments, for an environmental permitting regulations training session."
EA,11/03/2016,INDUSTRIAL WATER J,2663.58,Industrial power washing of Golf Links Sluice to remove algae build up
EA,11/03/2016,JOHNSONS MOVING SE,525.16,Moving the old back up safe from the communications room in Sapphire East
EA,11/03/2016,KOREC,2334,Annual renewal of global positioning system survey equipment licence
EA,11/03/2016,LAMBERTS/NORWICH/LTD,598.8,28 volt cordless hammer drill for Waveney Works
EA,11/03/2016,LINCOLN SECURITY LTD,1380.89,Various sized padlocks to be fitted onto the new flood gates and penstocks as part of the Walderingfield Flood Alleviation Scheme
EA,11/03/2016,LINCOLN SECURITY LTD,656.16,Various sized padlocks to be fitted onto the new flood gates and penstocks as part of the Walderingfield Flood Alleviation Scheme
EA,11/03/2016,LUBETECH INDUSTRIES LT,927.12,Pollution spill kits and absorbent spill pads for Birmingham and Black Country Depot
EA,11/03/2016,MARTIN DAWES OFFIC,688.15,Seven headsets for use with new digital phone system
EA,11/03/2016,PARK PLAZA RIVERBANK,835.52,Accommodation and evening meals for four nights for one person whilst on incident management duty in London
EA,11/03/2016,QUAY MARINAS LTD,596.6,Three months mooring fees including lifting charge at Royal Quays for a winter berth of EA marine monitoring boat
EA,11/03/2016,SELWOOD LTD,1555.37,Supply of wire armour and layflat pipe for Staffordshire Field Team
EA,11/03/2016,SHELLEY SIGNS LIMITED,1093.2,25 river level monitoring face plates for river staff gauges for installation at Bedford pumping station and for use as general spares
EA,11/03/2016,SITE SAFETY LTD,1088.13,51 pairs of high visibility trousers for Romsey office to comply with new Highways working regulations.
EA,11/03/2016,SKILLS FOR CARE SOLUTI,506.39,One day room hire only for twelve people for an inland leadership team meeting.
EA,11/03/2016,SOLIHULL COLLEGE,1965.9,"Five day room hire for seventeen people, including lunch and refreshments, for an enhanced intelligence training course."
EA,11/03/2016,SPOT,1299.46,Annual licence fee for Spot tracker personal tracking devices used as a valuable health and safety tool
EA,11/03/2016,STARLIGHT NIGHT VISION,1813,Repairs to an image intensifier used by environmental crime team.
EA,11/03/2016,STONEYBECK INN LTD,2014.5,Accommodation for mutual aid staff during winter floods 2015-16
EA,11/03/2016,TRAVIS PERKINS,1817.38,"Thirty sheets of concrete reinforcement steel fabric, 180 ring spacers, one hundred U Bars and 2Kg stainless steel ties for Uttoxter Depot"
EA,11/03/2016,WORLD OF TRAVEL,577.11,"One day room hire for twelve people, including lunch and refreshments, for a recovery planning meeting in London."
EA,11/03/2016,WORLD OF TRAVEL,524.62,One day room hire for 16 people including lunch and refreshments in Birmingham for Better Planning for the Water Environment initiative
EA,11/03/2016,WP-HR WALLINGFORD,1869.6,"Three day training course for two people, including refreshments and materials, on coastal processes and management, and coastal structures"
EA,11/03/2016,WWW.BARRIERSDIRECT.CO.,604.3,"Ten hurdle type crowd control barriers to securely fence off, part failed assets on temporary works schedules following a public safety inspection"
EA,11/03/2016,WWW.BBOFFICESUPPLIES.C,750,Ergonomic chair for member of staff with health problems following workplace assessment.
EA,11/03/2016,WWW.GLASDON.COM,707.47,Replacement of three  vandalised and rotten timber life belt stations with plastic ones following a public safety  inspection
EA,11/03/2016,WWW.PHOTONICUNIVERSE.C,3434.07,"Twelve solar panels, batteries and accessories to power up closed circuit cameras at debris screen sites on brooks to monitor levels and monitor collecting debris on screens near culverts."
EA,13/03/2016,STONEGRAVE AGGREGATES,1322.5,"Operational waste tipping charges for waste generated through maintenance, reactive and incident response work in the Durham and Tees Valley"
EA,14/03/2016,A HESTER LTD,592.2,Emptying of depot cesspit
EA,14/03/2016,ACTION FOR BLIND P,1141.4,"One day room hire for 42 people, including lunch, refreshments and equipment, for a national operations finance team meeting in Birmingham"
EA,14/03/2016,ADOBE  PS CREATIVE CLD,533.52,Annual renewal of two photo processing licences for Geometrics network use.
EA,14/03/2016,AGGREGATE IND UK L,1020,"19.22 tonnes granite for bank protection for new culvert at Faxton Brook, Northampton"
EA,14/03/2016,Amazon UK Marketplace,780.3,Various iPad leads and plugs during rollout of National iPad project
EA,14/03/2016,ASHTEAD TECHNOLOGY,540,Calibration of gas monitors for the installations team
EA,14/03/2016,BCW OFFICE PROD,1356.41,"Six 'site entrances signs, six 'slow' signs, six 'caution, wagons turning' signs and six 'road works' signs for use on various sites."
EA,14/03/2016,BULLEY DAVEY LIMIT,1440,Emergency removal of silt preventing closure of Cley Tidal Barrier
EA,14/03/2016,CCAS LIMITED,1200,Four day training course for two people on Institution of Occupational Safety and Health Managing Safely
EA,14/03/2016,CLARKES OF WALSHAM,1776.74,30m galvanised welded mesh and 200m high tensile boarded wire for stock fencing on Ouse Washes
EA,14/03/2016,CONFERENCE ASTON LTD,2853.1,"Two days room hire for eighteen people, including lunch, refreshments and accommodation for thirteen people, for a property projects team meeting"
EA,14/03/2016,COTTAM BRUSH LTD,4854.6,One hundred 12mm and thirty 8mm brush material for utilisation in eel passes at gauging stations
EA,14/03/2016,DORMAR PRODUCTS,2280,"Extendable debris drags to maintain culvert trash screens to prevent blockages, maintain flows and reduce flood risk"
EA,14/03/2016,DYNAMIC EMS LTD,1446,Repair and upgrade of three telemetry outstations so they may be reused at groundwater sites.
EA,14/03/2016,DYNAMIC EMS LTD,1260,Repair and upgrade of two telemetry outstations so they may be reused at groundwater sites.
EA,14/03/2016,EREWASH,762.38,"Depot inspection fees for the building at the Draycott Depot, Derby."
EA,14/03/2016,FOSTER FABRICATION,1846.8,Metal work for new hydrometry and telemetry installation at Thirlmere
EA,14/03/2016,GEOTECHNICAL INSTR,534,Six month calibration of equipment used for detection of gas on landfill sites
EA,14/03/2016,GOUGH & KELLY,3000,Security guards for the Foss Barrier as a result of winter flooding 2015-16
EA,14/03/2016,gov.uk/phe,825,Two days radiation protection supervisors training course for one person.
EA,14/03/2016,GRAPHIC AD,2395,Research and design materials for new exhibition display in the Thames Barrier Information Centre
EA,14/03/2016,GREATER MANCHESTER CHA,1108.8,Meeting Room hire with IT equipment projector and screen with refreshments and lunch for 28 delegates attending a meeting for National Trading Regulation Team 
EA,14/03/2016,HILLS WASTE SOLUTION,975.66,Collection and removal of waste gathered from trash screens around the Swindon area.
EA,14/03/2016,JEWSON LTD,786.36,Silt trap at Faxton Brook flood defence structure
EA,14/03/2016,KB REINFORCEMENTS,503.76,Reinforcement steel for engineering works at the Minford flood recovery scheme.
EA,14/03/2016,MARTIN DAWES OFFIC,1220.32,Nineteen headsets for members of staff following introduction of a new digital telephony system.
EA,14/03/2016,MARTIN DAWES OFFIC,1216.94,Twenty headsets for members of staff following introduction of a new digital telephony system.
EA,14/03/2016,METCALFE (PLANT HI,1855.89,Hire of four lighting towers for two weeks used during winter flooding 2015-16.
EA,14/03/2016,MORGAN MARINE LTD,1264.8,Telemetry kiosk for new installation at Wet Sledded
EA,14/03/2016,MORGAN MARINE LTD,1264.8,Telemetry kiosk for new installation at Coniston Coppermine's
EA,14/03/2016,MORGAN MARINE LTD,1083.6,Two meter cabinets to be installed at Whitchurch and Kings Osborne to house flood warning river level equipment
EA,14/03/2016,NORTH LAKES HOTEL,1344,Accommodation for one person for twelve nights whilst providing mutual aid during winter flooding 2015-16
EA,14/03/2016,NOVOTEL BIRMINGHAM CIT,1108,"Two days room hire for eighteen people, including lunch and refreshments, for a property projects team meeting"
EA,14/03/2016,"PC SPECIALIST, WAKEFIE",2833.56,Three laptops to support the timely delivery of the Regulation Digital Service and support current live systems.
EA,14/03/2016,PHENOMENEX LTD,669.59,Amino guard cartridges used in the clean-up procedure for Oestrogens analysed by liquid chromatography triple mass spectroscopy in routine waters.
EA,14/03/2016,PRIORY ROOMS (BULL STR,633.6,"One day room hire for 22 people, including lunch and refreshments, for a national operations finance team meeting in Birmingham"
EA,14/03/2016,RINGWAY SIGNS LTD,574.58,Corporate livery for application to plant equipment and trailers for South East fleet team
EA,14/03/2016,RINGWAY SIGNS LTD,574.58,Corporate livery for application to plant equipment and trailers for South East fleet team
EA,14/03/2016,ROGER YOUNG JAGUAR SAL,4012.8,"3,800 litres of fuel to deliver 152 new Isuzu vehicles to cover transport to various EA depots."
EA,14/03/2016,RS COMPONENTS,510.59,Six 10 watt solar panels for use at non mains powered river level and flow sites
EA,14/03/2016,SIG,664.8,Mastic cement compound to fill cracks in Hackers Bow Sluice in North Somerset
EA,14/03/2016,SITA HOLDINGS UK,680.66,Waste collections for Ultra House and Spurries House
EA,14/03/2016,SOLIHULL COLLEGE,974.22,Meeting Room hire with IT equipment projector and screen with refreshments and lunch for 22 delegates attending a meeting for National Enforcement Extended Leadership Team  
EA,14/03/2016,TELFORD INTERNATIONAL,1015.08,Three day hire of IT equipment for the EA exhibition lounge at the Flood and Coast Conference 2016.
EA,14/03/2016,UNITEDUTILITIES.CO,849.24,Water bill for Ultra House for May-July 2015
EA,14/03/2016,WEBSTORE,1175,"Five day training course for one person, including course materials, lunch and refreshments, on groundwater contamination and remediation"
EA,14/03/2016,WWW.ACTIVATEEVENTS.COM,504,Registration fees for one person to attend a Flood and Coast conference
EA,14/03/2016,WWW.BBOFFICESUPPLIES.C,654.3,Ergonomic chair for member of staff with health problems following workplace assessment.
EA,14/03/2016,WWW.QA.COM,1233.6,MSP exam fees for eight team members to enhance their project management core skill base to enable the delivery of the capital programme
EA,14/03/2016,WWW.TECNI-CABLE.COM,744,Two Hackers Bow Man Anchors hired for a week to hold a person on a lifeline whilst repointing the upstream face of the sluice
EA,14/03/2016,XMA LTD,520.6,Toner cartridges for printer at Ultra House used to print out large maps
EA,14/03/2016,XYLEM WATER SOLUTIONS,1557.6,Telemetry outstation for new installation at Coniston Coppermine's
EA,15/03/2016,AGGREGATE IND UK L,660,Twenty tonnes of aggregates for Uttoxeter Depot.
EA,15/03/2016,ASH SAFETY,507,Hire of three rebreather escape sets for confined spaces entry
EA,15/03/2016,AUSTIN WALMSLEY,668.4,"Removal and disposal of two old metal kiosks, approximately 1.5m x 1m x 1m, from Speke Reservoir and Speke Industrial Estate borehole sites."
EA,15/03/2016,BFS GROUP,549.35,Food supplied to be prepared and sold at the Thames Barrier View Cafe
EA,15/03/2016,BIRMINGHAM REP ENTERPR,840,"One day room hire for 28 people, including lunch and refreshments, for a materials to land project workshop."
EA,15/03/2016,BTS GROUP LIMITED,1800,Two visits to Waterside House to carry out grounds maintenance in October
EA,15/03/2016,BTS GROUP LIMITED,900,Monthly visit to Waterside House to carry out grounds maintenance
EA,15/03/2016,BTS GROUP LIMITED,900,One visit to Waterside House to carry out grounds maintenance 
EA,15/03/2016,CARTRIDGE SAVE,1733.78,One set of toner cartridges and cleaner heads for Plotter at Rivers House
