,,,Department for Work and Pensions August 2016,,
Line Number ,Posting Date ,MCH.Merchant Category Code (MCC),MCH.Merchant Name,FIN.Transaction Amount,
1,25/07/2016,8220,AVADO LEARNING LIM,"£2,514.00",Payment for external training 
2,22/07/2016,8220,AVADO LEARNING LIM,£594.00,Payment for external training 
3,01/08/2016,8699,GREATER MANCHESTER CHA,£570.00,Payment for membership fees 
4,08/08/2016,5732,CVP.COM,£549.00,Payment for IT consumables 
5,03/08/2016,5722,SEPURA PLC,£540.00,Payment for Radio chargers 
