"00153528","N/D","SCS1","Head Commercial Industrial Policy","Responsible for MOD industrial policy","Ministry of Defence","Ministry of Defence","Defence Equipment and Support","030 679 30206","DESSec-ParliamentaryBusiness@mod.uk","00176079","0","1.00","N/A","N/A","","Procurement","","1"
"00159581","N/D","SCS1","Head Tech Assistance and Guidance","Responsible for assisting DE&S Operating Centres to improve their teams’ programme, project and technology management and providing DE&S programme management assistance.","Ministry of Defence","Ministry of Defence","Defence Equipment and Support","030 679 30206","DESSec-ParliamentaryBusiness@mod.uk","00003321","0","1.00","N/A","N/A","","Programme and Project Management (PPM)","","1"
"00160259","N/D","SCS1","Land Equipment Armoured Vehicles Programmes Specialist Vehicles Programme Leader","Responsible for Speciaist Vehicles programme","Ministry of Defence","Ministry of Defence","Defence Equipment and Support","030 679 30206","DESSec-ParliamentaryBusiness@mod.uk","00172024","0","1.00","N/A","N/A","","Programme and Project Management (PPM)","","1"
"00165338","Vacant","SCS1","Head Weapons Programme","Responsible for the Weapons Programme","Ministry of Defence","Ministry of Defence","Defence Equipment and Support","N/A","N/A","00170773","0","1.00","N/A","N/A","","Programme and Project Management (PPM)","","1"
"00165354","Vacant","OF-6","Head Logistics Delivery Transition, Disposals and British Forces Post Office","Responsible for Logistics Delivery transition, British Froces Post Office and the Disposals Service Authority","Ministry of Defence","Ministry of Defence","Defence Equipment and Support","N/A","N/A","00198770","0","1.00","N/A","N/A","","Military","","1"
"00168616","Barry Burton","SCS2","Director Corporate Affairs","Responsible for DE&S strategic governance, reputation, infrastructure and security.","Ministry of Defence","Ministry of Defence","Defence Equipment and Support","030 679 30206","DESSec-ParliamentaryBusiness@mod.uk","00212421","0","1.00","85000","89999","","Operational Delivery","","1"
"00168617","Vacant","SCS1","Head Materiel Strategy Portfolio","Responsible for the Materiel Strategy portfolio","Ministry of Defence","Ministry of Defence","Defence Equipment and Support","N/A","N/A","00203390","0","1.00","N/A","N/A","","Programme and Project Management (PPM)","","1"
"00170310","Lt Gen Paul Jaques","OF-8","Chief of Materiel Land","Responsible for the coherent supply and support of all Land equipments, systems and logistics to support current and future operations.","Ministry of Defence","Ministry of Defence","Defence Equipment and Support","030 679 30206","DESSec-ParliamentaryBusiness@mod.uk","00212421","0","1.00","130000","134999","","Military","","1"
"00170311","V Adm Simon Lister","OF-8","Chief of Materiel Fleet","Responsible for the availability of Royal Navy ships and submarines, now and in the future.","Ministry of Defence","Ministry of Defence","Defence Equipment and Support","030 679 30206","DESSec-ParliamentaryBusiness@mod.uk","00212421","0","1.00","140000","144999","","Military","","1"
"00170429","Adrian Baguley","SCS2","Director Air Support","Responsible for acquisition and support for all current and future aircraft other than fast jets, including air transport, air to air refuelling, air intelligence and surveillance assets, and related training and airfield support equipment.","Ministry of Defence","Ministry of Defence","Defence Equipment and Support","030 679 30206","DESSec-ParliamentaryBusiness@mod.uk","00172101","0","1.00","125000","129999","","Programme and Project Management (PPM)","","1"
"00170773","Richard Smart","SCS2","Director Weapons","Responsible for all weapons and munitions programmes in DE&S.","Ministry of Defence","Ministry of Defence","Defence Equipment and Support","030 679 30206","DESSec-ParliamentaryBusiness@mod.uk","00170310","0","1.00","125000","129999","","Programme and Project Management (PPM)","","1"
"00171964","N/D","SCS1","Head Future Submarines","Responsible for delivering future submarine concepts, design and build arrangements for the Successor SSBN and follow on SSN; including the associated infrastructure arrangements and supporting US Common Missile Compartment and technology programmes.","Ministry of Defence","Ministry of Defence","Defence Equipment and Support","030 679 30206","DESSec-ParliamentaryBusiness@mod.uk","00006158","0","1.00","N/A","N/A","","Programme and Project Management (PPM)","","1"
"00172010","N/D","SCS1","Head Tech Quality, Safety & Environmental Protection","Assists DE&S workplaces, services and products to minimise unintentional harm to people and the environment.  Provides policy, systems, advice, guidance, training, performance information, audit and assurance.","Ministry of Defence","Ministry of Defence","Defence Equipment and Support","030 679 30206","DESSec-ParliamentaryBusiness@mod.uk","00003321","0","1.00","N/A","N/A","","Programme and Project Management (PPM)","","1"
"00172024","N/D","SCS1","Head Land Equipment Armoured Vehicles Programmes","Responsible for the development, production and in-service support of Army armoured tracked vehicles and their sub-systems, including Scout and the Warrior Capability Sustainment Programme; and Land Forces indirect fire systems, including guns, rockets, C4I, radars and joint fires integration equipment.","Ministry of Defence","Ministry of Defence","Defence Equipment and Support","030 679 30206","DESSec-ParliamentaryBusiness@mod.uk","00023490","0","1.00","N/A","N/A","","Programme and Project Management (PPM)","","1"
"00172101","AM Simon Bollom","OF-8","Chief of Materiel Air","Responsible for the coherent supply and support of all Air equipments, systems and logistics to support current and future operations.","Ministry of Defence","Ministry of Defence","Defence Equipment and Support","030 679 30206","DESSec-ParliamentaryBusiness@mod.uk","00212421","0","1.00","145000","149999","","Military","","1"
"00172154","N/D","SCS1","Head Combat Air Commercial","Responsible for providing commercial advice and assurance to DES Combat Air Director and commercial functional line management to all commercial staff within the Operating Centre.","Ministry of Defence","Ministry of Defence","Defence Equipment and Support","030 679 30206","DESSec-ParliamentaryBusiness@mod.uk","00051335","0","1.00","N/A","N/A","","Procurement","","1"
"00172696","N/D","SCS1","Head Commercial Analytics","Responsible for DES Commercial Analytics","Ministry of Defence","Ministry of Defence","Defence Equipment and Support","030 679 30206","DESSec-ParliamentaryBusiness@mod.uk","00176079","0","1.00","N/A","N/A","","Procurement","","1"
"00173858","N/D","SCS1","Head Weapons Commercial","Responsible for providing commercial advice and assurance to DES Weapons Director and commercial functional line management to all commercial staff within the Operating Centre.","Ministry of Defence","Ministry of Defence","Defence Equipment and Support","030 679 30206","DESSec-ParliamentaryBusiness@mod.uk","00170773","0","1.00","N/A","N/A","","Procurement","","1"
"00173860","N/D","SCS1","Head Helicopters Commercial","Responsible for providing commercial advice and assurance to DES Helicopters Director and commercial functional line management to all commercial staff within the Operating Centre.","Ministry of Defence","Ministry of Defence","Defence Equipment and Support","030 679 30206","DESSec-ParliamentaryBusiness@mod.uk","00003179","0","1.00","N/A","N/A","","Procurement","","1"
"00174134","N/D","SCS1","Head Submarines Chief Engineer","Responsible for co-ordinating the availability of the engineering resources (standards, people and training) needed to meet the current and future requirements of the Submarine Programme.  Includes oversight of the Combat Systems Group.","Ministry of Defence","Ministry of Defence","Defence Equipment and Support","030 679 30206","DESSec-ParliamentaryBusiness@mod.uk","00184652","0","1.00","N/A","N/A","","Science and Engineering","","1"
"00174689","N/D","SCS1","Head Combat Air Strategic Programmes","Responsible for strategic programmes within Combat Air","Ministry of Defence","Ministry of Defence","Defence Equipment and Support","030 679 30206","DESSec-ParliamentaryBusiness@mod.uk","00051335","0","1.00","N/A","N/A","","Programme and Project Management (PPM)","","1"
"00176079","Vacant","SCS3","Director General Commercial","Responsible for all DE&S commercial business and is Head of Profession for commercial staff across the MOD","Ministry of Defence","Ministry of Defence","Defence Equipment and Support","N/A","N/A","00212421","0","1.00","N/A","N/A","","Operational Delivery","","1"
"00176751","N/D","SCS1","Head HR People Strategy","Responsible for supporting the business through a dedicated HR Business Partner (HRBP) for each Operating Centre; the Centre of Expertise team; and for the Joint Service Support Team (JSST) who support TLB Military Staff by interpreting Military policy and plans for use in the Joint environment.","Ministry of Defence","Ministry of Defence","Defence Equipment and Support","030 679 30206","DESSec-ParliamentaryBusiness@mod.uk","00000001","0","1.00","N/A","N/A","","Human Resources","","1"
"00178267","Vacant","SCS1","Head Materiel Strategy Organisational Design","Responsible for Material Strategy design","Ministry of Defence","Ministry of Defence","Defence Equipment and Support","N/A","N/A","00203390","0","1.00","N/A","N/A","","Programme and Project Management (PPM)","","1"
"00179064","N/D","SCS1","Head Technical Engineering Group","The MOD custodian for the 'System of Systems Approach' Initiative. Responsible for leading on implementing systems and software engineering across Defence; and undertakes the role of Chief System Architect to support Network Enabled Capability and wider defence interoperability.","Ministry of Defence","Ministry of Defence","Defence Equipment and Support","030 679 30206","DESSec-ParliamentaryBusiness@mod.uk","00003321","0","1.00","N/A","N/A","","Science and Engineering","","1"
"00179865","N/D","SCS1","Head SEOC Support Chain Information Services","Responsible for delivering efficient and effective application services across Defence.","Ministry of Defence","Ministry of Defence","Defence Equipment and Support","030 679 30206","DESSec-ParliamentaryBusiness@mod.uk","00018623","0","1.00","N/A","N/A","","Knowledge and Information Management (KIM)","","1"
"00179993","N/D","SCS1","Head Weapons Team Complex Weapons","Responsible for all air defence capability project teams and surface attack project teams within the Team Complex Weapons initiative, plus a number of maritime radar projects.","Ministry of Defence","Ministry of Defence","Defence Equipment and Support","030 679 30206","DESSec-ParliamentaryBusiness@mod.uk","00170773","0","1.00","N/A","N/A","","Programme and Project Management (PPM)","","1"
"00181132","N/D","SCS1","Head Submarines Acquisition Maritime Underwater Future Capability","Responsible for Submarine support","Ministry of Defence","Ministry of Defence","Defence Equipment and Support","030 679 30206","DESSec-ParliamentaryBusiness@mod.uk","00006158","0","1.00","N/A","N/A","","Programme and Project Management (PPM)","","1"
"00182282","N/D","OF-6","Head Land Equipment Soldier Training and Special Programmes","Responsible for the Soldier Training and Special Programmes which equips and supports front line soldiers  with the equipment they need to engage in dismounted close combat, including small arms up to light mortars; surveillance and target acquisition equipment; personal equipment and ancilaries, batteries and hand held photographic equipment.","Ministry of Defence","Ministry of Defence","Defence Equipment and Support","030 679 30206","DESSec-ParliamentaryBusiness@mod.uk","00023490","0","1.00","N/A","N/A","","Military","","1"
"00183045","N/D","SCS1","Head Technology Delivery","Responsible for leading technology and capability investigations and demonstration programmes to expedite the exploitation of technologies into operational capability; and the primary interface within DE&S with the Defence Science and Technology Laboratory.","Ministry of Defence","Ministry of Defence","Defence Equipment and Support","030 679 30206","DESSec-ParliamentaryBusiness@mod.uk","00003321","0","1.00","N/A","N/A","","Science and Engineering","","1"
"00184599","N/D","SCS1","Head ISTAR Programme Delivery Group 3","Responsible for Air Command and Control systems, including Air Defence systems.","Ministry of Defence","Ministry of Defence","Defence Equipment and Support","030 679 30206","DESSec-ParliamentaryBusiness@mod.uk","00003594","0","1.00","N/A","N/A","","Programme and Project Management (PPM)","","1"
"00184652","R Adm Keith Beckett","OF-7","Director Submarines Chief Strategic Systems Executive","Responsible for assisting Chief Strategic Systems Executive in his role in providing assurance to the First Sea Lord for the delivery of Continuous At Sea Deterrence; and for the Submarine Training and Education Programme.","Ministry of Defence","Ministry of Defence","Defence Equipment and Support","030 679 30206","DESSec-ParliamentaryBusiness@mod.uk","00170311","0","1.00","110000","114999","","Military","","1"
"00185268","Vacant","SCS1","Head Air Support Air Systems, Equipment & Training","Responsible for the provision of commodities for all aircraft, including helicopters; the procurement and support of airfield ground vehicles and equipment; the procurement and support of aircraft defensive and targeting aids; and for the delivery and support of flight simulators and synthetic trainers for the majority of air platforms (including helicopters).","Ministry of Defence","Ministry of Defence","Defence Equipment and Support","N/A","N/A","00170429","0","1.00","N/A","N/A","","Procurement","","1"
"00188627","N/D","SCS1","Head Chief Information Officer","Responsible for helping DE&S business units to derive maximum business benefit from their information through the adoption and exploitation of new technologies and ways of working.","Ministry of Defence","Ministry of Defence","Defence Equipment and Support","030 679 30206","DESSec-ParliamentaryBusiness@mod.uk","00003321","0","1.00","N/A","N/A","","Knowledge and Information Management (KIM)","","1"
"00188813","N/D","OF-6","Head Helicopters 3","Responsible for Apache and Chinook project teams and the Helicopter Safety Team.","Ministry of Defence","Ministry of Defence","Defence Equipment and Support","030 679 30206","DESSec-ParliamentaryBusiness@mod.uk","00003179","0","1.00","N/A","N/A","","Military","","1"
"00190286","N/D","SCS1","Head Ships Maritime Combat Systems","Naval Design Partnership lead. Responsible for the delivery and support of surface ship combat systems and equipment fitted to surface ships and submarines;   and provision of Combat Systems subject matter expertise and processes","Ministry of Defence","Ministry of Defence","Defence Equipment and Support","030 679 30206","DESSec-ParliamentaryBusiness@mod.uk","00000066","0","1.00","N/A","N/A","","Programme and Project Management (PPM)","","1"
"00194481","N/D","SCS1","Head Commercial Strategy Coordination","Responsible for DE&S Commercial Strategy","Ministry of Defence","Ministry of Defence","Defence Equipment and Support","030 679 30206","DESSec-ParliamentaryBusiness@mod.uk","00176079","0","1.00","N/A","N/A","","Procurement","","1"
"00195021","N/D","SCS1","Head Materiel Strategy MSP Management","Responsible for Managed Service Provider Management","Ministry of Defence","Ministry of Defence","Defence Equipment and Support","030 679 30206","DESSec-ParliamentaryBusiness@mod.uk","00203390","0","1.00","N/A","N/A","","Programme and Project Management (PPM)","","1"
"00195371","N/D","SCS1","Head Logistics Delivery Programme Management","Responsible for Logistic Delivry Programme Management","Ministry of Defence","Ministry of Defence","Defence Equipment and Support","030 679 30206","DESSec-ParliamentaryBusiness@mod.uk","00198770","0","1.00","N/A","N/A","","Programme and Project Management (PPM)","","1"
"00195864","Vacant","SCS1","Head Chief of Materiel Land JSC and LCS Finance","Finance Head for Chief of Materiel Land Joint Support Chain and Logistic Commodities & Services","Ministry of Defence","Ministry of Defence","Defence Equipment and Support","N/A","N/A","00018623","0","1.00","N/A","N/A","","Finance","","1"
"00198424","Alan Peter","SCS2","Director Commercial Operations","Responsible for commercial activities across DE&S applying best practice mentoring to the 9 Operating Centre (OC) 1* Heads of Commercial.  Engaging with a wide range of stakeholders to promote and enhance the reputation of the profession and organisation, taking the lead in key contract negotiations and utilising combined expertise to assist the OC Commercial and Project teams deliver best value for defence.","Ministry of Defence","Ministry of Defence","Defence Equipment and Support","030 679 30206","DESSec-ParliamentaryBusiness@mod.uk","00176079","0","1.00","130000","134999","","Procurement","","1"
"00198770","Roger West","SCS2","Director Logistics Delivery","Responsible for logistics delivery that meet the needs of our Armed Forces","Ministry of Defence","Ministry of Defence","Defence Equipment and Support","030 679 30206","DESSec-ParliamentaryBusiness@mod.uk","00170310","0","1.00","160000","164999","","Programme and Project Management (PPM)","","1"
"00199122","Tony Doherty","SCS2","Head SEOC Support Chain Processes","Responsible for support chain processes","Ministry of Defence","Ministry of Defence","Defence Equipment and Support","030 679 30206","DESSec-ParliamentaryBusiness@mod.uk","00018623","0","1.00","N/A","N/A","","Operational Delivery","Contractor","1"
"00201481","N/D","SCS1","Chief of Materiel Air Chief Finance Officer","Provides senior financial support for the Chief of Materiel (Air) and acts as a financial focal point within DE&S for the Air domain","Ministry of Defence","Ministry of Defence","Defence Equipment and Support","030 679 30206","DESSec-ParliamentaryBusiness@mod.uk","00172101","0","1.00","N/A","N/A","","Finance","","1"
"00201482","N/D","SCS1","Chief of Materiel Land Chief Finance Officer","Provides senior financial support to the Chief of Materiel (Land) and acts as a financial focal point within DE&S for the Land domain","Ministry of Defence","Ministry of Defence","Defence Equipment and Support","030 679 30206","DESSec-ParliamentaryBusiness@mod.uk","00170310","0","1.00","N/A","N/A","","Finance","","1"
"00201483","N/D","SCS1","Chief of Materiel Fleet Chief Finance Officer","Provides senior financial support to the Chief of Materiel (Fleet) and acts as a financial focal point within DE&S for the Fleet domain","Ministry of Defence","Ministry of Defence","Defence Equipment and Support","030 679 30206","DESSec-ParliamentaryBusiness@mod.uk","00170311","0","1.00","N/A","N/A","","Finance","","1"
"00201484","N/D","SCS1","Chief of Materiel Joint Enablers Chief Finance Officer","Provides senior financial support for the Chief of Materiel (Joint Enablers) and acts as a financial focal point within DE&S for Joint Enablers","Ministry of Defence","Ministry of Defence","Defence Equipment and Support","030 679 30206","DESSec-ParliamentaryBusiness@mod.uk","00003320","0","1.00","N/A","N/A","","Finance","","1"
"00202058","N/D","SCS1","Head Ships Portfolio Office","Provides DES Ships Director with a central service for programming, including management of third order assumptions, planning round activity, managing overall workload and operating a “front door” process for proposed new work.  Ensures activities are aligned with the other maritime Operating Centres in DE&S and  leads a number of central functions including operations and performance management, risk, business planning, information and knowledge management, workforce management, communications and continuous improvement.","Ministry of Defence","Ministry of Defence","Defence Equipment and Support","030 679 30206","DESSec-ParliamentaryBusiness@mod.uk","00000066","0","1.00","N/A","N/A","","Programme and Project Management (PPM)","","1"
"00202147","N/D","SCS1","Head HR Workforce Structure Capability","Responsible for DE&S Resourcing and Strategic Workforce Planning.","Ministry of Defence","Ministry of Defence","Defence Equipment and Support","030 679 30206","DESSec-ParliamentaryBusiness@mod.uk","00000001","0","1.00","N/A","N/A","","Human Resources","","1"
"00202979","N/D","OF-6","Head Air Support A400M","Responsible for the A400M Project Team","Ministry of Defence","Ministry of Defence","Defence Equipment and Support","030 679 30206","DESSec-ParliamentaryBusiness@mod.uk","00170429","0","1.00","N/A","N/A","","Military","","1"
"00203390","Geoffrey Robins","SCS2","Director Transformation","Responsible for MSP contracts and engagement between the DE&S Transformation programme and other MOD-wide change initiatives.","Ministry of Defence","Ministry of Defence","Defence Equipment and Support","030 679 30206","DESSec-ParliamentaryBusiness@mod.uk","00212421","0","1.00","150000","154999","","Programme and Project Management (PPM)","","1"
"00205725","N/D","SCS1","Head Ships Acquisition T26 and OPV","Responsible for the Type 26 Global Combat Ship & Offshore Patrol Vessel Project Teams","Ministry of Defence","Ministry of Defence","Defence Equipment and Support","030 679 30206","DESSec-ParliamentaryBusiness@mod.uk","00004366","0","1.00","N/A","N/A","","Programme and Project Management (PPM)","","1"
"00206392","N/D","SCS1","Head Ships Acquisition QEC","Responsible for QEC acquisition","Ministry of Defence","Ministry of Defence","Defence Equipment and Support","030 679 30206","DESSec-ParliamentaryBusiness@mod.uk","00004366","0","1.00","N/A","N/A","","Programme and Project Management (PPM)","","1"
"00208119","N/D","SCS1","Head Commissioning & Managing Organisation","Responsible for the Logistics Delivery Commissioning Management Organisation","Ministry of Defence","Ministry of Defence","Defence Equipment and Support","030 679 30206","DESSec-ParliamentaryBusiness@mod.uk","00198770","0","1.00","N/A","N/A","","Programme and Project Management (PPM)","","1"
"00208121","N/D","SCS1","Head Commissioning & Managing Organisation - Operations","Responsible for Operations in the Logistics Delivery Commissioning Management Organisaion","Ministry of Defence","Ministry of Defence","Defence Equipment and Support","030 679 30206","DESSec-ParliamentaryBusiness@mod.uk","00198770","0","1.00","N/A","N/A","","Programme and Project Management (PPM)","","1"
"00208651","N/D","SCS1","Head Commercial AWE","Responsible for AWE commercial matters","Ministry of Defence","Ministry of Defence","Defence Equipment and Support","030 679 30206","DESSec-ParliamentaryBusiness@mod.uk","00198424","0","1.00","N/A","N/A","","Procurement","","1"
"00208652","N/D","SCS1","Head Commercial Contract Management","Responsible for Commercial Contract Management","Ministry of Defence","Ministry of Defence","Defence Equipment and Support","030 679 30206","DESSec-ParliamentaryBusiness@mod.uk","00208790","0","1.00","N/A","N/A","","Procurement","","1"
"00208707","N/D","SCS1","Head Commercial Maritime Support","Responsible for Commercial Maritime Support matters","Ministry of Defence","Ministry of Defence","Defence Equipment and Support","030 679 30206","DESSec-ParliamentaryBusiness@mod.uk","00198424","0","1.00","N/A","N/A","","Procurement","","1"
"00208790","Morag Stuart","SCS2","Director Commercial Contract Management","Responsible for Contract Management","Ministry of Defence","Ministry of Defence","Defence Equipment and Support","030 679 30206","DESSec-ParliamentaryBusiness@mod.uk","00176079","0","1.00","N/A","N/A","","Procurement","Contractor","1"
"00208915","N/D","SCS1","Head Disposal Services Authority","Responsible for Disposals","Ministry of Defence","Ministry of Defence","Defence Equipment and Support","030 679 30206","DESSec-ParliamentaryBusiness@mod.uk","00198770","0","1.00","N/A","N/A","","Property and asset management","","1"
"00209288","N/D","SCS1","Head Commercial Professionalism Programme","Responsible for Commercial Professionalism Programme","Ministry of Defence","Ministry of Defence","Defence Equipment and Support","030 679 30206","DESSec-ParliamentaryBusiness@mod.uk","00209289","0","1.00","N/A","N/A","","Programme and Project Management (PPM)","","1"
"00209289","Mike Greatwich","SCS2","Director Commercial Function","Responsible for DE&S Commercial future organisational structure and Commercial Talent Development and Qualification","Ministry of Defence","Ministry of Defence","Defence Equipment and Support","030 679 30206","DESSec-ParliamentaryBusiness@mod.uk","00176079","0","1.00","95000","99999","","Procurement","","1"
"00210906","N/D","SCS1","Head Commercial Contract Management Portfolio","Responsible for the Contract Management portfolio","Ministry of Defence","Ministry of Defence","Defence Equipment and Support","030 679 30206","DESSec-ParliamentaryBusiness@mod.uk","00208790","0","1.00","N/A","N/A","","Procurement","","1"
"00211002","N/D","SCS1","Head Commercial Single Source Acquisition Team","Responsible for consistent implementation of the Single Source Contract Regulations and for liaision with the Single Source Regulations Office.","Ministry of Defence","Ministry of Defence","Defence Equipment and Support","030 679 30206","DESSec-ParliamentaryBusiness@mod.uk","00176079","0","1.00","N/A","N/A","","Procurement","","1"
"00211126","David Ball","SCS2","Director Learning and Talent","Responsible for the identification and development of talent.","Ministry of Defence","Ministry of Defence","Defence Equipment and Support","030 679 30206","DESSec-ParliamentaryBusiness@mod.uk","00212421","0","1.00","100000","104999","","Human Resources","","1"
