"00212068","N/D","SCS1","CEO Chief of Staff","Chief of Staff for DES CEO","Ministry of Defence","Ministry of Defence","Defence Equipment and Support","030 679 30206","DESSec-ParliamentaryBusiness@mod.uk","00212421","0","1.00","N/A","N/A","","Operational Delivery","","1"
"00212094","Eliminated","SCS1","Head SEOC SCE-CET Aviation","Responsible for Aviation Supply Chain Engagement","Ministry of Defence","Ministry of Defence","Defence Equipment and Support","N/A","N/A","00018623","0","1.00","N/A","N/A","","Programme and Project Management (PPM)","","1"
"00212095","Eliminated","SCS1","Head SEOC SCE-CET Maritime","Responsible for Maritime Supply Chain Engagement","Ministry of Defence","Ministry of Defence","Defence Equipment and Support","N/A","N/A","00018623","0","1.00","N/A","N/A","","Programme and Project Management (PPM)","","1"
"00212097","N/D","SCS1","Corporate Head SEOC Integrated Logistics","Corporate functional manager for Integrated Logistics in SEOC","Ministry of Defence","Ministry of Defence","Defence Equipment and Support","030 679 30206","DESSec-ParliamentaryBusiness@mod.uk","00018623","0","1.00","N/A","N/A","","Human Resources","","1"
"00212421","Tony Douglas","SCS4","Chief Executive Officer","Head of DE&S","Ministry of Defence","Ministry of Defence","Defence Equipment and Support","030 679 30206","DESSec-ParliamentaryBusiness@mod.uk","XX","393767148","1.00","285000","289999","","Operational Delivery","","1"
"00213135","N/D","SCS1","Head Commercial Corporate Function","Responsible for functional management of Commercial matters in the Corporate domain.","Ministry of Defence","Ministry of Defence","Defence Equipment and Support","030 679 30206","DESSec-ParliamentaryBusiness@mod.uk","00203390","0","1.00","N/A","N/A","","Planning","","1"
"00213339","N/D","SCS1","Head Submarines Acquisition Project Advance","Responsible for improving the capability of the maritime domain","Ministry of Defence","Ministry of Defence","Defence Equipment and Support","030 679 30206","DESSec-ParliamentaryBusiness@mod.uk","00006158","0","1.00","N/A","N/A","","Planning","","1"
"00213486","N/D","SCS1","Head Air Support Air-ISTAR","Responsible for the delivery and In-service support of Airseeker aircraft;and the In-service support of Sentinel battlefield surveillance aircraft plus ground stations and Sentry airborne early warning aircraft.","Ministry of Defence","Ministry of Defence","Defence Equipment and Support","030 679 30206","DESSec-ParliamentaryBusiness@mod.uk","00170429","0","1.00","N/A","N/A","","Programme and Project Management (PPM)","","1"
"00214168","N/D","SCS1","HR Business Partners Fleet Lead","Responsible for HR key people issues in the Fleet domain","Ministry of Defence","Ministry of Defence","Defence Equipment and Support","030 679 30206","DESSec-ParliamentaryBusiness@mod.uk","00170311","0","1.00","N/A","N/A","","Human Resources","","1"
"00214169","N/D","SCS1","HR Business Partners Air Lead","Responsible for HR key people issues in the Air domain","Ministry of Defence","Ministry of Defence","Defence Equipment and Support","030 679 30206","DESSec-ParliamentaryBusiness@mod.uk","00172101","0","1.00","N/A","N/A","","Human Resources","","1"
"00214170","N/D","SCS1","HR Business Partners Land Lead","Responsible for HR key people issues in the Land domain","Ministry of Defence","Ministry of Defence","Defence Equipment and Support","030 679 30206","DESSec-ParliamentaryBusiness@mod.uk","00214658","0","1.00","N/A","N/A","","Human Resources","","1"
"00214171","N/D","SCS1","HR Business Partners Joint Enablers Lead","Responsible for HR key people issues in the Join Enablers domain","Ministry of Defence","Ministry of Defence","Defence Equipment and Support","030 679 30206","DESSec-ParliamentaryBusiness@mod.uk","00215660","0","1.00","N/A","N/A","","Human Resources","","1"
"00214172","N/D","SCS1","Head HR Business Partners Corporate Functional Management","Corporate functional management of HR people issues","Ministry of Defence","Ministry of Defence","Defence Equipment and Support","030 679 30206","DESSec-ParliamentaryBusiness@mod.uk","00203390","0","1.00","N/A","N/A","","Human Resources","","1"
"00214177","N/D","SCS1","Head Tech Business Process Assurance Corporate Function","Responsible for functional management of Business Processes and Assurance in the Technical domain","Ministry of Defence","Ministry of Defence","Defence Equipment and Support","030 679 30206","DESSec-ParliamentaryBusiness@mod.uk","00003321","0","1.00","N/A","N/A","","Human Resources","","1"
"00214404","N/D","SCS1","Head HR Workforce Planning and Resourcing","Responsible for Workforce Planning and Resourcing","Ministry of Defence","Ministry of Defence","Defence Equipment and Support","030 679 30206","DESSec-ParliamentaryBusiness@mod.uk","00000001","0","1.00","N/A","N/A","","Human Resources","","1"
"00214658","Dan Wood","SCS2","Chief of Materiel Land MSP Chief Operating Officer","Managed Service Provider Chief Operating Office for Chief of Materiel Land","Ministry of Defence","Ministry of Defence","Defence Equipment and Support","030 679 30206","DESSec-ParliamentaryBusiness@mod.uk","00170310","0","1.00","N/A","N/A","","Programme and Project Management (PPM)","Contractor","1"
"00215035","N/D","SCS1","Head Chief of Materiel Air Function Manager Integrated Logistics","Responsible for functional management of Integrated Logistics in the Air domain.","Ministry of Defence","Ministry of Defence","Defence Equipment and Support","030 679 30206","DESSec-ParliamentaryBusiness@mod.uk","00172101","0","1.00","N/A","N/A","","Human Resources","","1"
"00215037","N/D","SCS1","Head Chief of Materiel Fleet Function Manager Integrated Logistics","Responsible for functional management of Integrated Logistics in the Fleet domain.","Ministry of Defence","Ministry of Defence","Defence Equipment and Support","030 679 30206","DESSec-ParliamentaryBusiness@mod.uk","00170311","0","1.00","N/A","N/A","","Human Resources","","1"
"00215039","N/D","SCS1","Head Chief of Materiel Land Function Manager Integrated Logistics","Responsible for functional management of Integrated Logistics in the Land domain.","Ministry of Defence","Ministry of Defence","Defence Equipment and Support","030 679 30206","DESSec-ParliamentaryBusiness@mod.uk","00214658","0","1.00","N/A","N/A","","Human Resources","","1"
"00215041","N/D","SCS1","Head Chief of Materiel Joint Enablers Function Manager Integrated Logistics","Responsible for functional management of Integrated Logistics in the Joint Enablers domain.","Ministry of Defence","Ministry of Defence","Defence Equipment and Support","030 679 30206","DESSec-ParliamentaryBusiness@mod.uk","00215660","0","1.00","N/A","N/A","","Human Resources","","1"
"00215043","N/D","SCS1","Head Project Control Corporate Functional Management","Corporate Function Manager for Project Controls","Ministry of Defence","Ministry of Defence","Defence Equipment and Support","030 679 30206","DESSec-ParliamentaryBusiness@mod.uk","00203390","0","1.00","N/A","N/A","","Programme and Project Management (PPM)","","1"
"00215046","N/D","SCS1","Head Chief of Materiel Air Function Manager Project Control","Responsible for functional management of Project controls in the Air domain.","Ministry of Defence","Ministry of Defence","Defence Equipment and Support","030 679 30206","DESSec-ParliamentaryBusiness@mod.uk","00172101","0","1.00","N/A","N/A","","Programme and Project Management (PPM)","","1"
"00215048","N/D","SCS1","Head Chief of Materiel Fleet Function Manager Project Control","Responsible for functional management of Project controls in the Fleet domain.","Ministry of Defence","Ministry of Defence","Defence Equipment and Support","030 679 30206","DESSec-ParliamentaryBusiness@mod.uk","00170311","0","1.00","N/A","N/A","","Programme and Project Management (PPM)","","1"
"00215050","N/D","SCS1","Head Chief of Materiel Land Function Manager Project Control","Responsible for functional management of Project controls in the Land domain.","Ministry of Defence","Ministry of Defence","Defence Equipment and Support","030 679 30206","DESSec-ParliamentaryBusiness@mod.uk","00214658","0","1.00","N/A","N/A","","Programme and Project Management (PPM)","","1"
"00215051","Vacant","SCS1","Head Chief of Materiel Joint Enablers Function Manager Project Control","Responsible for functional management of Project controls in the Joint Enablers domain.","Ministry of Defence","Ministry of Defence","Defence Equipment and Support","N/A","N/A","00003320","0","1.00","N/A","N/A","","Programme and Project Management (PPM)","","1"
"00215052","N/D","SCS1","Head Finance & Accounting Corporate Functional Management","Responsible for Corporate functional management of Finance and Accounting","Ministry of Defence","Ministry of Defence","Defence Equipment and Support","030 679 30206","DESSec-ParliamentaryBusiness@mod.uk","00003323","0","1.00","N/A","N/A","","Finance","","1"
"00215061","N/D","SCS1","Head Chief of Materiel Air Function Manager Commercial","Responsible for functional management of Commercial matters in the Air domain.","Ministry of Defence","Ministry of Defence","Defence Equipment and Support","030 679 30206","DESSec-ParliamentaryBusiness@mod.uk","00172101","0","1.00","N/A","N/A","","Procurement","","1"
"00215063","N/D","SCS1","Head Chief of Materiel Fleet Function Manager Commercial","Responsible for functional management of Commercial matters in the Fleet domain.","Ministry of Defence","Ministry of Defence","Defence Equipment and Support","030 679 30206","DESSec-ParliamentaryBusiness@mod.uk","00170311","0","1.00","N/A","N/A","","Procurement","","1"
"00215064","Vacant","SCS1","Head Chief of Materiel Land Function Manager Commercial","Responsible for functional management of Commercial matters in the Land domain.","Ministry of Defence","Ministry of Defence","Defence Equipment and Support","N/A","N/A","00170310","0","1.00","N/A","N/A","","Procurement","Fiona Johnson from 01/06/2016","1"
"00215066","Vacant","SCS1","Head Chief of Materiel Joint Enablers Function Manager Commercial","Responsible for functional management of Commercial matters in the JE domain.","Ministry of Defence","Ministry of Defence","Defence Equipment and Support","N/A","N/A","00215660","0","1.00","N/A","N/A","","Procurement","","1"
"00215067","N/D","SCS1","Head Tech Project Management Corporate Function","Responsible for functional management of Project Management in the Technical domain.","Ministry of Defence","Ministry of Defence","Defence Equipment and Support","030 679 30206","DESSec-ParliamentaryBusiness@mod.uk","00003321","0","1.00","N/A","N/A","","Programme and Project Management (PPM)","","1"
"00215068","N/D","SCS1","Head Chief of Materiel Air Function Manager Project Management","Responsible for functional management of Project Management in the Air domain.","Ministry of Defence","Ministry of Defence","Defence Equipment and Support","030 679 30206","DESSec-ParliamentaryBusiness@mod.uk","00172101","0","1.00","N/A","N/A","","Programme and Project Management (PPM)","","1"
"00215070","N/D","SCS1","Head Chief of Materiel Fleet Function Manager Project Management","Responsible for functional management of Project Management in the Fleet domain.","Ministry of Defence","Ministry of Defence","Defence Equipment and Support","030 679 30206","DESSec-ParliamentaryBusiness@mod.uk","00170311","0","1.00","N/A","N/A","","Programme and Project Management (PPM)","","1"
"00215072","N/D","SCS1","Head Chief of Materiel Land Function Manager Project Management","Responsible for functional management of Project Management in the Land domain.","Ministry of Defence","Ministry of Defence","Defence Equipment and Support","030 679 30206","DESSec-ParliamentaryBusiness@mod.uk","00214658","0","1.00","N/A","N/A","","Programme and Project Management (PPM)","","1"
"00215074","N/D","SCS1","Head Chief of Materiel Joint Enablers Function Manager Project Management","Responsible for functional management of Project Management in the Joint Enablers domain.","Ministry of Defence","Ministry of Defence","Defence Equipment and Support","030 679 30206","DESSec-ParliamentaryBusiness@mod.uk","00215660","0","1.00","N/A","N/A","","Programme and Project Management (PPM)","","1"
"00215080","N/D","SCS1","Head Tech Engineering Corporate Function","Corporate Functional Manager for Engineering","Ministry of Defence","Ministry of Defence","Defence Equipment and Support","030 679 30206","DESSec-ParliamentaryBusiness@mod.uk","00203390","0","1.00","N/A","N/A","","Science and Engineering","","1"
"00215082","Vacant","SCS1","Head Chief of Materiel Air Function Manager Engineering","Responsible for functional management of Engineering in the Air domain.","Ministry of Defence","Ministry of Defence","Defence Equipment and Support","N/A","N/A","00172101","0","1.00","N/A","N/A","","Science and Engineering","","1"
"00215084","Vacant","SCS1","Head Chief of Materiel Fleet Function Manager Engineering","Responsible for functional management of Engineering in the Fleet domain.","Ministry of Defence","Ministry of Defence","Defence Equipment and Support","N/A","N/A","00170311","0","1.00","N/A","N/A","","Science and Engineering","","1"
"00215087","N/D","SCS1","Head Chief of Materiel Land Function Manager Engineering","Responsible for functional management of Engineering in the Land domain.","Ministry of Defence","Ministry of Defence","Defence Equipment and Support","030 679 30206","DESSec-ParliamentaryBusiness@mod.uk","00214658","0","1.00","N/A","N/A","","Science and Engineering","","1"
"00215088","Vacant","SCS1","Head Chief of Materiel Joint Enablers Function Manager Engineering","Responsible for functional management of Engineering in the JE domain.","Ministry of Defence","Ministry of Defence","Defence Equipment and Support","N/A","N/A","00003320","0","1.00","N/A","N/A","","Science and Engineering","","1"
"00215090","N/D","SCS1","Head Information Management & Information Technology Corporate Functional Management","Responsible for functional management of Information Management and Information Technology in the Corporate domain.","Ministry of Defence","Ministry of Defence","Defence Equipment and Support","030 679 30206","DESSec-ParliamentaryBusiness@mod.uk","00203390","0","1.00","N/A","N/A","","Knowledge and Information Management (KIM)","","1"
"00215092","N/D","SCS1","Head CEO Corporate Services Corporate Function","Corporate Function Manager for Corporate Services","Ministry of Defence","Ministry of Defence","Defence Equipment and Support","030 679 30206","DESSec-ParliamentaryBusiness@mod.uk","00168616","0","1.00","N/A","N/A","","Human Resources","","1"
"00215094","N/D","SCS1","Head CEO Business Process Assurance Corporate Functional Management","Corporate Function Manager for Business Processes and Assurance","Ministry of Defence","Ministry of Defence","Defence Equipment and Support","030 679 30206","DESSec-ParliamentaryBusiness@mod.uk","00168616","0","1.00","N/A","N/A","","Human Resources","","1"
"00215096","N/D","SCS1","Head Tech Occupational Health, Safety and Environmental Corporate Function","Corporate Function Manager for Occupational Health, Safety and Environmental matters","Ministry of Defence","Ministry of Defence","Defence Equipment and Support","030 679 30206","DESSec-ParliamentaryBusiness@mod.uk","00203390","0","1.00","N/A","N/A","","Human Resources","Peter Adams from 01/08/2016","1"
"00215170","N/D","SCS1","HR Business Partners Corporate Lead","Corporate HR Business Partner Lead","Ministry of Defence","Ministry of Defence","Defence Equipment and Support","030 679 30206","DESSec-ParliamentaryBusiness@mod.uk","00214172","0","1.00","N/A","N/A","","Human Resources","","1"
"00215660","N/D","SCS1","Chief of Materiel Joint Enablers MSP Chief Operating Officer","Managed Service Provider Chief Operating Office for Chief of Materiel Joint Enablers","Ministry of Defence","Ministry of Defence","Defence Equipment and Support","030 679 30206","DESSec-ParliamentaryBusiness@mod.uk","00003320","0","1.00","N/A","N/A","","Programme and Project Management (PPM)","Contractor","1"
"01462808","Vacant","OF-6","Head Fleet Customer Support Team","Responsible for providing a 24/7 focal point for Defect Management and Crisis Response in support of Navy Command, providing business support to COM Fleet and developing and delivering the Navy Command Joint Business Agreement along with the associated monitoring and reporting of Maritime Performance and Risk.","Ministry of Defence","Ministry of Defence","Defence Equipment and Support","N/A","N/A","00170311","0","1.00","N/A","N/A","","Operational Delivery","","1"
