"Post Unique Reference","Name","Grade (or equivalent)","Job Title","Job/Team Function","Parent Department","Organisation","Unit","Contact Phone","Contact E-mail","Reports to Senior Post","Salary Cost of Reports (£)","FTE","Actual Pay Floor (£)","Actual Pay Ceiling (£)","","Professional/Occupational Group","Notes","Valid?"
"DWP135","ROBERT DEVEREUX","SCS4","Permanent Secretary","Overall leadership of the Department, and its day to day operations and the Government's programme of major reform.","Department for Work and Pensions","Department for Work and Pensions","Private Office","020 7449 5517","strategy@dwp.gsi.gov.uk","XX","190134","1.00","180000","184999","","Operational Delivery","","1"
"DWP123","DEBBIE ALDER","SCS3","Director General, Human Resources","Responsible for delivering an HR service to the Department’s 100,000 employees and management. Ensures that this HR service is cost-effective and supports the customer-focused delivery of the Department’s activities.","Department for Work and Pensions","Department for Work and Pensions","Human Resources","0207 449 5173","hr@dwp.gsi.gov.uk","DWP135","246634","1.00","125000","129999","","Operational Delivery","","1"
"DWP295","HOWARD SHIPLEE","SCS3","Director General for the Universal Credit Programme","Responsible for managing the progressive national rollout and live support of the Universal Credit Pathfinder Service.","Department for Work and Pensions","Department for Work and Pensions","Change","020 7340 4339","universal.creditcomms@dwp.gsi.gov.uk","DWP135","102000","1.00","195000","199999","","Human Resources","","1"
"DWP187","JEREMY MOORE","SCS3","Director General Strategy,Policy and Analysis Group","Advises and supports Ministers and the Executive Team in the formulation and deliverability of policy relating to the Government’s welfare, work and pension reforms as well as the social justice agenda, including looking beyond the individual reforms already underway.","Department for Work and Pensions","Department for Work and Pensions","Strategy","020 7449 5517","strategy@dwp.gsi.gov.uk","DWP135","972480","1.00","140000","144999","","Other","","1"
"DWP315","KEVIN CUNNINGTON","SCS3","Director General for Digital Transformation Group","Digital Transformation Group is responsible for defining the Department's vision, business strategy and future business design; defining the transformation roadmap and delivery methods; managing, assuring, and leading the Department's portfolio of change and assessing change proposals; supporting and building secure, common digital services with embedded customer insight; defining new capability requirements and supporting their development.","Department for Work and Pensions","Department for Work and Pensions","Business Transformation Group","020 7449 5782","strategy@dwp.gsi.gov.uk","DWP135","622841","1.00","150000","154999","","Finance","","1"
"DWP99","MIKE DRIVER","SCS3","Director General, Finance and Chief Financial Officer","Responsible for financial planning, performance management, procurement, estates provision, investment portfolio and risk assurance across the Department. Responsible for the financial control environment for benefit payments totalling over £150 billion and for the departmental financial management processes controlling a Departmental Expenditure limit of £7.8 billion. Holds direct budgetary responsibility for an operating and capital budget of £600m.","Department for Work and Pensions","Department for Work and Pensions","Finance Group","0207 449 5173","finance@dwp.gsi.gov.uk","DWP135","142245","1.00","140000","144999","","Programme and Project Management (PPM)","","1"
"DWP202","NOEL SHANAHAN","SCS3","Director General, DWP Operations and SRO for the Child Maintenance Change Programme","Responsible for the development and provision of DWP's services to the public, including those provided by partners or under contract. Also Senior Responsible Owner for the Child Maintenance Change Programme.","Department for Work and Pensions","Department for Work and Pensions","Operations - Other","020 7449 5517","correspondence@dwp.gsi.gov.uk","DWP135","273178","1.00","160000","164999","","Policy","","1"
"DWP116","ALISON STANLEY","SCS2","HR Director, Civil Service Employee Policy","Civil Service Employee Policy was set up on 01 April 2011 as one of the Expert Services under Civil Service HR. We provide a professional and specialist service across government departments to develop and maintain the civil service framework of people policies and practice. Working closely with government departments, we deliver simplified, rationalised policies, including guidance and support with implementation. We also offer an Expert Advice Service to deliver the Civil Service Reform priorities to Cabinet Office and departments.","Department for Work and Pensions","Department for Work and Pensions","CSEP","020 7340 4339","hr@dwp.gsi.gov.uk","DWP123","22190","1.00","110000","114999","","Human Resources","","1"
"DWP108","ANDREW FORZANI","SCS2","DWP Commercial Director","Accountable for all DWP commercial activity and performance, providing commercial assurance for annual business worth around £3.4 billion.  Leadership of a Commercial Directorate covering sourcing and contract management of contracts to deliver best VFM services to DWP which support DWP operational, efficiency and Welfare Reform objectives.  Leadership of the DWP procurement profession and DWP commercial, sustainability and travel policy and strategies.   Crown Commercial Representative for Tata.  Key objectives are to improve DWP commercial capability, improve DWP contract service delivery, reduce DWP third party expenditure and use DWP procurement to promote economic growth.","Department for Work and Pensions","Department for Work and Pensions","Finance Group","020 7449 5782","finance@dwp.gsi.gov.uk","DWP99","4277259","1.00","110000","114999","","Finance","","1"
"DWP28","ANGELA MACDONALD","SCS2","Director for Operational Excellence","Operational Excellence has 2 primary roles: accountability for the service integrity of the benefit system (fraud and error and security) and for driving up operational excellence across the whole of operations. The Directorate is split into 4 areas: Fraud & Error Service, Central Operations, Service Design & Management and Change & Implementation.","Department for Work and Pensions","Department for Work and Pensions","Operations - Operational Excellence","0207 449 5173","correspondence@dwp.gsi.gov.uk","DWP202","1387280","1.00","100000","104999","","Operational Delivery","","1"
"DWP304","ANN HARRIS","SCS2","Universal Credit Programme Director","The Programme Director is responsible, and held acount by the SRO, for the successful delivery of the day to day running of the Programme, delivery of the Programme objectives, monitoring benefits realised against the Business case.The Programme Director is also responsible for the overall integrity and coherence of the Programme, providing leadership, direct line management of project strand leads, chair governance boards/meetings and engagement with key internal and external delivery partners and stakeholders.","Department for Work and Pensions","Department for Work and Pensions","Change","0207 449 5173","universal.creditcomms@dwp.gsi.gov.uk","DWP295","140809","1.00","90000","94999","","Programme and Project Management (PPM)","","1"
"DWP149","BILL GUNNYEON","SCS2","Director, Health and Wellbeing","Responsible for medical and health related advice to Ministers and the Department; for quality of all medical related work including oversight of quality of work of medical services contractor; for medical and health related policy within the Department;  for leading the health, work and wellbeing agenda on behalf of the Department; for oversight of all science based research as Departmental Chief Scientific Adviser; and for external relationships with healthcare professional bodies and other key stakeholders.","Department for Work and Pensions","Department for Work and Pensions","Strategy","020 7449 7720","strategy@dwp.gsi.gov.uk","DWP187","0","1.00","100000","104999","","Policy","","1"
"DWP192","CHARLOTTE CLARK","SCS2","Director of Private Pensions","Responsible for developing a regime that supports increased pension saving and minimises the burden on employers. Responsibility for delivering a major reform  starting in October 2012 when on a staged basis all employers, starting with the largest, will be required to automatically enrol their work force into a pension. Unless the employee chooses to opt out employer and employee will be required to make a minimum contribution to the pension. The team are overseeing the development of a new low cost pension – National Employment Savings Trust. The team is also responsible, with the Pensions Regulator and the Pension Protection Fund for ensuring an effective regime for pension protection.","Department for Work and Pensions","Department for Work and Pensions","Strategy","020 7449 5517","strategy@dwp.gsi.gov.uk","DWP187","3763392","1.00","140000","144999","","Policy","","1"
"DWP178","CHRIS HAYES","SCS2","Labour Market & Conditionality Director","Responsible for leading on the overall DWP strategy for the labour market for now and under Universal Credit; the labour market regimes for working age claimants; and DWP work across government and with external partners to achieve better outcomes for young people and working age claimants.","Department for Work and Pensions","Department for Work and Pensions","Strategy","020 7449 5517","strategy@dwp.gsi.gov.uk","DWP187","5474764","1.00","130000","134999","","Policy","","1"
"DWP231","CHRISTINE FORSTER","SCS2","Operations Director","The Operations Director is responsible for providing direction to the operation of the current statutory schemes and for the delivery of performance indicators and service standards.  This means delivering improved client service whilst continuing to achieve efficiencies.  Responsible for influencing the design, development and content of the new statutory scheme programmes to ensure they are fit for purpose and deliver planned efficiencies and operational management of the new scheme following its introduction.","Department for Work and Pensions","Department for Work and Pensions","Operations - CMG","0207 340 4206","transparency.questions@childmaintenance.gsi.gov.uk","DWP203","522347","1.00","85000","89999","","Operational Delivery","","1"
"DWP148","DAVID FRAZER","SCS2","Director of Information, Governance and Security","Responsible for helping DWP to make best use of its information, whilst complying with obligations to keep it safe, secure and used only where we have legal powers to do so. The Directorate provides a range of services to support this, including the production of statistics; management information; information architecture; analytical data bases; data matching; records management; and library services . It also provides the department with expert advice on security;  business continuity; policies on information; its governance framework; and managing relationships with its arms length bodies and the devolved administrations.","Department for Work and Pensions","Department for Work and Pensions","Finance Group","020 7449 5782","finance@dwp.gsi.gov.uk","DWP99","236857","1.00","95000","99999","","Finance","","1"
"DWP14","GRAEME WALLACE","SCS2","Pensions Director","Responsible for the payment of State Pension, Attendance Allowance and Carers Allowance. Pay out £98 billion annually including; £79.9 billion in State Pension (SP) to 12.6 million customers; £7.7 billion in Pension Credit (PC) to 2.5 million customers; £5.5 billion in Attendance Allowance (AA) to 1.6 million customers; £2.8 billion in ‘one-off payments’ (Winter Fuel, Christmas Bonus etc); and £1.9 billion in Carer’s Allowance (CA) to 633,000 households. processing 5,500 Claims, and 29,000 Change of Circs. Includes administering State Pension to 1.2 million customers and Working Age benefits to 20,000 customers in 210 countries. Also handle 740,000 calls per year from Working Age customers, and issue 500,000 Individual Pension Statements and 70,000 Pension Traces. Also work with over 400 Pension providers to issue 4 million Combined Pensions Statements a year to Future Pensioners","Department for Work and Pensions","Department for Work and Pensions","Operations - Pensions","0207 449 5173","universal.creditcomms@dwp.gsi.gov.uk","DWP202","100372194","1.00","85000","89999","","Operational Delivery","","1"
"DWP127","IAN PAVEY","SCS2","HR Director, Change & Business Transformation","To provide appropriate HR interventions to enable the delivery of the department's major change programmes, to manage the people impacts of change and the delivery of the people plan. Also to provide HR Business partner services to the Change functions and programmes.","Department for Work and Pensions","Department for Work and Pensions","Human Resources","020 7340 4339","hr@dwp.gsi.gov.uk","DWP123","190134","1.00","115000","119999","","Human Resources","","1"
"DWP204","IAN WRIGHT","SCS2","Change Director","The Change Directorate leads the implementation of major change projects, ensuring that projects are delivered to time and to budget.","Department for Work and Pensions","Department for Work and Pensions","Operations - CMG","020 7449 5782","transparency.questions@childmaintenance.gsi.gov.uk","DWP203","273178","1.00","115000","119999","","Operational Delivery","","1"
"DWP106","JACINDA HUMPHRY","SCS2","Director, Departmental Planning and Performance Management","Leads negotiations with HM Treasury on Departmental funding; advises Ministers and the Executive team on the allocation and management of resources across the Department; reports internally and externally on the Department’s performance; and provides financial, planning and performance management support to the Department’s Strategy function.","Department for Work and Pensions","Department for Work and Pensions","Finance Group","020 7449 5782","finance@dwp.gsi.gov.uk","DWP99","246634","1.00","100000","104999","","Finance","","1"
"DWP249","JASON FEENEY","SCS2","Benefits Director","Responsible for the delivery of all working age benefits including Jobseekers Allowance, Employment Support Allowance, Income Support, Disability Living Allowance and Personal Independence Payment. Accountable for the accurate payment of c.£30 billion of expenditure and the leadership of 22,000 staff across 72 sites. Senior Responsible Owner for Personal Independence Payment, Appeals Reform and Spend to Save.","Department for Work and Pensions","Department for Work and Pensions","Operations - Benefits","0207 449 7516","correspondence@dwp.gsi.gov.uk","DWP202","622841","1.00","105000","109999","","Operational Delivery","","1"
"DWP102","JOHN PORTEOUS","SCS2","Finance Director, Corporate and Change","To lead a qualified team of finance professionals to ensure that the Department delivers value for money across the Corporate Centre and Change portfolio.","Department for Work and Pensions","Department for Work and Pensions","Finance Group","020 7449 5782","finance@dwp.gsi.gov.uk","DWP99","0","1.00","110000","114999","","Finance","","1"
"DWP317","JOHN-PAUL MARKS","SCS2","Universal Credit Programme Manager","To lead the Programme Management function to provide planning and programme controls that secure integrated delivery and robust monitoring; develop, maintain and execute the programme’s stakeholder & partner management strategy; lead the programme’s response to the 2013 People Survey; build the programme’s internal communications activity.","Department for Work and Pensions","Department for Work and Pensions","Change","0207 449 5173","universal.creditcomms@dwp.gsi.gov.uk","DWP304","0","1.00","85000","89999","","Programme and Project Management (PPM)","","1"
"DWP101","JON FUNDREY","SCS2","Financial Controller","Financial Control provides regular financial and performance reports to business partners, enabling them to support the business to manage resources, control costs and drive performance.We produce the Department’s Resource Accounts; advise on risk and control; provide banking services, resolve payment issues and manage the relationship with the department’s shared service provider","Department for Work and Pensions","Department for Work and Pensions","Finance Group","020 7449 5782","finance@dwp.gsi.gov.uk","DWP99","203914","1.00","125000","129999","","Finance","","1"
"DWP265","JONATHAN LINDLEY","SCS2","Director, Programme & Project Core Services, DWP IT","Accountable for delivery of consistent core services to IT Project Managers in DWP, and for liaison with Business Change Directors.","Department for Work and Pensions","Department for Work and Pensions","Change","0207 449 7892","pmd.planningandperformance@dwp.gsi.gov.uk","DWP76","2699297","1.00","125000","129999","","Programme and Project Management (PPM)","","1"
"DWP298","JONATHAN RUSSELL","SCS2","Director HR Services","Responsible for (1) the development & delivery of HR Policy including Pay & Reward strategy; (2) the provision of services on HR performance & resource planning, business & HR management intelligence; (3) the management of a range of departmental health/ wellbeing contracts covering 17 Govt Departments; (4) the leadership of the DWP HR Casework Service, Reasonable Adjustments Team & the HR Mediation/ Investigation Service; (5) the lead on Employee Relations and Health & Safety; (6) to ensure effective & efficient provision of services provided by Shared Services in DWP & X-government & compliance to Departmental governance & assurance requirements; the effective & efficient service provision from Civil Service Learning; Civil Service Resourcing, MyCSP  & (7) to oversee the strategic direction & delivery of the DWP & cross-Civil Service Diversity & Equality agenda.","Department for Work and Pensions","Department for Work and Pensions","Human Resources","020 7340 4339","hr@dwp.gsi.gov.uk","DWP123","5208696","1.00","85000","89999","","Human Resources","","1"
"DWP338","JUSTIN RUSSELL","SCS2","Director, ESA Directorate","Responsibility for policy development and programme delivery in relation to Employment Support Allowance and Work Capability Assessment.","Department for Work and Pensions","Department for Work and Pensions","Strategy","020 7449 7720","strategy@dwp.gsi.gov.uk","DWP187","332933","1.00","100000","104999","","Policy","","1"
"DWP277","KAREN GOSDEN","SCS2","Director Stakeholder Management","Responsible for, Internal and external partner and stakeholder management including: Other Government Departments, Devolved administrations, 
Local Authorities, Ministers and Lobby Groups. Briefing and support for, Parliamentary correspondence, Freedom of Information etc Internal and external communications.","Department for Work and Pensions","Department for Work and Pensions","Change","0207 449 5173","universal.creditcomms@dwp.gsi.gov.uk","DWP304","0","1.00","85000","89999","","Programme and Project Management (PPM)","","1"
"DWP300","KATHRYN PRITCHARD","SCS2","Director of HR Strategy & Organisation Development","Lead the development & delivery of the DWP People Strategy & operating model for HR.  Provide strategic & functional leadership to the Corporate HR Business Partners, including driving through organisational changes & providing the ‘voice’ of the Corporate Centre to the HR Executive team.  Provide strategic HR support to change activities across the Department through the Change Programme and other major programmes of change within the Department.  Provide effective & efficient processes for prioritising the work of the HR Function and the allocation of HR resources to key Departmental priorities.  Lead the work on defining, agreeing and monitoring the performance framework for HR ensuring that the outcomes delivered by HR support business performance.  Act as the Finance Director and Business support office for Corporate HR.","Department for Work and Pensions","Department for Work and Pensions","Human Resources","020 7340 4339","hr@dwp.gsi.gov.uk","DWP123","4247346","1.00","120000","124999","","Human Resources","","1"
"DWP77","KENNY ROBERTSON","SCS2","IT Director","Accountable for: DWP IT Strategy and Architecture and financial, delivery and operational performance of IT systems and services of; corporate business; Shared Services; and DWP Cross-Government IT systems and services.","Department for Work and Pensions","Department for Work and Pensions","Corporate IT","0207 449 7892","pmd.planningandperformance@dwp.gsi.gov.uk","DWP76","1467725","1.00","135000","139999","","Information Technology","","1"
"DWP171","MARK FISHER","SCS2","Social Justice Director","Responsible for leading the DWP team supporting the Secretary of State for Work and Pensions in respect of his cross-Government responsibilities for social justice and child poverty.","Department for Work and Pensions","Department for Work and Pensions","Strategy","020 7340 4339","hr@dwp.gsi.gov.uk","DWP187","0","1.00","125000","129999","","Policy","","1"
"DWP104","MARK RIPLEY","SCS2","Head of Internal Audit","Delivery of a professional Internal Audit service to provide an independent view on the adequacy and effectiveness of the Department’s governance, risk and control arrangements. Establishment of the European Social Fund Audit Authority for the England and Gibraltar programme, in accordance with EC requirements. Provision of independent and robust investigation of serious fraud and wrongdoing by the Department’s staff and contractors.","Department for Work and Pensions","Department for Work and Pensions","Finance Group","0207 449 7892","pmd.planningandperformance@dwp.gsi.gov.uk","DWP99","4781513","1.00","90000","94999","","Finance","","1"
"DWP183","MARY PATTISON","SCS2","Ageing Society & State Pensions Director","The Directorate is responsible for State Pensions policy and legislation, supporting Ministers in their overall reform of the State Pensions system and developing and modelling options for reform of the State Pensions system in support of Ministerial objectives of equality and fairness and Older People & the Ageing Society Strategy Division.","Department for Work and Pensions","Department for Work and Pensions","Strategy","020 7449 5517","strategy@dwp.gsi.gov.uk","DWP187","7555635","1.00","85000","89999","","Policy","","1"
"DWP263","MIKE BAKER","SCS2","Universal Credit Operations Director","Accountable for the operational delivery of Universal Credit services to UK citizens.","Department for Work and Pensions","Department for Work and Pensions","Operations - Universal Credit","0207 449 5173","universal.creditcomms@dwp.gsi.gov.uk","DWP202","0","1.00","85000","89999","","Operational Delivery","","1"
"DWP79","MIKE TRURAN","SCS2","Corporate IT Service Delivery Director","The Service Delivery Director takes overall leadership and accountability for the success of DWP IT services by defining, maintaining and improving those services, managing the overall performance and supporting and assuring delivery of new services. Manages stakeholder requirements via best value from the Department’s suppliers and delivery of a modern IT operations capability and industry standard best practice.","Department for Work and Pensions","Department for Work and Pensions","Corporate IT","0207 449 7892","pmd.planningandperformance@dwp.gsi.gov.uk","DWP76","0","1.00","130000","134999","","Information Technology","","1"
"DWP19","MYRTLE LLOYD","SCS2","Network Services Director","The team is accountable for the delivery and management of DWP services across a virtual, multi-channel network comprising telephone and digital services. They are responsible for ensuring that these services are delivered efficiently and coherently to required customer service standards, ensuring that business targets and objectives are met and constantly measured for sustained performance improvement. The team also has responsibility for driving the transformation of DWP business from a face to face and telephony business to one where online channels become the contact method of choice for customers and claimants, where appropriate.","Department for Work and Pensions","Department for Work and Pensions","Operations - Network Services","0207 449 5173","correspondence@dwp.gsi.gov.uk","DWP202","0","1.00","90000","94999","","Operational Delivery","","1"
"DWP29","NEIL COULING","SCS2","Work Services Director DWP","Responsible for the delivery of face-to-face services through Jobcentres, partnerships, and the visiting service. Accountable for the overall Working Age customer experience, ensuring coherence across the services provided to working age claimants by the Network Services Director, the Contracted Customer Services Director, the Benefits Director and the Operational Excellence Director. Personally accountable as: Senior Responsible Owner (SRO) for the Labour Market change programme and Earned Autonomy, which is delivering greater flexibility for Jobcentre Plus Districts;  Senior User Executive for the Universal Credit Programme, helping to ensure the voice of Operations is properly represented and that proposals are deliverable.","Department for Work and Pensions","Department for Work and Pensions","Operations - Work Services Other","0207 449 7516","correspondence@dwp.gsi.gov.uk","DWP202","14507403","1.00","100000","104999","","Programme and Project Management (PPM)","","1"
"DWP157","PAUL MCCOMB","SCS2","Principal Private Secretary to the Secretary of State/running DWP Private Office","Provision of advice and support to the Secretary of State, Departmental Ministers, the Permanent Secretary and Departmental Board.","Department for Work and Pensions","Department for Work and Pensions","Private Office","020 7449 7720","strategy@dwp.gsi.gov.uk","DWP135","1556890","1.00","85000","89999","","Policy","","1"
