"DWP100","N/D","SCS1","Head of Commercial Strategy and Business Management","Responsible for DWP commercial strategy and the business management of the DWP Commercial Directorate.  Leadership of teams providing commercial strategy, policy, best practice and e-solutions covering all DWP commercial activity, sustainability and climate change strategies. Also management of teams that plan and manage the DWP Commercial Directorate, including work prioritisation, resource management and people development. Key objectives are reducing procurement costs, lean processes, maximising commercial assurance and value for money for the taxpayer and achievement of DWP sustainability, climate change and carbon reduction targets.","Department for Work and Pensions","Department for Work and Pensions","Finance Group","020 7449 5782","finance@dwp.gsi.gov.uk","DWP108","5617328","1.00","85000","89999","","Finance","","1"
"DWP111","N/D","SCS1","Deputy Director, Funding and Spending Strategy Division","Overall leadership of DWP’s input to major fiscal events and advising Ministers and the Executive Team on the department's funding and spending strategy.  This includes oversight of the Department’s DEL and AME planning and lead responsibility for the Department’s relationship with HM Treasury.","Department for Work and Pensions","Department for Work and Pensions","Finance Group","020 7449 5782","finance@dwp.gsi.gov.uk","DWP106","0","1.00","80000","84999","","Finance","","1"
"DWP309","N/D","SCS1","Head of Universal Credit & Automated Service Delivery","To provide professional accountancy support to programme managers, delivering key welfare reform projects so that investment costs represent value for money, are affordable and projected spend is controlled ensuring delivery to time, budget and quality.","Department for Work and Pensions","Department for Work and Pensions","Finance Group","020 7449 5782","finance@dwp.gsi.gov.uk","DWP102","0","1.00","80000","84999","","Finance","","1"
"DWP42","N/D","SCS1","Work Services Director, Scotland (DWP Operations)","The main purpose of the Work Services Director role is to drive performance across the Jobcentre network, and to provide senior leadership across Scotland. Ultimately accountable for the end to end customer experience and customer services delivered through local Jobcentres and other service outlets, including advisory services, financial assessment and help with job search; ensuring that all face to face customer contacts are undertaken to required standards, within budget, headcount and against all agreed operational targets. Further accountable for services to employers and for relationships with key partners to support the successful delivery of DWP objectives.","Department for Work and Pensions","Department for Work and Pensions","Operations - Work Services Scotland","0207 449 7516","correspondence@dwp.gsi.gov.uk","DWP29","0","1.00","70000","74999","","Information Technology","","1"
"DWP210","N/D","SCS1","Head of Family Policy Division","The purpose of the Social Justice Policy team is to develop policy on family-related aspects of Social Justice by identifying the root causes of disadvantage that follow from family challenges, and to use that knowledge to prevent disadvantage from arising and to help people turn their lives around where it does.","Department for Work and Pensions","Department for Work and Pensions","Strategy","0207 340 4206","transparency.questions@childmaintenance.gsi.gov.uk","DWP171","4590992","1.00","70000","74999","","Policy","","1"
"DWP335","N/D","SCS1","Head of Unversal Jobmatch","Universal Jobmatch was launched in November 2012 and is one of the largest jobsites in the UK. DWP has made UJ part of the government’s plan for providing easy online access to government services for all and it is available to all UK employers and job seekers, 24 hours a day, 7 days a week. Universal Jobmatch streamlines our existing services for employers, is available to all people looking for work whether they are claiming benefits or in work, and empowers claimants to take more responsibility for their jobsearch and get more targeted support from advisers. All services offered to jobseekers or employers/recruiters are available free of charge at the point of contact.","department for Work and Pensions","Department for Work and Pensions","Business Transformation Group","0207 340 4206","strategy@dwp.gsi.gov.uk","DWP315","0","1.00","75000","79999","","Policy","","1"
"DWP39","N/D","SCS1","Head of Fraud Investigation Service","Fraud Investigation Service investigates potential fraudulent attacks against all benefits owned by DWP or administered on behalf of DWP. It works in partnership with Local Authorities, other Government Departments, including HMRC, the Police and other relevant bodies. It also conducts financial investigations, referred by a criminal investigator or in accordance with directives from the courts with a view to recovering money illegally obtained through criminal activity.","Department for Work and Pensions","Department for Work and Pensions","Operations - Operational Excellence","0207 449 5173","correspondence@dwp.gsi.gov.uk","DWP28","101252277","1.00","65000","69999","","Operational Delivery","","1"
"DWP159","N/D","SCS1","Head of Information Management, Devolution and Governance Division","Information Management, Devolution and Governance Division enables the DWP to use the information it is responsible for effectively and lawfully. When it is appropriate the Division facilitates the release of information into the public domain. Its centres of expertise also ensure the Department’s stewardship teams exercise appropriate oversight over DWP's Non–Departmental Public Bodies and support DWP in developing successful relationships with the UK’s devolved governments in Scotland, Wales and Northern Ireland. Additionally the Division's governance policies and assurance controls ensure Departmental accountabilities are defined, assurance controls are thorough and challenged, following best practice and mandatory policy.","Department for Work and Pensions","Department for Work and Pensions","Finance Group","020 7449 5782","finance@dwp.gsi.gov.uk","DWP148","2652584","1.00","65000","69999","","Finance","","1"
"DWP1811","N/D","SCS1","Deputy Director, EU & International Affairs","The current role of the EUIA division is to promote UK employment, labour market and social policies across the EU and internationally; shape European and international rules, standards and services in the field of employment and social affairs to be as effective, proportionate and evidence-based as possible; and, manage policy as regards migrants’ access to the UK benefit system.","Department for Work and Pensions","Department for Work and Pensions","Strategy","020 7449 5517","strategy@dwp.gsi.gov.uk","DWP178","0","1.00","65000","69999","","Policy","","1"
"DWP1831","N/D","SCS1","Head of Labour Market Intervention Strategy","To develop and evaluate labour market interventions which will move people on DWP benefits into work or more or better paid work; and to provide advice to Ministers and others on these issues.","Department for Work and Pensions","Department for Work and Pensions","Change","0207 449 5173","universal.creditcomms@dwp.gsi.gov.uk","DWP304","0","1.00","85000","89999","","Programme and Project Management (PPM)","","1"
"DWP25","N/D","SCS1","Work Services Director","Leads a team of 6900 staff with a £278m budget to deliver against 37 DWP targets across Central England.  This patch covers 52% of the DWP area and leads 147 Jobcentres.  The main aim is to help unemployed people on JSA, IS and ESA benefits into a job.","Department for Work and Pensions","Department for Work and Pensions","Operations - Work Services Central England","0207 449 7516","correspondence@dwp.gsi.gov.uk","DWP29","136725809","1.00","75000","79999","","Operational Delivery","","1"
"DWP89","N/D","SCS1","Business Partner, Pensions and Operational Excellence","To provide finance business partner support for Pensions Operational Delivery and Operational Excellence Directorate, in terms of Finance, Planning and Performance Management with necessary challenge and support to embed a value for money ethos in those business areas.","Department for Work and Pensions","Department for Work and Pensions","Finance Group","020 7449 5782","finance@dwp.gsi.gov.uk","DWP305","0","1.00","75000","79999","","Finance","","1"
"DWP146","N/D","SCS1","Deputy Director of Communications - Social Justice, Disability and overarching Stakeholder Relations","Communications handling, advice and provision of marketing for the Department.","Department for Work and Pensions","Department for Work and Pensions","Communications & FLDM","020 7449 7720","strategy@dwp.gsi.gov.uk","DWP158","56321","1.00","70000","74999","","Communications","","1"
"DWP78","N/D","SCS1","IT Transformation Technical Programme Manager","IT Transformation.  Leading the IT Transformation Programme to deliver IT services to support DWP","Department for Work and Pensions","Department for Work and Pensions","Corporate IT","0207 449 7892","pmd.planningandperformance@dwp.gsi.gov.uk","DWP265","0","1.00","85000","89999","","Information Technology","","1"
"DWP142","N/D","SCS1","Head of Forecasting","Responsible for forecasting expenditure on all state benefits and pensions within DWP’s remit, and in most cases the equivalents for Northern Ireland. This is undertaken for the Office for Budget Responsibility and HM Treasury as well as DWP itself. Also responsible for forecasting business volumes (e.g. claims, changes of circumstance, numbers passing particular qualification thresholds for labour market programmes) for all of DWP, and the associated appeals for the Tribunals Service. And provision of information on benefit expenditure to Parliament and other organisations and individuals.","Department for Work and Pensions","Department for Work and Pensions","Strategy","020 7449 7720","strategy@dwp.gsi.gov.uk","DWP152","0","1.00","80000","84999","","Policy","","1"
"DWP115","N/D","SCS1","Business Partner, Benefits & Network Services","To provide professional, evidence based, decision making support, challenge and professional advice to the Directorate on all aspects of financial management, performance and risk. This is achieved by leading and coordinating on a range of business disciplines – Financial Management and Control, Performance Management, risk management and oversight of assurance and Governance.","Department for Work and Pensions","Department for Work and Pensions","Finance Group","020 7449 5782","finance@dwp.gsi.gov.uk","DWP305","0","1.00","75000","79999","","Finance","","1"
"DWP198","N/D","SCS1","Deputy Director of Communications - Labour Market Operations","Delivering strategic communications & marketing for the Government's employment programmes including Youth Contract & Work Programme. Responsibility for strategic communications on Benefit Cap, Fraud & Error & promoting digital services.  Leading team delivering a range of communications into DWP Operations & acting as communications business partner to the Operational Executive Team.","Department for Work and Pensions","Department for Work and Pensions","Communications & FLDM","020 7449 7720","strategy@dwp.gsi.gov.uk","DWP158","3587910","1.00","70000","74999","","Communications","","1"
"DWP50","N/D","SCS1","Personal Independence Payment Programme Manager","To programme manage the Personal Independence Payment Implementation programme.","Department for Work and Pensions","Department for Work and Pensions","Change","020 7449 5517","universal.creditcomms@dwp.gsi.gov.uk","DWP249","0","1.00","70000","74999","","Programme and Project Management (PPM)","","1"
"DWP6","N/D","SCS1","Deputy Director, Stakeholder & Partner Management, Universal Credit Programme","To develop the implementation strategy, detailed implementation approach and supporting implementation plans for Universal Credit","Department for Work and Pensions","Department for Work and Pensions","Change","0207 449 5173","universal.creditcomms@dwp.gsi.gov.uk","DWP6","0","1.00","65000","69999","","Programme and Project Management (PPM)","","1"
"DWP88","N/D","SCS1","Head of Business Intelligence Centre","BI is a single, integrated finance function to provide high quality financial, performance and productivity information throughout the Department and for external reporting.  BI undertake all routine Financial and Performance reporting (data gathering and production) at the business unit and DWP level, providing ‘one version of the truth’ for the Departments' financial and non-financial information, eliminating duplication and ensuring sign off from the respective business owners.  BI conduct initial Level 1 challenge and analysis and ensure that the messages and datasets are consistent, accurate and complete.","Department for Work and Pensions","Department for Work and Pensions","Finance Group","020 7449 5782","finance@dwp.gsi.gov.uk","DWP101","8724597","0.90","75000","79999","","Finance","","1"
"DWP276","N/D","SCS1","Deputy Director IT","Deputy Director within DWP IT Project Directorate (ITPD) on the Fraud and Error   Programme. Responsibilities include delivery of the Integrated Risk Intelligence Service   (IRIS), Referrals Management / Case Management and DWP Strategic Data Warehouse solutions to support a reduction in Fraud and Error within DWP through greater detection of existing fraud and error, improved referrals capability to investigate fraud to resolution;   and support the wider Welfare Reform Agenda including underpinning fraud prevention for the full solution for Universal Credit.","Department for Work and Pensions","Department for Work and Pensions","Corporate IT","0207 449 7892","pmd.planningandperformance@dwp.gsi.gov.uk","DWP76","0","1.00","65000","69999","","Information Technology","","1"
"DWP269","N/D","SCS1","Labour Market Programme Manager","To deliver changes to ensure that as many people as possible are in work.","Department for Work and Pensions","Department for Work and Pensions","Change","0207 449 5173","universal.creditcomms@dwp.gsi.gov.uk","DWP60","2790721","1.00","65000","69999","","Programme and Project Management (PPM)","","1"
"DWP110","N/D","SCS1","Head of Operational Planning and Performance Management","As a member of the Operations Finance senior leadership team, leads the integrated planning and performance management function, covering the full range of planning and performance to support DWP operations delivery accountabilities. The primary purpose being to translate DWP corporate plans into coherent business deliverables at all levels of the operation. The role provides professional, evidence based, decision making support, challenge and professional advice on all aspects of financial management, performance, value for money, investment and risk.","Department for Work and Pensions","Department for Work and Pensions","Finance Group","020 7449 5782","finance@dwp.gsi.gov.uk","DWP106","0","1.00","65000","69999","","Finance","","1"
"DWP129","N/D","SCS1","HR Director, IT","Responsible for the HR & Professional Capability function within DWP IT. Also sits on the IT Executive Team to help influence and shape the people agenda & to ensure that it is delivered in line with operational business needs.","Department for Work and Pensions","Department for Work and Pensions","Human Resources","020 7340 4339","hr@dwp.gsi.gov.uk","DWP123","1535073","1.00","85000","89999","","Human Resources","","1"
"DWP74","N/D","SCS1","Head of Service Transition","Head of Service Transition and Network Tower, part of Corporate IT function. Ensuring that new IT projects have a successful handover into the live running environment, and can be operated for the upcoming years. Also Accountable for the management oversight of the Network service tower contract, including all aspects of contract and supplier delivery.","Department for Work and Pensions","Department for Work and Pensions","Corporate IT","0207 449 7892","pmd.planningandperformance@dwp.gsi.gov.uk","DWP79","2399043","0.91","75000","79999","","Information Technology","","1"
"DWP337","N/D","SCS1","Senior Finance Business Partner","We enable business decision making by providing support and professional advice on all aspects of  financial management, performance, value for money, investment and risk. My team aims to achieve this by developing and maintaining key relationships with senior managers and their teams across the Work Services Directorate.","Department for Work and Pensions","Department for Work and Pensions","Finance Group","020 7449 5782","finance@dwp.gsi.gov.uk","DWP305","0","1.00","70000","74999","","Finance","","1"
"DWP80","N/D","SCS1","Deputy IT Director","Supports the IT Director in his accountabilities to provide DWP IT Businesses with their IT requirements, providing suitable IT systems and services that allow DWP staff to deliver services to DWP’s Customers and Claimants.","Department for Work and Pensions","Department for Work and Pensions","Corporate IT","0207 449 7892","pmd.planningandperformance@dwp.gsi.gov.uk","DWP77","14542234","1.00","70000","74999","","Information Technology","","1"
"DWP109","N/D","SCS1","Head of Finance Control & Policy","Responsible for resolving accounts qualification issues; to develop a strategic approach to building the Department's future financial accounting capability.","Department for Work and Pensions","Department for Work and Pensions","Finance Group","020 7449 5782","finance@dwp.gsi.gov.uk","DWP82","1468930","0.86","75000","79999","","Finance","","1"
"DWP323","N/D","SCS1","Deputy Director Planning and Controls UC Programme","Overall responsibility for programme management and assurance ensuring the ongoing coherence and progress of the Programme to successfully deliver phases of Universal Credit, supporting DWP Change function by providing strategic oversight and challenge and management of programme activities; assessing and mitigating risk, finance, compliance, performance.  The type of activity includes: Applying the appropriate Departmental project management framework for the project; Clarifying and refining the project / programme objectives; Ensuing the application of robust risk management strategies and contingency plans; Defining and measuring project success criteria throughout the life cycle; Developing professional and well respected relationships with key stakeholders and embed effective communication/engagement strategies; Ensure the effective leadership and management of all financial and people related activities, developing a high performing team;","Department for Work and Pensions","Department for Work and Pensions","Change","0207 449 5173","universal.creditcomms@dwp.gsi.gov.uk","DWP6","0","1.00","70000","74999","","Programme and Project Management (PPM)","","1"
"DWP3","N/D","SCS1","Head of Medical Services (Operations)","To manage the performance and delivery of the contract for the supply of medical assessments for benefit.  Working with the supplier to ensure good performance, customer service and value for money.","Department for Work and Pensions","Department for Work and Pensions","Finance Group","0207 449 7516","correspondence@dwp.gsi.gov.uk","DWP8","44530","1.00","75000","79999","","Finance","","1"
"DWP9","N/D","SCS1","Head of Universal Credit, Business Process","To develop the business processes and business products that are required to support Universal Credit delivery.","Department for Work and Pensions","Department for Work and Pensions","Change","0207 449 5173","universal.creditcomms@dwp.gsi.gov.uk","DWP284","0","1.00","70000","74999","","Programme and Project Management (PPM)","","1"
"DWP172","N/D","SCS1","Head of Labour Market Analysis","Expert domain for the analysis and interpretation of regional, national and international labour market trends, including the monthly labour market National Statistics, the department’s overall approach to employment policy and cross government working on labour market issues.","Department for Work and Pensions","Department for Work and Pensions","Strategy","020 7449 5517","strategy@dwp.gsi.gov.uk","DWP178","0","1.00","70000","74999","","Policy","","1"
"DWP296","N/D","SCS1","Deputy Director, Universal Credit Pathfinder & Piloting","Managing the progressive national rollout and live support of the Universal Credit Pathfinder Service.","Department for Work and Pensions","Department for Work and Pensions","Change","0207 449 7892","universal.creditcomms@dwp.gsi.gov.uk","DWP284","0","1.00","80000","84999","","Programme and Project Management (PPM)","","1"
"DWP154","N/D","SCS1","Chief Statistician","Measurement of fraud and error in the benefits system (under and over-payments) and publication of related National Statistics; Compilation of National and other official statistics relating to benefits and claimants and related analyses in support of policy development; Measurement of incomes and poverty, including child, working-age and pensioner poverty and income inequality through the Family Resources Survey; Departmental lead for the Wealth and Assets Survey, the English Longitudinal Study of Ageing, the Life Opportunities Survey, and related analyses. Deputy Head of Profession for statistics: upholding professional standards including the Code of Practice for Official Statistics.","Department for Work and Pensions","Department for Work and Pensions","Strategy","020 7449 7720","strategy@dwp.gsi.gov.uk","DWP152","0","1.00","70000","74999","","Policy","","1"
"DWP44","N/D","SCS1","Deputy Director Civil Service Employee Policy","Civil Service Employee Policy was set up on 01 April 2011 as one of the Expert Services under Civil Service HR. We provide a professional and specialist service across government departments to develop and maintain the civil service framework of people policies and practice. Working closely with government departments, we deliver simplified, rationalised policies, including guidance and support with implementation. We also offer an Expert Advice Service to deliver the Civil Service Reform priorities to Cabinet Office and departments.","Department for Work and Pensions","Department for Work and Pensions","CSEP","020 7340 4339","hr@dwp.gsi.gov.uk","DWP116","0","0.92","65000","69999","","Human Resources","","1"
"DWP261","N/D","SCS1","Deputy Director of Projects, ITPD, DWP","The projects cover all business areas including internal financial systems, infrastructure upgrades, labour market initiatives such as Universal Jobmatch, Benefit Cap and recently the Work Programme. We are responsible for the IT implementation of electronic document repositories and e-signing as part of the digitalisation programme. We also manage IT projects which enable the interface of DWP systems with Local Authorities and HMRC.","Department for Work and Pensions","Department for Work and Pensions","Corporate IT","0207 449 7892","pmd.planningandperformance@dwp.gsi.gov.uk","DWP76","0","1.00","75000","79999","","Information Technology","","1"
"DWP36","N/D","SCS1","Head of Central Operations","The team is responsible for delivery of National Insurance number provision delivering a robust and secure NiNO to domestic and foreign applicants. We also manage the Operational complaints, correspondence and feedback functions which includes: responding to MP queries, answering customer letters, undertaking peer and serious case reviews, responding to Parliamentary questions and Freedom of Information requests. Our failure demand and client assurance teams undertake quality checks on our delivery to ensure compliance with processes and assurance of quality service to customers.","Department for Work and Pensions","Department for Work and Pensions","Operations - Operational Excellence","0207 449 5173","correspondence@dwp.gsi.gov.uk","DWP28","0","1.00","65000","69999","","Operational Delivery","","1"
"DWP324","N/D","SCS1","Head of Strategic Design – Universal Credit Programme;","Creation of strategic design for UC including the strategic intent document; target and interim operating models; high-level business requirements; management information strategy and transition and migration planning.","Department for Work and Pensions","Department for Work and Pensions","Change","0207 449 5173","universal.creditcomms@dwp.gsi.gov.uk","DWP277","0","1.00","75000","79999","","Programme and Project Management (PPM)","","1"
"DWP216","N/D","SCS1","Programme Director","This team are responsible for the delivery of elements of the new child maintenance scheme. This includes the organisation design, site strategy and any third party contracts.","Department for Work and Pensions","Department for Work and Pensions","Corporate IT","0207 340 4206","transparency.questions@childmaintenance.gsi.gov.uk","DWP205","0","1.00","90000","94999","","Information Technology","","1"
"DWP160","N/D","SCS1","Head of Internal Communications and the Studio","Internal communications and the Studio exists to help staff and citizens understand DWP better, whether that is the services the Department offers or the part they play in making DWP’s objectives to reform welfare and pensions a success. The team achieves this through communications advice, planning, channel delivery (including the DWP website and intranet, DirectGov and Businesslink websites) and brand management. The team has a duty to fulfil the Department’s legal requirements to provide information to citizens which includes corporate publications (such as green papers), leaflets, letters, forms and display materials for Jobcentre Plus and Pension Disability and Carers Service.","Department for Work and Pensions","Department for Work and Pensions","Communications & FLDM","020 7449 7720","strategy@dwp.gsi.gov.uk","DWP158","0","1.00","70000","74999","","Communications","","1"
