"DWP169","PETE SEARLE","SCS2","Working Age Benefits Director","My team leads the development and maintenance of policy for most of the main benefits for people of working age, including Universal Credit, Jobseeker's Allowance, Employment and Support Allowance and Housing Benefit.","Department for Work and Pensions","Department for Work and Pensions","Strategy","020 7449 5517","strategy@dwp.gsi.gov.uk","DWP187","6882517","1.00","95000","99999","","Policy","","1"
"DWP158","RICHARD CASEBY","SCS2","Director of  Communications","Covering the Department's press office, internal communications, marketing and PR.","Department for Work and Pensions","Department for Work and Pensions","Communications & FLDM","020 7449 7720","strategy@dwp.gsi.gov.uk","DWP135","1233064","1.00","120000","124999","","Communications","","1"
"DWP275","SARAH COX","SCS2","Director UC Programme","Responsible for ensuring that robust, transparent and deliverable programme plans are in place and that programme momentum is maintained.   Also responsible for ensuring that joint and collective accountabilities are clear, that commissioning arrangements are appropriately specified and that the right level of timely direction is given across the whole programme.","Department for Work and Pensions","Department for Work and Pensions","Business Transformation Group","0207 449 5173","universal.creditcomms@dwp.gsi.gov.uk","DWP315","3935344","1.00","105000","109999","","Programme and Project Management (PPM)","","1"
"DWP128","SARAH SCULLION","SCS2","HR Director DWP Operations","The HR Director Operations' accountability is to contribute to the delivery of the Operational Business Targets through the provision of HR business partner services and the implementation of the people strategy.","Department for Work and Pensions","Department for Work and Pensions","Human Resources","020 7340 4339","hr@dwp.gsi.gov.uk","DWP123","4903232","1.00","115000","119999","","Human Resources","","1"
"DWP205","SIMON MCKINNON","SCS2","Information and Technology Director","The Information and Technology Directorate is responsible for ensuring that the Child Maintenance Group current and future Information Technology and Information Management needs are met. The Directorate provides local IT support, telephony services, and operational support for the Child Maintenance Group's current business applications. The Directorate is also supporting the Child Maintenance Group's change programme, building with third parties a range of applications for the new child maintenance scheme. In addition, the directorate provides information assurance and IT security services to protect information and systems within the Child Maintenance Group.","Department for Work and Pensions","Department for Work and Pensions","Corporate IT","0207 340 4206","transparency.questions@childmaintenance.gsi.gov.uk","DWP76","1986105","1.00","125000","129999","","Information Technology","","1"
"DWP8","SIMON TSE","SCS2","Health Services Director","Health Services Directorate is responsible for managing and continuously improving the performance of Health and Disability Assessment providers, especially in the key areas of capacity, productivity and value for money. We have an important role in working with our contracted partners to develop closer working relationships, identify and introduce process improvements and provide an effective link between contracted service providers and DWP Operations.","Department for Work and Pensions","Department for Work and Pensions","Finance Group","0207 449 5173","finance@dwp.gsi.gov.uk","DWP99","2061687","1.00","100000","104999","","Finance","","1"
"DWP305","STEVE BUCKINGHAM","SCS2","Finance Director DWP Operations","Leading the Finance Operations Directorate, ensuring that effective financial management and planning and performance management regimes are in place and that they support effective decision-making through high quality analysis, challenge, advice, and reporting.Ensuring Value for Money is considered at all levels of Operations and that an effective link is achieved between productivity, unit costing and other planning and financial activities. Leading all financial matters within CMG including financial management, reporting, accounting and business performance reporting and ensuring that value for money is delivered. Responsible for leading the Commission’s commercial and supplier relationship activities and contributing to the future direction of the organisation by offering advice to the Executive Team and Ministers, and delivering CMG’s planning, analysis, management information and research activities.","Department for Work and Pensions","Department for Work and Pensions","Finance Group","020 7449 5782","transparency.questions@childmaintenance.gsi.gov.uk","DWP99","0","1.00","105000","109999","","Finance","","1"
"DWP76","STEVE RILEY","SCS2","Head of IT Project Delivery","Accountable to the Customer Businesses for the provison of all IT services. Accountable to Customer Bsuinesses and DWO CIO to ensure that IT Budgets are spent appropriately. Accountable for managing the demand from the Customer  Business. Working in collboration with CIT supply side directors, is accountable for ensuring that IT performance meets Customer expectations & agreed service levels & targets.","Department for Work and Pensions","Department for Work and Pensions","Corporate IT","0207 449 7892","pmd.planningandperformance@dwp.gsi.gov.uk","DWP76","18551186","1.00","100000","104999","","Information Technology","","1"
"DWP60","SUE MOORE","SCS2","Director of DWP Portfolio Management Unit","Portfolio Management Unit plays a key role in managing the end-to-end change process & provides independent assurance to the DWP Executive Team (ET) through the Portfolio Board (PB) & the Portfolio Management Committee (PMC) whilst enabling the successful delivery of the department’s change portfolio. Within PMU the Contract Approvals team manage the processes for both internal ministerial and external CO contract approvals. PMU aspires to be an exemplar in Portfolio Management by building our professional capability; managing the flexible Change Resource Pool, providing expert advice to influence decision making, and working collaboratively across DWP and with all the change programmes","Department for Work and Pensions","Department for Work and Pensions","Change","0207 449 5173","finance@dwp.gsi.gov.uk","DWP99","4241590","1.00","85000","89999","","Programme and Project Management (PPM)","","1"
"DWP203","SUSAN PARK","SCS2","Director, Child Maintenance Group","Responsible for the day to day running of Child Maintenance Group & its operations, change, corporate affairs and customer functions.","Department for Work and Pensions","Department for Work and Pensions","Operations - CMG","0207 340 4206","transparency.questions@childmaintenance.gsi.gov.uk","DWP202","766802","1.00","120000","124999","","Operational Delivery","","1"
"DWP229","TOM MCCORMACK","SCS2","Director of Programme Delivery","The Programme Delivery Director is responsible for driving delivery of the Child Maintenance change programme, with lead responsibilities including delivery assurance; project planning and interdependencies; programme assurance and reporting; risks and issues management; and programme resource planning.  The Director also has responsibility for People and Capability programme deliverables, including organisation design; workforce planning and people allocation; content product delivery and live like testing; business preparation; and implementation control.  The Director also acts as deputy for the CMG Change Director.","Department for Work and Pensions","Department for Work and Pensions","Operations - CMG","0207 340 4206","transparency.questions@childmaintenance.gsi.gov.uk","DWP204","0","1.00","90000","94999","","Operational Delivery","","1"
"DWP165","TRACEY WALTHO","SCS2","Deputy Director, Health and Wellbeing","Leads on health and safety strategy across Government, including advice to Ministers on funding and objectives for the Health and Safety Executive. Also leads a range of programmes to improve health in the workplace and to compensate people who are injured at work.","Department for Work and Pensions","Department for Work and Pensions","Strategy","020 7449 7720","strategy@dwp.gsi.gov.uk","DWP149","5759743","0.92","85000","89999","","Policy","","1"
"DWP152","TREVOR HUDDLESTON","SCS2","Chief Analyst","This post is responsible for the co-ordination, delivery and quality assurance of all analysis across DWP. Analytical teams: (a) contribute to the process of evidence based policy development and delivery design; (b) help to monitor and evaluate the impacts of Departmental policies; (c) provide analytical information to support the Parliamentary and legislative process; (d)  provide forecasts of benefit expenditure to support HMT's sound planning of the Government finances.","Department for Work and Pensions","Department for Work and Pensions","Strategy","020 7449 7720","strategy@dwp.gsi.gov.uk","DWP187","3930849","1.00","100000","104999","","Policy","","1"
"DWP68","Vacant","SCS2","Group Applications Director","Ensure the development and delivery of all IT application developments for the DWP Group to time, cost and quality. Application development spend has a typical annual budget range of between £200m to £400m.","Department for Work and Pensions","Department for Work and Pensions","Corporate IT","N/A","N/A","DWP76","0","1.00","0","0","","Information Technology","","1"
"DWP284","N/D","SCS1","Universal Credit Phase 1 Director","Universal Credit Pathfinder Delivery Director. Key responsibilities are to plan the delivery and implementation of the Pathfinder service for Universal Credit, beginning a controlled rollout from April 2013 and managing rollout to progressive sites beyond the initial implementation. As part of that delivery, develop and implement Pathfinder live operational processes, and jointly lead and manage the Pathfinder UC service with DWP operational colleagues, ensuring the service is available and operates effectively, managing and capturing issues as they arise. As Pathfinder is designed to allow Universal Credit to learn from operational experience, ensure formal evaluation and lessons learned are captured in order to inform the future Universal Credit service.","Department for Work and Pensions","Department for Work and Pensions","Change","0207 449 7892","universal.creditcomms@dwp.gsi.gov.uk","DWP304","0","1.00","85000","89999","","Programme and Project Management (PPM)","","1"
"DWP164","N/D","SCS1","Head of Central Analysis Division","Central Analytical Division (CAD) develops and evaluates analysis that is cross cutting across DWP and links to wider Government initiatives.  Main responsibilities include: a) Co-ordinating the overall analysis of poverty across DWP; b) Horizon scanning, both within the Department and across Government; c) Improving the quality and policy impact of DWP evaluations; d) Planning and prioritising externally commissioned research and evaluations; e) Trialling co-ordination across DWP; f) Security Assurance for Research and Analysis (SARA); g) Quality-assuring the analysis presented in DWP Impact Assessments; h) Maintaining and developing the DWP Social Cost-Benefit Analysis Framework","Department for Work and Pensions","Department for Work and Pensions","Strategy","020 7449 7720","strategy@dwp.gsi.gov.uk","DWP152","0","1.00","75000","79999","","Policy","","1"
"DWP316","N/D","SCS1","Head of Business Transformation","Responsible for definition of the future business design of DWP to deliver the department's business strategy.  Responsible for creating the joined-up transformation roadmap to achieve this target design.","Department for Work and Pensions","Department for Work and Pensions","Business Transformation Group","020 7449 5517","strategy@dwp.gsi.gov.uk","DWP315","0","1.00","105000","109999","","Policy","","1"
"DWP227","N/D","SCS1","Head of IT Services","The IT Services team provides operational service management for the Child Maintenance Group's current applications and infrastructure. The team is responsible for incident, problem, availability, change request and service level management. Working with our IT suppliers, it ensures that our systems meet business needs in a cost effective manner. The team also manages and operates the Live Running IT Costs and Budget.","Department for Work and Pensions","Department for Work and Pensions","Corporate IT","0207 340 4206","transparency.questions@childmaintenance.gsi.gov.uk","DWP205","1104898","1.00","70000","74999","","Information Technology","","1"
"DWP266","N/D","SCS1","Deputy Director, Work, Welfare & Wellbeing in Later Life","Strategy on: up-rating of social security benefits and State pensions; employment, welfare benefits and wellbeing for older people; extending working life; combatting pensioner poverty and material deprivation among older people; and engagement with older people. Maintenance and reform of Pension Credit. Maintenance of universal pensioner benefits. Income aspects of combatting fuel poverty, including operation of the Warm Home Discount Scheme.","Department for Work and Pensions","Department for Work and Pensions","Strategy","020 7449 5517","strategy@dwp.gsi.gov.uk","DWP183","0","1.00","70000","74999","","Policy","","1"
"DWP21","N/D","SCS1","Head of Security  DWP Operations","We support DWP Operations in achieving its objectives by ensuring it safeguards its information assets and promotes responsible behaviour and ensures suitable and sufficient control measures are in place to manage and mitigate Health & Safety risk.","Department for Work and Pensions","Department for Work and Pensions","Operations - Operational Excellence","0207 449 5173","correspondence@dwp.gsi.gov.uk","DWP286","0","1.00","85000","89999","","Policy","","1"
"DWP188","N/D","SCS1","Head of Housing Policy Division","Responsible for providing policy advice to Ministers on Housing Benefit, Council Tax Benefit and Support for Mortgage Interest, and the housing element of Universal Credit and Pension Credit.","Department for Work and Pensions","Department for Work and Pensions","Strategy","020 7449 5517","strategy@dwp.gsi.gov.uk","DWP169","0","1.00","65000","69999","","Policy","","1"
"DWP2","N/D","SCS1","Head of Contact Centres","Head of Profession for Contact Centre Services, leading a national network of 32 Contact Centres, delivering service to Working Age Customers & Employers","Department for Work and Pensions","Department for Work and Pensions","Operations - Network Services","0207 449 5173","correspondence@dwp.gsi.gov.uk","DWP19","92026044","1.00","90000","94999","","Operational Delivery","","1"
"DWP15","N/D","SCS1","Head of Work Programmes Division","Managing all contracted employment programmes delivered by third party providers on behalf of the Department.","Department for Work and Pensions","Department for Work and Pensions","Operations - Work Services North West","0207 449 7516","correspondence@dwp.gsi.gov.uk","DWP82","0","1.00","65000","69999","","Finance","","1"
"DWP174","N/D","SCS1","Head of European Social Fund","The team is responsible for deciding how European Social Fund money should be spent in England and Gibraltar and for managing the expenditure by supporting and checking providers and submitting claims to the European Commission.","Department for Work and Pensions","Department for Work and Pensions","Strategy","020 7449 5517","strategy@dwp.gsi.gov.uk","DWP171","0","1.00","65000","69999","","Policy","","1"
"DWP130","N/D","SCS1","HR Director for Strategy Group","Responsible for providing strategic HR advice and support to the Strategy Group in addressing business requirements.  Implementing strategies to deliver the right people in the right place at the right time with the right skills and to increase organisational performance and effectiveness.","Department for Work and Pensions","Department for Work and Pensions","Human Resources","020 7340 4339","hr@dwp.gsi.gov.uk","DWP123","620601","0.94","75000","79999","","Human Resources","","1"
"DWP84","N/D","SCS1","Head of Debt Management","Debt Management is responsible for collecting Debt and Compensation on behalf of DWP, Local Authorities, other Government Departments and the NHS. It also administers the Integrated Loan Scheme on behalf of the Home Office. 1800 staff are primarily housed in 9 locations and forms part of DWP Finance Group Directorate.","Department for Work and Pensions","Department for Work and Pensions","Debt Management","020 7449 5782","finance@dwp.gsi.gov.uk","DWP99","37627069","1.00","80000","84999","","Finance","","1"
"DWP278","N/D","SCS1","Deputy Director of Communications Universal Credit","Responsible for leading the development and delivery of high quality and innovative communication strategies and plans to support the Government’s business delivery objectives on Universal Credit. Provide expert advice to senior internal and external stakeholders on communications and act as senior Business Partner to the Universal Credit Programme.","Department for Work and Pensions","Department for Work and Pensions","Communications & FLDM","020 7449 7720","strategy@dwp.gsi.gov.uk","DWP158","0","1.00","90000","94999","","Communications","","1"
"DWP72","N/D","SCS1","Programme Manager,  Digitalisation Programme","To deliver DWP's programme of Business Change that will be enabled by digitally based projects to help the Department achieve its goal of “Digital by Default”.","Department for Work and Pensions","Department for Work and Pensions","Change","0207 449 5173","universal.creditcomms@dwp.gsi.gov.uk","DWP60","3799129","1.00","65000","69999","","Programme and Project Management (PPM)","","1"
"DWP43","N/D","SCS1","Work Services Director, London & Home Counties","The main purpose of the Work Services Director role is to drive performance across the Jobcentre network, and to provide senior leadership across London and Home Counties. Ultimately accountable for the end to end customer experience and customer services delivered through local Jobcentres and other service outlets, including advisory services, financial assessment and help with job search; ensuring that all face to face customer contacts are undertaken to required standards, within budget, headcount and against all agreed operational targets. Further accountable for services to employers and for relationships with key partners to support the successful delivery of DWP objectives.","Department for Work and Pensions","Department for Work and Pensions","Operations - Work Services London & Home Counties","0207 449 7516","correspondence@dwp.gsi.gov.uk","DWP203","154269655","1.00","65000","69999","","Operational Delivery","","1"
"DWP86","N/D","SCS1","Deputy Director, Performance and Value for Money, Finance Group","Responsible for shaping DWP’s strategic approach to Performance and Value for Money from the finance perspective and achieving optimal outcomes","Department for Work and Pensions","Department for Work and Pensions","Finance Group","020 7449 5782","finance@dwp.gsi.gov.uk","DWP106","0","0.85","65000","69999","","Finance","","1"
"DWP179","N/D","SCS1","Department and Business Strategy Director","The team owns the overall strategic vision for the DWP and connects people working on strategy with operations by making sure that the strategy developed is deliverable and that what the strategy says is done.","Department for Work and Pensions","Department for Work and Pensions","Business Transformation Group","020 7449 5517","strategy@dwp.gsi.gov.uk","DWP315","0","0.69","75000","79999","","Policy","","1"
"DWP286","N/D","SCS1","Universal Credit Security","Sitting within the Universal Credit Programme, but responsible for ensuring the end-to-end security delivery capability is in place to provide secure online and other services for both Universal Credit and the wider Department.","Department for Work and Pensions","Department for Work and Pensions","Change","020 7449 5517","universal.creditcomms@dwp.gsi.gov.uk","DWP284","1743552","1.00","70000","74999","","Programme and Project Management (PPM)","","1"
"DWP147","N/D","SCS1","Head of Feedback, Legislation and Decision Making Division","Our role is to respond professionally to feedback (correspondence, complaints, appeals) about the Department’s services; to give guidance to the Department’s front-line decision-makers; and to promote appropriate regulation and effective management of legislation.","Department for Work and Pensions","Department for Work and Pensions","Communications & FLDM","020 7449 7720","strategy@dwp.gsi.gov.uk","DWP158","5441338","1.00","85000","89999","","Operational Delivery","","1"
"DWP175","N/D","SCS1","Deputy Director, Labour Market Partnerships Division","Labour Market Partnerships Division leads on defining and shaping strategic partnerships to meet the needs of employers and localities and develop the skills of workless people to help more people back into employment. It does this by encouraging and facilitating the coherent delivery of services between DWP and other partners, whether they be in the public, private or voluntary and community sectors.","Department for Work and Pensions","Department for Work and Pensions","Strategy","020 7449 5517","strategy@dwp.gsi.gov.uk","DWP178","0","1.00","65000","69999","","Policy","","1"
"DWP181","N/D","SCS1","Lead Analyst, Universal Credits and Working Age","Providing the evidence and analysis to support the development of policy and delivery for Universal Credit, Housing Benefits and Working Age Benefits.","Department for Work and Pensions","Department for Work and Pensions","Strategy","020 7449 5517","strategy@dwp.gsi.gov.uk","DWP169","0","1.00","80000","84999","","Policy","","1"
"DWP217","N/D","SCS1","Programme Director","This team are responsible for the delivery of elements of the new child maintenance scheme. This includes organisation design, site strategy and  third party contracts.","Department for Work and Pensions","Department for Work and Pensions","Operations - CMG","0207 340 4206","transparency.questions@childmaintenance.gsi.gov.uk","DWP204","0","1.00","90000","94999","","Operational Delivery","","1"
"DWP280","N/D","SCS1","Deputy Director Security and Business Continuity","To provide business continuity, security and Information Assurance (IA) policies, strategies and services to the Department, and to ensure that there are effective continuity plans for all major risks to the business.  I am also the Departmental Security Officer (DSO), a mandated Cabinet Office role.","Department for Work and Pensions","Department for Work and Pensions","Finance Group","020 7449 5782","finance@dwp.gsi.gov.uk","DWP148","4640166","1.00","70000","74999","","Finance","","1"
"DWP4","N/D","SCS1","Deputy Director, Housing Delivery","The team supports the delivery of Housing Benefit and Council Tax Benefit, allocating and managing the DWP funding to local authorities. We analyse performance data and support local authorities in improving their delivery. We support local authority housing costs teams in preparing for the changes that Universal Credit and welfare reform will bring.","Department for Work and Pensions","Department for Work and Pensions","Operations - Benefits","0207 449 7516","correspondence@dwp.gsi.gov.uk","DWP249","0","1.00","70000","74999","","Operational Delivery","","1"
"DWP34","N/D","SCS1","Deputy Director, Housing Delivery","The team supports the delivery of Housing Benefit and Council Tax Benefit, allocating and managing the DWP funding to local authorities. We analyse performance data and support local authorities in improving their delivery. We support local authority housing costs teams in preparing for the changes that Universal Credit and welfare reform will bring.","Department for Work and Pensions","Department for Work and Pensions","Change","0207 449 7516","correspondence@dwp.gsi.gov.uk","DWP8","2212648","1.00","65000","69999","","Finance","","1"
"DWP35","N/D","SCS1","Work Services Director, North West","Accountable to the Director of Work Services for all customer services delivered through Jobcentres and other local service outlets, including advisory services, financial assessment and help with job search.  The post holder is accountable for the end-to-end customer experience in the Group; ensuring that all face to face customer service is undertaken to required standards; within budget and headcount; and for delivering against all agreed operational targets and measures. The main purpose of the role is to drive performance across the Jobcentre network, supporting claimants into work and to provide senior leadership across the Group.","Department for Work and Pensions","Department for Work and Pensions","Operations - Work Services North West","0207 449 7516","correspondence@dwp.gsi.gov.uk","DWP29","92767312","1.00","60000","64999","","Operational Delivery","","1"
"DWP270","N/D","SCS1","Universal Credit IT Lead","Delivery of IT infrastructure & security capabilities is support of Universal Credit","Department for Work and Pensions","Department for Work and Pensions","Corporate IT","0207 449 7892","pmd.planningandperformance@dwp.gsi.gov.uk","DWP76","0","1.00","75000","79999","","Information Technology","","1"
