LHB16CD,LHB16NM,LHB16NMW,FID
W11000023,Betsi Cadwaladr University Health Board,Bwrdd Iechyd Prifysgol Betsi Cadwaladr,1
W11000024,Powys Teaching Health Board,Bwrdd Iechyd Addysgu Powys,2
W11000025,Hywel Dda University Health Board,Bwrdd Iechyd Prifysgol Hywel Dda,3
W11000026,Abertawe Bro Morgannwg University Health Board,Bwrdd Iechyd Prifysgol Abertawe Bro Morgannwg,4
W11000027,Cwm Taf University Health Board,Bwrdd Iechyd Prifysgol Cwm Taf,5
W11000028,Aneurin Bevan University Health Board,Bwrdd Iechyd Prifysgol Aneurin Bevan,6
W11000029,Cardiff and Vale University Health Board,Bwrdd Iechyd Prifysgol Caerdydd a’r Fro,7
