HR-17-11,Hull Road ,Citizens Advice York ,Funding to run weekly full day advice sessions in the ward ,Supporting residents to prosper and access the services they need ,20/12/2017,08/02/2018,19970,Funding released 
HR-17-14,Hull Road ,,"Design, print and distribute a Hull Road ward newsletter ","1) Promote a friendly and welcoming commuity, 2) Encouraging volunteering and community involvement, 3) Supporting residents to prosper and access the services they need ",05/01/2018,05/01/2018,1100,Complete
HR-17-16,Hull Road ,,Commission Eboracum Security to lock and unlock Hull Road park gates in March and April ,1) Promote a friendly and welcoming community ,22/02/2018,,1700,Complete
HR-17-17,Hull Road ,Badger Hill Residents Community Group  ,"Funding towards the cost of website licensing, printing of annual newsletter and AGM room hire",1) Promote a friendly and welcoming community 2) Encouraging volunteering and community involvement ,08/03/2018,20/03/2018,304.15,Funding released to  group 
HW-17-01,Haxby and Wigginton,Haxby and Wigginton Youth and Community Association ,"A detached youth work service on Ethel Ward which will see additional detached activity taking place in the ward 24 weeks of year.Activity will be delivered alongside Haxby Library mobile service, supporting young people in accessing more community services. ","Social isolation is often a direct outcome for young people who choose to not engage with external provisions outside school. This isolation from organised activity and social opportunities can lead to boredom and delinquency. By providing additional services that does not require young people to access a formal provision of activity, directly addresses social isolation and delinquent behaviour as a result. ",09/05/2017,09/05/2017,1758.9,Funding Agreed
HW-17-02,Haxby and Wigginton,Wigginton Grasshoppers FC,Lay a land drain to improve drainage of the playing pitches. ,Enhancing the environment & green spaces,09/05/2017,01/06/2017,2500,Funding Agreed
HW-17-03,Haxby and Wigginton,Haxby and Wigginton Methodist Church,To install a disabled lifting platform to allow those with mobility issues access to upstairs rooms.,Addresses social isolation and loneliness issues. Helps create an environment where everyone can enjoy time and activities together.,09/05/2017,01/06/2017,2000,Funding Agreed
HW-17-04,Haxby and Wigginton,The Wonder Years Preschool and Extended school ,"Towards carrying out weekly Forest School Sessions for children attending all sessions. Funding would go towards health and safety equipment, Fire and cooking, tools and bags and storage equipment, along with dens and shelters to get the sessions established ",Enhancing the environment & green spaces,29/06/2017,29/06/2017,1205,Funding Agreed
HW-17-05,Haxby and Wigginton,Haxby Playgroup,Towards repairing and revamping the outdoor play area at Haxby Playgroup for the continued learning and opportunities for the children ,Addresses social isolation and loneliness issues. Helps create an environment where everyone can enjoy time and activities together,13/07/2017,13/07/2017,2500,Funding Agreed
HW-17-07,Haxby and Wigginton,York City Football Club Foundation ,Towards providing holiday provision to young people  within the ward and to also continue for a further academic year sessions currently running weekly at  Joseph Rowntree School.,Addresses social isolation and loneliness issues. Helps create an environment where everyone can enjoy time and activities together,13/07/2017,13/07/2017,3502,Funding Agreed
HW-17-09,Haxby and Wigginton,Haxby and Wigginton Youth and Community Association ,Towards the cost of establishing a youth council within the ward,Addresses social isolation and loneliness issues. Helps create an environment where everyone can enjoy time and activities together,08/08/2017,20/09/2017,2233,Funding Agreed
HW-17-10,Haxby and Wigginton,York CVS ,"To offer the ward a social prescribing scheme to combat loneliness and isolation, ",Increase community safety and cohesion,01/08/2017,25/08/2017,4697,Funding Agreed
MK-17-01,Micklegate,CVS,"To offer the ward a social prescribing scheme to combat loneliness and isolation, ",Increase community safety and cohesion,01/08/2017,25/08/2017,4697,Funding Agreed
MK-17-02,Micklegate,York Blind and Partially Sighted Society,"To promote their services more widely within the Micklegate Ward and hopefully identify some of those 2,000 people living with sight loss but not in receipt of services.","•a community where all generations are supported, looked after and included
•a safe and resilient community
",03/05/2017,03/05/2017,2000,Funding Agreed
MK-17-03,Micklegate,Highways,New salt bin outside St Clement's Church,"•a safe and resilient community
•a clean and green community
",10/09/2017,10/09/2017,350,Paid
MK-17-06,Micklegate,York CVS,"Flood resilience packs for the community: preparedness kits, emergency plans, volunteer training, etc.","•a community where all generations are supported, looked after and included
•a safe and resilient community
",05/07/2017,05/07/2017,3645,Funding Agreed
MK-17-08,Micklegate,Ward,Bishopthorpe Road sculpture planning permission,A neighbourhood shaped by the community,14/06/2017,14/06/2017,195,Paid
Mk-17-09,Micklegate,CYC,New children's equipment for Scarcroft Green playground. Led by City of York Council's Public Realm team.,"•a neighbourhood shaped by the community
•a community where all generations are supported, looked after and included
",31/03/2017,31/03/2017,10000,Funding agreed
mk-17-10,Micklegate,CYC,Railings Rowntree Park,•a clean and green community,31/03/2017,31/03/2017,4000,Paid
Mk-17-12,Micklegate,CYC,New children's equipment for Rowntree Park playground. Led by City of York Council's Public Realm team.,"•a neighbourhood shaped by the community
•a community where all generations are supported, looked after and included
",31/03/2017,31/03/2017,20000,Funding agreed
Mk-17-13,Micklegate,CYC,"Scarcroft Green improvements (not play area). This will consist of new benches, improved pathways, markings, signage, green space, etc.  Led by City of York Council's Public Realm team.",•a neighbourhood shaped by the community •a clean and green community,31/03/2017,31/03/2017,10000,Funding agreed
MK-17-16,Micklegate,CYC,Payment for the Micklegate Business Initiative to close the road for a free Christmas street event-The Micklegate Mingle.,"•a community where all generations are supported, looked after and included
•a safe and resilient community
",15/11/2017,15/11/2017,460,Paid
OD-16-15 / 15a,Osbaldwick & Derwent,CYC Highways,"Dropped kerbs in Dunnington, Intake Lane",highways,30/11/2016,09/12/2016,2000,ongoing
OD-16-19,Osbaldwick & Derwent,Osbaldwick Sports Club,"A grant to pay for a replacement grass cutter to maintain the club's field. Funding to cover full cost of purchase is coming from three sources, so the Football Association, the Ward Committee and the Club. ",More community and youth opportunities,08/02/2017,16/03/2017,7500,Funding released
OD-17-01,Osbaldwick & Derwent,CYC Highways,"To dig out the verge on Thirkleby Way at Junction with Farndale Avenue and replace it with concrete and cobbles, protecting footpath by installing two cast iron bollards",A safer community,18/04/2017,20/04/2017,1000,Commisioned to highways
OD-17-02,Osbaldwick & Derwent,CYC Highways,"To dig out and replace the verge outside no’s 1 and 3 Thirkleby Way, YO10 3PU with concrete and cobbles protecting verge + install two cast iron bollards protecting the footpath. ",A safer community,18/04/2017,20/04/2017,250,Commisioned to highways
OD-17-03,Osbaldwick & Derwent,CYC Highways,"To remove the verge and replace with Tarmac, although some kerbs may need resetting due to vehicles overrun - Tranby and Farndale Avenues junction",A safer community,18/04/2017,20/04/2017,4000,Commisioned to highways
OD-17-04,Osbaldwick & Derwent,St Nicholas Churchyard Grass Cutters,to purchase a new grass cutter and burushcutter for the group of volunteers to use to maintain the churchyard,,18/04/2017,20/04/2017,485,Funding released
OD-17-05,Osbaldwick & Derwent,CYC Highways,To replace the strip of grass verge alongside the footpath at the Kexby inbound bus stop with concrete/cobbles to a width of 2’ with a pin kerb at the back. This is to tidy up the area and reduce future maintenance. 2’ should suffice as the Laurel hedge will prevent any verge growth.,A safer community,18/04/2017,20/04/2017,3500,Commisioned to highways
OD-17-06,Osbaldwick & Derwent,Murton Parish Council,A grant towards replacement of the existing street sign on Smary Lane with a granite through with sign affixed to it and replacement of the finger signpost on the village green with  a more appropriate rural sign.,A cleaner environemnt for all villages,18/04/2017,20/04/2017,1350,Funding released
OD-17-07,Osbaldwick & Derwent,Murton Parish Council,"A grant towards works around to the village pond, so dredging the beck flowing into the pond to reduce flooding, hedging work, tidying surrounds and restocking plants. ",A cleaner environemnt for all villages,18/04/2017,20/04/2017,600,Funding Agreed
OD-17-08,Osbaldwick & Derwent,CYC Highways,"Removal of the 12"" wide grass verges on Bracken Hill, Osbaldwick and replacement with concrete/cobbles. Verges are being damaged/overrun by cars.",highways,24/04/2017,24/04/2017,4300,Commisioned to highways
OD-17-09,Osbaldwick & Derwent,CYC Public Realm Team,Payment from the ward budget to maintain the current level of grounds maintenance service.,cleaner and greener environment,18/04/2017,20/04/2017,1891,Funding Agreed
OD-17-13,Osbaldwick & Derwent,CYC,"To solve parking problem on a CYC grass verge. The grass verge is constantly being damaged by cars. 
Proposal is to place a seat in this area with the addition of a couple of bollards/stones to protect the verge. This will be a pleasant place to sit for elderly, dog walkers etc. and not far from the bus stop over the road.
",A cleaner environment for all villages ,18/04/2017,20/04/2017,1000,With Highways
OD-17-14,Osbaldwick & Derwent,CYC ,"To create a four or five car parking bay on York Street, Dunnington, outside the Newsagents and opposite the bus stop. - this is now just a feasibility study  to start with",Safer communities across the ward,18/04/2017,20/04/2017,1000,with Highways
OD-17-15,Osbaldwick & Derwent,Dunnington in Bloom (Dunnington PC),Grant to Dunnington in Bloom To fund the purchase of 2 lawnmowers,A cleaner environment for all villages ,08/08/2017,09/08/2017,958.4,PAID
OD-17-16,Osbaldwick & Derwent,cyc,Pay for 10 embellishment kits for street lighting (part of a larger CYC capital scheme),A safer community,11/08/2017,11/08/2017,4500,COMPLETE
RC-16-11,Rawcliffe & Clifton Without,Highways,To install additional street lighting on Malton Way . (17 Malton Way approx) and ongoing costs,Highways,21/02/2017,21/02/2017,350,Funding Agreed
RC-17-10,Rawcliffe & Clifton Without,Clifton Moor Tiddlers ,Towards new play equipment and storage and refreshments at Clifton Moor tiddler Group ,Social Inclusion to combat loneliness & Isolation,14/03/2017,14/03/2017,250,Approved
RCW-17-02,Rawcliffe & Clifton Without,Rawcliffe Parish Council,A grant towards rennovations at Rawcliffe Rec to improve facilities offer a community cafe and additional meeting rooms,"social inclusion to combat loneliness & isolation, improving community spaces, supporting young people",20/06/2017,20/06/2017,20000,Approved
RCW-17-03,Rawcliffe & Clifton Without,Clifton Elderberries,A grant to go towards the cost of offering coach trips 3-4 times a year to elderly residents within the ward ,Social Inclusion to combat loneliness & Isolation,20/06/2017,20/06/2017,350,Approved
RCW-17-07,Rawcliffe & Clifton Without,Young at Heart ,Towards providing funds to subsidise the cost of two coach trips for the older generation who attend Young at Heart ,Social Inclusion to combat ,20/06/2017,27/06/2017,500,Funding Agreed
RCW-17-08,Rawcliffe & Clifton Without,Clifton Sea Scouts,Towards improving toilet facilities & creating a disabled toilet whilst adding projector and investing in tablets for the group,"Supporting young people, Impoving community spaces",20/06/2017,27/06/2017,6400,Funding Agreed
RCW-17-10,Rawcliffe & Clifton Without,Clifton Moor Community Church ,Towards the running costs of the Mosaic Pop up cafe. A community based group that meet for three days during the school holidays to run a variet of activities for the whole community,Supporting young peole,25/07/2017,27/07/2017,250,Funding Agreed
RCW-17-12,Rawcliffe & Clifton Without,Clifton Explore Library,"Towards the cost of purchasing, publising and refreshments equipment to launch a boccia session at the library",Social Inclusion to combat loneliness & Isolation,17/08/2017,29/08/2017,250,Approved
RCW-17-13,Rawcliffe & Clifton Without,York City Football Club Foundation ,To offer a free football holiday coaching course for young people within the Rawcliffe and Clifton without ward over the February half term,Supporting young people,30/06/2017,03/10/2017,1686,approved
RCW-17-15,Rawcliffe & Clifton Without,Accessible Arts ,To support the creative community project providing creative sessions using digital technology for older people and those living with demnetia in the Rawcliffe and Clifton Without ward,Social Inclusion to combat loneliness & Isolation,19/12/2017,23/01/2018,1000,pending
RCW-17-16,Rawcliffe & Clifton Without,Environment Community officers,"To produce ""no feeding the ducks"" signs at Rawcliffe Lake ",Improving community spaces,10/03/2017,11/01/2018,600,pending
RW-17-01,Rural West York,CYC Highways,To clean the Rufforth Gates on the Wetherby road driving into Rufforth vilage,Improve the Environment,10/08/2017,10/08/2017,400,Paid 
RW-17-02,Rural West York,Little St Mary's Pre-school Playgroup,Towards maintenance work and repairs to outdoor play area,To improve the lives of children and young people,28/03/2017,28/03/2017,700,Paid
RW-17-05,Rural West York,Rufforth Pre School ,To replace a pair of Trapezoid tables for the children attending their sessions,To improve the lives of children and young people,11/05/2017,11/05/2017,234,Paid
RW-17-06,Rural West York,Poppleton youth action group,support towards the groups running costs,To improve the lives of children and young people,23/05/2017,23/05/2017,2500,Paid
RW-17-07,Rural West York,Upper Poppelton Parish Council,Repair the village Maypole,Improve the Environment ,11/07/2017,11/07/2017,1000,Paid
RW-17-08,Rural West York,Poppleton Play,Improve Poppleton playground. Consult with young people to add new equipment and repair the existing environment,Priority met: To improve the lives of children and young people                                                                       Priority met: Improving the physical environment of the ward ,16/08/2017,16/08/2017,5000,Paid
RW-17-10,Rural West York,Askham Richard Parish Council,"Askham Richard Parish Council to purchase a defibrillator, cabinet and training to install in Askham Richard.",Priority met: Supporting projects and initiatives which help residents fell part of their community and improves wellbeing ,01/09/2017,01/09/2017,1412.4,Paid
ST-17-01,Strensall ,Strensall Library,Fund two events to reduce child and adult loneliness,Tackle Loneliness and Isolation,23/02/2017,24/03/2017,200,released to the group
ST-17-02,Strensall ,Earswick Parish Council,purchase  acoustic tiles for the Village Hall,Reduce social isolation,28/04/2017,01/06/2017,3180.96,released to group
ST-17-04,Strensall ,York City Foundation,Grant to York City Foundation to deliver youth provision in the Strensall ward at idfentified areas,Improve the help and wellbeing of wards residents,26/06/2017,12/07/2017,4550,released to the group
ST-17-05,Strensall ,York City Foundation,"A pot of money for any youth provision activity costs or extra engagement sessions throughout the year to compliment the youth provision work strensall are funding through the York City Foundation, TO BE ACCESSED WHEN NEEDED",Improves the health and weelbeing of wards residents and provides community provision for young people,18/07/2017,18/07/2017,5000,ongoing 
ST-17-06,Strensall ,Strensall Parish Council,Grant for a strimmer to support Parish Council to toidy up green area.,Improving the local enviroment and promoting a feeling of wellbeing. ,10/08/2017,10/08/2017,537.5,released to the group
ST-17-07,Strensall ,Strensall Parish Council,Purchase of bluebells and native species of spring bulbs for Strensall Woodland and open green spaces,Improving the local enviroment and promoting a feeling of wellbeing. ,10/08/2017,10/08/2017,500,released to the group
ST-17-10,Strensall ,Earswick Parish Council,Match funded the Parish Council to purchase outdoor gym equipment (for 12 year plus),Improving the local enviroment and promoting a feeling of wellbeing & to improve physical enviroment,06/10/2017,06/10/2017,4900,released to the group
ST-17-11,Strensall ,Stockton on the Forest Parish Council,Grant to install a new bench for visitors and residents to enjoy. ,To improve physical enviroment,26/10/2017,26/10/2017,362.5,relased to the group
ST-17-14,Strensall ,York City Football Club Foundation ,Grant to provide a weekly youth club in Strensall. Every Friday evening from Dec 2017 to March 2018. Including consultation and delivery.,To improve the health and wellbeing of ward residents and provides community provision for young people.,22/11/2017,22/11/2017,5150,released to the group
ST-17-17,Strensall ,St Mary's Church Setting up a Community Cafe in Strensall ‘Spearhead Community Cafe’. ,Grant to set up a Community Cafe. Targeting residents who are lonely and isolated. ,Improves the health and weelbeing of wards residents.,11/03/2017,11/03/2017,420,released to the group
ST-17-18,Strensall ,York City Football Club Foundation ,Grant to provide a weekly youth club in Strensall. Every Friday evening. March 2018 to May 2018,To improve the health and wellbeing of ward residents and provides community provision for young people.,15/03/2018,15/03/2018,3000,released to the group
WE-15-14,Westfield,CYC,Front street pavement improvements,highways,01/01/2016,28/03/2016,7181,Funding Agreed
WE-16-07,Westfield,CYC,Support for Sportsfields (scheme number 6 on the 2016-17 ward ballot) – to install one goal post at Foxwood Park. ,Improve activities for young people,14/03/2017,14/03/2017,479,completed
WE-16-12,Westfield,CYC,Hawshead Close footpath repairs. , Improve the local environment and take pride in Westfield,01/02/2017,14/03/2017,420,completed
WE-16-14,Westfield,CYC,A feasibility study  to assess if both entranceways to the alleyway between Askham Grove and Tennent Road can be converted to disabled/pushchair friendly and the steps be replaced with sloped paving., Improve the local environment and take pride in Westfield,14/03/2017,14/03/2017,500,ongoing
WE-16-17,Westfield,CYC,"Trees work fund to be used for maintenance, trimming and replacement of trees on Council land", Improve the local environment and take pride in Westfield,14/03/2017,14/03/2017,10926,work being commissioned
WE-16-17b,Westfield,CYC,"£2926 from the 2017-18 budget to top up the trees work fund to be used for maintenance, trimming and replacement of trees on Council land", Improve the local environment and take pride in Westfield,27/07/2017,25/08/2017,2926,Funding Agreed
WE-16-19,Westfield,CYC,Fund a skip for hard plastic items from  11am-1pm on Saturday 1st April 2017, Improve the local environment and take pride in Westfield,14/03/2017,14/03/2017,610,completed
WE-16-20,Westfield,CYC Youth Engagement (LAT West),"Project to tackle anti-social behaviour in Chapelfields area:
Multi-agency team involving Police, LAT and Public Health as well as local community groups will seek to address ASB through targeted diversionary activities for local children and young people. This will link to the Communities that Care (CTC) programme that is being developed by the local Police.  £2,000 from (Ballot Nov 2016-ref 5), £1,521 from underspend of the Sportsfields pot (Ballot Nov 2016 -ref 6) ",Addresses all ward priorities indirectly,14/03/2017,14/03/2017,3521,activities being commisioned
WE-16-21,Westfield,CYC Youth Engagement (LAT West),"Organised activities at the tarmac multi games area between Kingsway West and Hob Moor Primary - £2,000 (Ballot Nov 2016 - ref no 7)",commisioning,14/03/2017,14/03/2017,2000,ongoing
WE-16-22,Westfield,CYC,"Street environment issues pot (ref number 12, 15 and 17 on the Nov 2016 ballot)  ", Improve the local environment and take pride in Westfield,14/03/2017,14/03/2017,12000,work being commissioned
WE-16-22b,Westfield,CYC,Bramham Road in front of Thomas Andrews Mews – to tarmac three small verges to make into footway construction ,Improve the local environment and take pride in Westfield ,04/10/2017,27/12/2017,3050,commisioned
We-16-22c,Westfield,CYC,Installation of vehicular crossing outside no 20 Barkston Avenue and relocation of pedestrian crossing  to a better location,Improve the local environment and take pride in Westfield ,04/10/2017,23/01/2018,6000,commisioned
We-16-22d,Westfield,CYC,To transform small grass verges outside no's 120 and 128 Middleton Road to tarmac surface.,Improve the local environment and take pride in Westfield ,04/10/2017,18/12/2017,1500,commisioned
WE-16-22e,Westfield,CYC,To transform the grass verge outside no 86 Foxwood Lane to tarmac construction strong enough for vehicular access/ manoeuvring.,Improve the local environment and take pride in Westfield ,04/10/2017,18/12/2017,2000,commisioned
WE-16-23,Westfield,CYC,Acomb Triathlon contribution,Improve activities for young people,14/03/2017,14/03/2017,500,completed
WE-16-25,Westfield,CYC,Deep cleaning of shopping areas on Green Lane shops and Beagle Ridge / Foxwood Lane, Improve the local environment and take pride in Westfield,14/03/2017,14/03/2017,2000,ongoing
WE-16-26,Westfield,CYC,Pot to tackle ASB issues. To be used towards the 'Communities that Care' and other projects addressing ASB across the ward.,Addresses all ward priorities indirectly,14/03/2017,14/03/2017,6841,work being commissioned
WE-16-26b,Westfield,CYC,£3657 from the 2017-18 budget to top up to the ASB pot to be used  for projects to tackle anti social behaviour in consultation with North Yorkshire Police.,Addresses all ward priorities indirectly,27/07/2017,25/08/2017,3657,work being commissioned
WE-16-27,Westfield,Foxwood Residents' Association,"To replace vandalised seat in Foxwood Park.  The funding of £500 was originally earmarked  by the Ward Committee  towards  instalaltion of a seat on the junction of Lowfields and Dijon Avenue , however  due to objections from concerned residents it has been decided to withdraw the proposal and use  the funding to install a bench at Foxwood park.",improve the local environment and take pride in Westfield,14/03/2017,14/03/2017,500,released to the group
WE-16-29 ,Westfield,CYC,Creation of communal car park on Askham Lane (by Cornlands Road junction) 198/200,highways,13/09/2017,04/10/2017,5000,commisioned
WE-16-30,Westfield,CYC,Creation of communal car park on Askham Lane (by Cornlands Road junction) 206/208,highways,13/09/2017,04/10/2017,3500,commisioned
WE-17-01 ,Westfield,CYC,Ascot Way and the school sign,improve the local environment and take pride in Westfield,14/03/2017,18/08/2017,315,completed
WE-17-02,Westfield,CYC,61 Gale Lane,Highways fund ,13/09/2017,04/10/2017,850,commisioned
WE-17-04,Westfield,CYC,Noticeboard on Foxwood Lane/Beagle Ridge Drive,,03/05/2017,01/07/2017,100,completed
WE-17-05,Westfield,CYC,Salt bins refill pot of £1250 to accomodate for refilling of 6 ward funded salt bins in winter 2017-18,improve the local environment and take pride in Westfield,14/03/2017,14/03/2017,1250,being used
WE-17-06,Westfield,CYC,Harold Court street sign removal and installation of a replacement sign,improve the local environment and take pride in Westfield,29/06/2017,29/06/2017,196,for old sign removal
WE-17-07,Westfield,CYC,Ward newsletter June 2017,Helps to address all ward priorities,01/03/2017,01/04/2017,2000,complete
WE-17-09,Westfield,Acomb Methodist Church,Community cinema project - a grant towards purchase of new chairs,reduce isolation; improve activities for young people,01/08/2017,25/08/2017,1463,grant released
WE-17-10,Westfield,Foxy Crafters, Local craft and chat grouop meeting weekly for an hour. A grant towards room hire charges to enable the group to meet for two hours per week.,reduce isolation ,25/08/2017,25/08/2017,400,Released to the group
WE-17-12,Westfield,Foxwood Resident's Association,A grant towards skip hire to take away rubbish and vegetation from the Foxwood Park.,improve the local environment and take pride in Westfield,01/08/2017,25/08/2017,183,grat agreement sent to group
WE-17-14,Westfield,York CVS,A grant towards the Ways to Wellbeing  project that connects local people to local health and wellbeing activities in their community. (The ward commits to fund the project over two years).,reduce isolation ,01/08/2017,25/08/2017,3429,released to the group
