WE-17-15,Westfield,Chill in the Community,"A grant towards development of facilities to incorporate a group kitchen.The kitchen will be used for teaching vulnerable adults to cook independently, teaching teens to cook for themselves nutritiously and on a budget, cooking for carers and young carers as a peer support activity, cooking groups for children with special needs as an inclusion and stimulation activity, providing mums with a space to practice weaning recipes as part of existing peer support, cooking lessons/brunch gatherings for people who may be socially isolated, to facilitate weekly pay as you feel YOURCAFE sessions run by people with additional needs supported by the Chill in the Community staff, budget cooking lessons for local families and working with Edibledible York and Abundance York.",reduce isolation; improve activities for young people,01/08/2017,25/08/2017,3130,released to the group
WE-17-16,Westfield,CYC,Windsor Garth speed table repairs,improve the local environment and take pride in Westfield,13/09/2017,04/10/2017,3000,commisioned
WE-17-17,Westfield,Foxwood Community Centre,Defibrillator for Foxwood Community Centre,improve the local environment and take pride in Westfield,21/07/2017,21/07/2017,2000,released to the group
WE-17-63,Westfield,CYC,Remodeling Corlett Court,HEIP - Physical environment improvements to benefit Council tenants,27/06/2017,20/02/2018,850,ward contribution to the project
WE-17-76,Westfield,CYC,£2194  ‘young people’ general fund to be used for schemes to support activities for young people during the year,Improve activities for young people,27/07/2017,25/08/2017,2149,ongoing
WE-17-76d,Westfield,Home Start,"A grant to pay for recruitment of volunteers from the community of  Westfield Ward who will be trained to provide one to one support for families, with children under the age of six years, living within the ward.","Improve activities for young people, reduce isolation",12/12/2017,15/12/2017,1500,agreed
WE-17-77,Westfield,CYC,£2194  ‘adult social care provision’ general fund to be used for schemes to support activities for older people during the year,reduce isolation,27/07/2017,25/08/2017,2194,ongoing
WE-17-78,Westfield,CYC,£3657 ‘tidy up days’ pot to support bulky waste removal and provision of skips during community tidy up days, Improve the local environment and take pride in Westfield,27/07/2017,25/08/2017,3657,ongoing
WE-17-81,Westfield,CYC,Protection of verges on Bramham Avenue,Improve the local environment and take pride in Westfield ,04/10/2017,23/01/2017,2500,commisioned
WH-17-01,Wheldrake,CYC,"Complete the tarmacking of the cycle path in Naburn, phase one was completed in 2016, plans already complete and estimate already given",encourage community activity,03/05/2017,03/05/2017,10500,Commisioned to highways
WH-17-02,Wheldrake,CYC,"Street Sign on B1228 opposite Church Lane, Elvington",Encourage and increase community engagement,15/05/2017,15/05/2017,50,Funding Agreed
WH-17-04,Wheldrake ,Elvington Parish Council ,Replace barrier fencing that borders the beck at White House Grove,safer and cleaner communities,05/04/2017,06/06/2017,472,PAID
Wh-17-05,Wheldrake ,Elvington Under 5's,Install new hot water system to replace old water heaters,Encourage and increase community engagement,07/06/2017,07/06/2017,400,PAID
WH-17-08,Wheldrake,CYC,Improvements to signage for speed limits and repainting of the road surface that slows cars down,community safety,30/06/2017,30/06/2017,5200,With Highways
WH-17-10,Wheldrake,Elvington Scout Group,"Contribution to the purchase of a minibus for beavers, scouts and cubs to use",REDUCE SOCIAL ISOLATION,02/10/2017,05/10/2017,2000,PAID
