DW-17-36,Dringhouses & Woodthorpe,Gala Signs,Replacement of a broken lock on the ward notice board on Tadcaster Road,Improving the local environment,19/02/2018,20/02/2018,48,commissioned
Dw-17-38,Dringhouses & Woodthorpe,Brunswick Organic Nursery,Supply and  installation of three raised beds. Two raised beds to be installed at the Dringhouses Library courtyard and one outside shops on Moorcroft Road. Beds will be filled  with topsoil/compost/leafmould mix  and looked after local volunteers.,Improving the local environment,13/02/2018,21/02/2018,945,commisioned
DW-17-39,Dringhouses & Woodthorpe,York City Knights Foundation,Young people's activities provision at Moor Lane and on Woodthorpe Green - mobile skatepark and inflatable pitch sessions,"Improving access to services and support, Increasing community involvement",23/02/2018,26/02/2018,2220,commissioned
DW-17-40,Dringhouses & Woodthorpe,CYC,Pot of funding towards refilling and/or relocation of ward funded salt bins,"Improving the local environment, promoting community safety",27/02/2018,02/03/2018,400,ongoing
FH-17-03,Fulford & Heslington,Fulford Scouts ,Funding for extra camping equipment -a 6 man tent and a cast iron 2 burner cooker ,Fostering a sense of community and promote local voluntary groups ,05/07/2017,05/07/2017,500,Ongoing 
FH-17-05,Fulford & Heslington,CYC,Fordlands Crescent ,Enhance and preserve the local environment ,20/04/2017,20/04/2017,1500,with Highways
FH-17-11,Fulford & Heslington ,Fulford Table Tennis Club (sponsor org Fulford Community Sports Club),"Funding to set up a table tennis club, including equipment, sports club affiliation fee and Level 1 award in coaching table tennis",Fostering a sense of community and promote local voluntary groups ,05/07/2017,05/07/2017,1110,Ongoing 
FH-17-12,Fulford & Heslington ,Heslington Sportsfield Management Committee ,Funding to repair the Kompan climbing unit on the Sportsfield,1) Enhance and preserve the local environment 2) Foster a sense of community and support local voluntary groups ,05/07/2017,05/07/2017,222,Ongoing 
FH-17-13,Fulford & Heslington ,Heslington Sportsfield Management Committee ,Funding to repair the damaged wetpour safety surfacing around the playtower unit,1) Enhance and preserve the local environment 2) Foster a sense of community and support local voluntary groups,05/07/2017,05/07/2017,2000,Ongoing
FH-17-14,Fulford & Heslington ,Fulford Show ,Funding to purchase a marquee and two gazebos for Fulford Show,Foster a sense of community and support local voluntary groups,05/07/2017,05/07/2017,260,Ongoing 
FH-17-15,Fulford & Heslington ,York City Knights  ,£1700 contribution towards an inflatable assault course and 6 x 90 min sessions held in F&H ward and £200 towards a Summer Scheme ,Fostering a sense of community and promote local voluntary groups ,20/04/2017,20/07/2017,1700,Funding released to group 
FH-17-19,Fulford & Heslington ,Heslington Village Meeting Room,Grant to Heslington Village Meeting room committee to paint the village meeting room,Foster a sense of community and support local voluntary groups,17/10/2017,19/10/2017,333,PAID
FS-16-09,Fishergate,CYC Highways,Patching and topcoat resurfacing of the section of New Walk from Blue Bridge Lane to Holly Terrace.  Remarking cycle logos at each access point on the side furthest from the steps but no segregated line to encourage more considerate shared use of the space,Promote sustainable transport and increase road safety; Maintain and enhance the quality of the environment ,08/09/2016,09/09/2016,18000,Complete
FS-16-29,Fishergate ,York CVS ,Funding for the Communities Ready for Anything project ,"A welcoming community, working together; Maintain and enhance the quality of the environment ",25/04/2017,25/04/2017,2700,Funding released 
FS-16-29b,Fishergate ,York CVS ,Additional funding for the Communities Ready for Anything project ,"A welcoming community, working together; Maintain and enhance the quality of the environment ",04/07/2017,08/09/2017,800,Funding released to group 
FS-17-02,Fishergate ,OCAY ,Funding for a joint project with Broadway Area Neighbours and Friends (BANF) to offer outreach advocacy work in 'hub's around the ward ,"A welcoming community, working together  ",25/04/2017,25/04/2017,2700,Funding released 
FS-17-03,Fishergate ,"Fishergate, Fulford and Heslington Local History Society",Funding to purchase a 3 panel set of free standing display boards ,"A welcoming community, working together  ",25/04/2017,25/04/2017,345,Funding released
FS-17-04,Fishergate ,Millennium Fair Committee ,Funding to support the running of the fair on 2nd July ,"A welcoming community, working together; Maintain and enhance the quality of the environment ",15/05/2017,22/05/2017,1400,Funding released 
FS-17-08,Fishergate ,The Arts Barge Project, Funding towards the barge conversion and the mooring,"A welcoming community, working together  ",28/07/2017,09/08/2017,2000,Funding released to group
FS-17-12,Fishergate ,CYC Highways ,"Renew the red surfacing at the pedestrian crossing point on Cemetery Road, next to the Conservative Club ",Highways fund ,04/10/2017,05/10/2017,1000,Work commissioned
FS-17-14,Fishergate ,,Printing of 500 New Walk Riverside Path consultation leaflets ,"A welcoming community, working together, Promote sustainable transport and increase road safety, Maintain and enhance the quality of the environment ",16/11/2017,16/11/2017,41.25,Complete
FS-17-15,Fishergate,CYC,Provision of a new salt bin + 1 refill near to the Edible York Barbican beds on Paragon Street ,"Promote sustainable transport and increase road safety, Maintain and enhance the quality of the environment ",08/01/2018,10/01/2018,405,Complete
FS-17-16,Fishergate ,Friends of Danesmead Wood ,Funding for insurance to cover equipment and working in the wood,Maintain and enhance the quality of the environment ,19/01/2018,22/02/2018,145,Funding released to group
FS-17-17,Fishergate ,CYC ,"Funding for 6 replacement trees at various locations in the ward, as identified by Harvey Lowson ",Maintain and enhance the quality of the environment ,12/01/2018,15/01/2018,1500,Complete
FS-17-18,Fishergate,Melbourne Centre CIC,Establish an accessible disco and social evening once a month on a Saturday night for young people who find it difficult to access regular options ,"A welcoming community, working together  ",09/03/2018,08/03/2018,700,Funding released to  group 
FS-17-19,Fishergate ,Melbourne Centre CIC,"Establish a new Green Woodwork venue for education purposes of all ages and levels, situated in the wooded area behind Danesgate School. Four sessions to be funded to build interest","A welcoming community, working together; Maintain and enhance the quality of the environment ",09/03/2018,08/03/2018,660,Funding released to  group 
FS-17-20,Fishergate ,Melbourne Centre CIC,"Improve resources for community use at the Melbourne Centre, specifically developing and using musical equipment for learning and wellbeing activity ","A welcoming community, working together  ",09/03/2018,08/03/2018,400,Funding released to  group 
FS-17-21,Fishergate,Friends of Danesmead Wood ,Purchase of additional equipment and a bench ,Maintain and enhance the quality of the environment ,09/03/2018,08/03/2018,1011.44,Funding released to  group 
GU-17-01,Guildhall,Explore York Library and Archive,Improve the outside area known as Library lawn which attracts anti-social behaviour. The intention is to create a garden area using the sarcophagi as agreed with the City Archaeologist. They will also supplement with 2 raised beds which will be used to grow salads & vegetables supported by Edible York.,By bringing this space into use and involving the local community anti-social behaviour will be greatly reduced. This space will add to the green public spaces within the Guildhall ward. It will provide an additional space for activities for children and families and will be a safe and welcoming space for all to enjoy.,10/05/2017,10/05/2017,400,released to the group
GU-17-02,Guildhall,Door 84,"The toilets are in much need to be refurbished to become more accessible, fit for purpose, increase how welcoming the space feels and comply with adapted health and safety requirements. To create a toilet area which has separate male, female and disabled access and changing facilities for children, young people and adults who need assistance with toileting and getting changed. ","‘People embrace diversity in their communities’ 
This will embrace not only the diversity in the community of Door 84 yet Guildhall as a whole for all of the residents who use the space or intend to in the future. 
",10/05/2017,10/05/2017,5000,Released to the group
GU-17-03,Guildhall,The Arts Barge Project,To build the barge conversion and for mooring. This will allow for all future events to take place. The Arts Barge is a community focused floating arts venue with full disabled access.,"There will be less anti-social behaviour due to many free of charge, accessible activities. Parks and green spaces will be better maintained as Tower Gardens will have volunteers and groups working here. Also, fewer people will suffer from loneliness and will embrace diversity due to the activities on offer. ",14/06/2017,14/06/2017,3000,Released to the group
GU-17-04 ,Guildhall,York BID,"Taxi Rank Marshals 

A taxi marshal trial programme,  where two marshals will be stationed at the Duncombe Place taxi rank on Friday and Saturday evenings, 10pm-4am. They will be tasked with managing the queue, reporting anti-social activity and delivering an efficient and orderly speed of service. The trial will address concerns from businesses, residents and tourists regarding the late night anti-social behaviour at the rank’s location.  


",there is less anti-social behaviour,12/07/2017,12/07/2017,2000,released to the group
GU-17-07,Guildhall,KYRA,"Kyra Women’s Project - Install WIFI/payment of first year bills 
Install wi fi and a telephone line to a new office space and help with payment of first years bills 


The space will ensure that we can continue to provide the provision and give room to ensure security and confidentiality of paperwork. The room is situated on the other side of the building to which we are based and we require to install wi fi and a telephone line.
",people embrace diversity in their communities,12/07/2017,12/07/2017,2103,released to the group
GU-17-08,Guildhall,Spark: York,"Grant to create the Spark:York community sensory garden. The garden will be the centrepiece of Spark:York. It is being created in partnership with Edible York, York Orchard Trust, The Prince's Trust and York Inspirational Kids. There will be a mentor scheme with tutors, who will be teaching the most vunerable young people in the ward gardening and growing skills. ",The garden will add an additional green space within the Guildhall Ward. It will provide an additional space for activities for children and families. It will be a safe space and welcoming space for all the community to enjoy.  This meets the ward priority: Reducing the number of people suffering from loneliness,09/08/2017,09/08/2017,10000,Funding released to the group
GU-17-09,Guildhall,FOGGEY (Friends of Guildhall Group and Edible York),"FOGGEY (Friends of Guildhall Group and Edible York) picks fruit, mainly apples and pears, and will then either use it to make juice at community events, or distribute them to people who would not otherwise have access to fruit. The grant is to purchase bags to hold the fruit. ",This meets  two ward prioirites: better maintenance of parks and green spaces. Fewer people suffering from loneliness.,13/09/2017,13/09/2017,100,Funding released to group
GU-17-10 ,Guildhall,Briars House Wellbeing Centre,"Briars House Wellbeing Centre caters for support groups including mental health support, Arts Barge Art Therapy for adopted children and other community groups. The grant is for storage cuboards for groups to use.",This meet the ward priorities: Fewer people suffering from loneliness and for people to embrace diversity in their communities.,13/09/2017,13/09/2017,2480,Funding released to group
GU-17-11,Guildhall,Door 84 ,"Door 84 is a community centre in the based in the Groves. The community centre caters for many groups including SNAPPY, Groves Residents Association, Lollipop (Childrens death chairty and many Youth Services. The grant is for repair work of Door 84's building. ",This meet the ward priorities: Fewer people suffering from loneliness and for people to embrace diversity in their communities.,13/09/2017,13/09/2017,9000,Funding released to group
GU-17-12,Guildhall,York Nurturing Community ,"Community Hub and Cafe based at Spark: York. To create a space that caters for all, which operates on a pay as you feel basis. Cooking hot and cold healthy foods.",This meets the ward priority: Reducing the number of people suffering from loneliness,09/08/2017,09/08/2017,10000,Funding released to the group
GU-17-15 ,Guildhall,Red Tower ,"Funding has been covered for part of the capital cost to refurb and fit out the Red Tower in 2016/17, making the building more serviceable and comfrotable for users. This includes a WC, Kithcen, Lighting and heating. Red Tower have secured additonal funding to complete the project with Yorventure. Part of the agreement of Yorventure grant was the 10% of the grant has to be paid by a third party. This ward will apy this 10% which will secure the YorVenture grant and allow works to be complete.",This meets the ward priority: Reducing the number of people suffering from loneliness,08/11/2017,08/11/2018,4986,Funding released to group
GU-17-17,Guildhall,CYC,"To reduce speeding on Clarence Street and Haxby Road., by extending the current Islands and making them larger and safer for residents.  Approximate cost of £10,000 per island. The ward will fund 2 of them.","Safety amongst residents will be better and reduce any potential accidents, especially in winter conditions. ",13/12/2017,13/12/2017,20000,Funding agreed 
GU-17-18,Guildhall,CYC ,To fill 10 salt bins that are not directly owned by City of York Council. £55 per refill.,"Safety amongst residents will be better and reduce any potential accidents, especially in winter conditions. ",27/02/2018,27/02/2018,550,Complete 
HE-16-09,Heworth,Tang Hall Community Centre,Grant towards the refurmbishment to a Changing Places toilet,"1) A Safer, cleaner environment, 2) A healthy and vibrant community, 3) Developing and supporting a prosperous community ",03/07/2017,03/07/2017,30000,Funding released to group
HE-16-14,Heworth ,Bell Farm Community Association ,Funding for 1) reinstatement of the stage at Bellfarm social hall 2) build a storage area and a small office 3)re-surface and restore to original use the small childrens outside space at the hall 4) continue to run Bellfarm Homework and Community Club for a further year ,"2) A healthy and vibrant community, 2) Developing and supporting a prosperous community ",03/07/2017,03/07/2017,21930,Funding released to  group
HE-17-02,Heworth ,Glen Mosaic Community Garden ,Funding for equipment and supplies to continue maintaining and developing the garden ,"1)A healthy & vibrant community, 2) Developing and supporting a prosperous community ",03/07/2017,03/07/2017,515,Funding released to group
HE-17-06,Heworth ,Tang Hall Big Local ,Funding towards the cost of the activitites at Tang Hall Community Centre during the Tang Hall Family Festival on 23.7.17,1) A healthy & vibrant community 2) Developing and supporting a prosperous community ,03/07/2017,03/07/2017,1000,Funding released to group 
HE-17-13,Heworth ,Friends of Helen Cadbury ,Funding towards a memorial area in Glen Gardens ,"A Safer, cleaner environment; A healthy & vibrant community ",11/09/2017,08/01/2017,4000,Funding released to group 
HE-17-14,Heworth ,Friends of Glen Gardens ,Funding to convert a disused gents toilet in the pavillion into a storeroom ,"1) A Safer, cleaner environment, 2) A healthy and vibrant community, 3) Developing and supporting a prosperous community ",22/12/2017,12/01/2018,1500,Funding released to group
HE-17-18,Heworth ,,"Design, print and distribute a Heworth Community newsletter ","A healthy and vibrant community, Developing and supporting a prosperous community ",11/09/2017,11/09/2017,1450,Complete
HE-17-19,Heworth ,Home Start York,"Funding to recruit and train volunteers from the Heworth ward community, to provide one to one support for families with children under the age of 6 living in the ward","A healthy and vibrant community, Developing and supporting a prosperous community ",22/12/2017,22/01/2018,1500,Funding released to group
HE-17-20,Heworth ,Big Futures Foundation ,Funding towards providing a schools counselling service for disadvantaged children at Tang Hall Primary School and Haxby Road Primary School ,"A healthy and vibrant community, Developing and supporting a prosperous community ",22/12/2017,22/01/2018,4460,Funding released to group
HE-17-21,Heworth ,York Flourish ,Funding towards running a weekly Meet & Eat lunch club at Tang Hall Community Centre,"A healthy and vibrant community, Developing and supporting a prosperous community ",25/01/2018,26/02/2018,6424,Funding released to group 
HE-17-22,Heworth ,Tang Hall Community Centre,Funding towards the purchase and installation of a defibrillator at the centre ,"A healthy and vibrant community, Developing and supporting a prosperous community ",09/02/2018,09/02/2018,825,Funding released to group
HE-17-23,Heworth ,Bell Farm Social Hall Management Committee ,Funding for a new door mat in the reception area and fit a new window in an external wall,"1) A Safer, cleaner environment, 2) Developing and supporting a prosperous community ",14/02/2018,15/02/2018,3000,Funding released to group
HE-17-26,Heworth ,Healthwatch at York CVS ,Funding to run a community consultation focused on the changes being made to health and care services as a result of the Burnholme site development ,A healthy and vibrant community;  Developing and supporting a prosperous community ,23/02/2018,26/02/2018,6000,Funding released to group
HE-17-27,Heworth ,Glen Allotments Plot 46 Special Needs Children ,"Funding for: Purchasing stone to repair car park, new signs on the gate to protect the children, repairs to the shed and a sign to stop flytipping",A healthy and vibrant community ,23/02/2018,26/02/2018,730,Funding released to group
HE-17-29,Heworth ,Citizens Advice York ,"Funding to extend the weekly advice and budgeting sessions in the ward offer a range of debt, benefits and general advice from Bell Farm Social Hall ",Developing and supporting a prosperous community  ,08/03/2018,09/03/2018,3000,Funding released to  group 
HeW-17-01,Heworth Without,Heworth Rugby League Club,A grant towards costs of  the Heworth Rugby League Club changing room refurbishment including resurfacing the floor and fixing showers.,Community provision,28/02/2017,26/04/2017,3000,Funding released
HeW-17-02,Heworth Without,New Visuality,Grant for a series of art sessions (10 sessions over 10 weeks) with senior residents from the ward,"Community provision , reducing social isolation",22/03/2017,21/04/2017,2490,Funding released
HeW-17-03,Heworth Without,Heworth Cricket Club,A grant towards refurbishment of the changing room and creation of an en-suite shower facilities for girls/ladies football teams.,Community provision,04/04/2017,21/04/2017,2000,Funding released
HeW-17-05,Heworth Without,The Hut,"A grant towards replacement of floor and purchase of new materials incl. PS3, Televisions, footballs, basketballs, PS3 games and craft materials",Community provision,10/05/2017,06/06/2017,2880,released to the group
HeW-17-06,Heworth Without,Christ Church Senior Friends,A grant towards outings by coach or car to local places of interest in York area.,"Community provision , reducing social isolation",10/05/2017,06/06/2017,485,released to the group
HeW-17-07,Heworth Without,CYC Public Realm Team,Payment from the ward budget to maintain the current level of grounds maintenance service.,Improvements to the streets and landscapes,10/05/2017,06/06/2017,2334,Funding Agreed
HnE-17-05,Huntington & New Earswick,Activ8Learning,"To run the provision man cave which will offer weekly craft & still workshops to elderly isolated residents in Huntington, funding to run 30 x 4 hour weekly sessions, materials, room hire, tutors and marketing ",Increase community safety and cohesion,10/05/2017,20/07/2017,5800,Funding Agreed
HnE-17-06,Huntington & New Earswick,The Toolbox Project,To run holiday provisions for young people living within Huntington and New Earswick ward,Increased opportunities for young people,09/05/2017,20/07/2017,1800,Funding Agreed
HnE-17-08,Huntington & New Earswick,York CVS ,"To offer the ward a social prescribing scheme to combat loneliness and isolation, ",Increase community safety and cohesion,10/05/2017,20/07/2017,3645,Funding Agreed
HnE-17-09,Huntington & New Earswick,Friends of New Earswick School (FONES),Twards the costs of running their annual summer fair,Increased opportunities for young people,18/05/2017,05/07/2017,500,Funding Agreed
HnE-17-10,Huntington & New Earswick,Park Run ,"Towards the cost of establishing a park Run within the ward the grant will cover set up costs (laptop, hi viz clothing, timing equipment, course markers)",Increased opportunities for young people,19/09/2017,27/07/2017,2000,Funding Agreed
HNE-17-18,Huntington & New Earswick,Wilberforce Trust,"Towards Volunteer expenses, training, DBS checks and costings towards the volunteer hub situated within the ward",Increase community safety and cohesion,28/02/2017,20/07/2017,1500,Approved
HNE-17-21,Huntington & New Earswick,York CVS ,"Ready for anything programme in response to the 2015 floods in event of future floods or other major incidents. Towards resources, story sacks volunteer and coordinator expense & support supervision and evaluation costs",Increase community safety and cohesion,21/03/2017,20/07/2017,3645,Funding Agreed
HO-16-19,Holgate,Holgate Allotments Association,Bringing allotment holders and the community together by creating a community garden,"supporting & encouraging efforts of local people; supporting & encouraging strong, safe, communities",17/03/2017,17/03/2017,3500,Funding Agreed
HO-17-01,Holgate,Chill in the community,Extend Kitchen facilities to enable more community group usage,"reducing social isolation, ",14/06/2017,14/06/2017,4158,Funding Agreed
HO-17-02,Holgate,Railway Institute Bowls Club,Funding for an exterior cabinet for a defibrillator and an open training session,"supporting & encouraging efforts of local people; supporting & encouraging strong, safe, communities",02/06/2017,02/06/2017,714,Funding Agreed
HO-17-03,Holgate,Friends of West Bank Park,Funding to plan and deliver the west bank park summer fair,"supporting & encouraging efforts of local people; supporting & encouraging strong, safe, communities",14/06/2017,14/06/2017,898,Funding Agreed
HO-17-04,Holgate,Poppleton Road out of school club,Funding towards delivering a summer programme of sports and activities,"supporting & encouraging efforts of local people; supporting & encouraging strong, safe, communities",14/06/2017,14/06/2017,1500,Funding Agreed
HO-17-05,Holgate,New Lane Sports Club,Contribution towards the improvements to the road from the main site access to the clubhouse,"supporting & encouraging efforts of local people; supporting & encouraging strong, safe, communities",16/06/2017,19/06/2017,5506,Funding Agreed
HO-17-09,Holgate,The PCC of the Parish of St Paul's Holgate,"Provide a monthly club for the over 60's, with lunch and entertainment",Reducing social isolation,28/07/2017,31/07/2017,600,Paid
HO-17-10,Holgate,York RI New Lane Community Sports Club,Hold a Christmas concert with music and refreshments at York RI sports club on Hamilton Drive. Funding will allow tickets to pensioners to be free of charge,"1: supporting and encouraging the efforts of local people and groups to continue to improve Holgate and provide activities for all ages. 2: work with communities to reduce social isolation, 3: support and encourage strong, safe and friendly communities",01/11/2017,01/11/2017,300,Paid
HO-17-11,Holgate,Friends of West Bank Park,For Friends of West Bank Park to pay a security firm for locking of the park gates overnight for a year,"•supporting and encouraging the efforts of local people and groups to continue to improve Holgate and provide activities for people of all ages
•supporting and encouraging strong, safe and friendly communities
",16/11/2017,16/11/2017,2000,Paid
HR-16-07,Hull Road ,Tang Hall Community Centre,Grant towards updating the toilet and shower block facilities in the centre (match funding with Heworth ward),1) Promote a friendly & welcoming community 2) encouraging volunteering & community involvement 3) Supporting residents to prosper and access the services they need ,13/07/2017,13/07/2017,15000,Funding released to group 
HR-17-03,Hull Road ,TCV,Funding to support the Tang Hall Festival ,1) Promote a friendly & welcoming community 2) encouraging volunteering & community involvement ,27/06/2017,27/06/2017,2500,Funding released to group
HR-17-04,Hull Road ,CYC Public Realm Team,Contribution to the Hull Road Park Café project - 6 months portacabin hire up to March 2018,1) Promote a friendly & welcoming community 2) encouraging volunteering & community involvement 3) Supporting residents to prosper and access the services they need ,27/06/2017,27/06/2017,8500,Funding released  
HR-17-10,Hull Road ,CYC,"3 salt bins to replace the ones removed in 2011on Newland Park Drive, Olympian Court and Melrosegate outside the WMC",Highways ,13/11/2017,13/11/2017,1215,Complete
