Scheme Reference,Ward,Recipient of ward funding,Scheme details ,Ward Priority met,Date passed to Ward Committee for decision,Date funding approved by Ward Committee,Final amount approved,Status
AC-16-14,Acomb,CYC commisioned external providers,Sports activities provision for young people in the ward - sumer 2017,"Increasing facilities and activities for young people , Improving health and wellbeing, Improving community involvement",01/02/2017,15/02/2017,1910,paid
AC-16-14a,Acomb,CYC commisioned external providers,Sports activities provision for young people in the ward - sumer 2017,"Increasing facilities and activities for young people , Improving health and wellbeing, Improving community involvement",01/02/2017,15/02/2017,1910,paid
AC-17-01,Acomb ,CYC Public Health team,Funding towards publicity materials and other costs associated with running of the Acomb Fun Run +  publicity of sports activities commisioned by the ward for summer 2017,"Increasing facilities and activities for young people , Improving health and wellbeing, Improving community involvement",01/02/2017,14/03/2017,500,Funding released
AC-17-03,Acomb ,The Island,1 to 1 mentoring mentoring of 8 vulnerable young people from the ward over the period of 52 weeks,"Increasing facilities and activities for young people , Improving health and wellbeing, Improving community involvement",01/04/2017,06/07/2017,6240,released to the group
AC-17-04,Acomb ,CYC Public Realm Team,dual purpose bin to be placed at the Boroughbridge Road end of the snicket from Albion Avenue,"A cleaner, greener ward",05/04/2017,05/04/2017,0,Bin requested
AC-17-05,Acomb ,CYC commisioned an external contractor,Replacement  of the front plastic glazing  on the  Princess Drive notice board.,Increasing community involvement,23/03/2017,05/04/2017,135,commisioned
AC-17-06,Acomb,CYC Highways,Danebury Crescent - to reconstruct footway and verges in Tarmac allowing vehicles to overrun on the verge. This is to eliminate recurring damage to grass verges.,Improvements to the local highways infrastructure - capital pot,05/04/2017,13/10/2017,25000,scheme commissioned 
AC-17-07,Acomb,Older Citizens Advocacy York,"A grant towards the postcard project to identify older people who are suffering from loneliness or social isolation. The project will incorporate door to door work, ‘pop up’ social hubs in differing areas of the ward and recruitment of community friend volunteers.","reducing social isolation, increasing community involvement",23/05/2017,22/06/2017,3250,released to the group
AC-17-08,Acomb,Holy Redeemer Church,A grant towards purchase of a secure store to be placed within the Church grounds to provide additional storage space to enable groups to expand their work and to welcome potential new users,"Increasing community involvement, increasing facilities and activities for young people",23/05/2017,22/06/2017,2600,released to the group
AC-17-09,Acomb,Carr Allotments Association,"A grant towards developement an existing ‘community plot’ on the Carr allotment site including creation of an inclusive and social space for plot holderswith a view for the plot to be used as an engagement environment with outside groups e.g. Carr Junior School. The community plot will include a community notice board, a covered seating area to double as a lecture/demonstration space, a pond, easy-access raised beds for use with the elderly, young children and wheelchair users, and a small wild flower meadow to complement the onsite apiary and increase biodiversity.","Increasing community involvement, increasing facilities and activities for young people, reducing social isolation, improving health and wellbeing, a cleaner, greener ward",23/05/2017,22/06/2017,1145,released to the group
AC-17-10,Acomb,Chill in the Community,"A grant towards development of facilities to incorporate a group kitchen.The kitchen will be used for teaching vulnerable adults to cook independently, teaching teens to cook for themselves nutritiously and on a budget, cooking for carers and young carers as a peer support activity, cooking groups for children with special needs as an inclusion and stimulation activity, providing mums with a space to practice weaning recipes as part of existing peer support, cooking lessons/brunch gatherings for people who may be socially isolated, to facilitate weekly pay as you feel YOURCAFE sessions run by people with additional needs supported by the Chill in the Community staff, budget cooking lessons for local families and working with Edibledible York and Abundance York.","increasing community involvement, reducing social isolation",23/05/2017,17/07/2017,4280,released to the group
AC-17-13,Acomb,Acomb Alive Traders Association,"A grant for plants and planters to be installed outside businesses on The Green, Acomb.","A cleaner, greener ward",22/05/2017,22/06/2017,470,Released to the group
AC-17-21,Acomb,Yorkey Dads,A grant towards start up costs of Yorkey Dads breakfast club at Lidgett Methodist Church ,"Reducing social isolation , improving health and wellbeing, increasing community involvement, improving facilities and activities for young people",04/08/2017,07/08/2017,2000,released to the group
AC-17-22,Acomb,CYC,Wheatlands Grove street lights redesign,Highways improvements,07/07/2017,01/09/2017,500,paid
AC-17-24,Acomb,New Visuality,"A grant for a 'The Acomb Time Traveller' project which aims to recruit 20 local young people and support them to develop a wide range of creative skills such as digital arts, silk screen poster making,, photography and storytelling.","Improving facilities and activities for young people, Increased community involvement",22/11/2017,22/12/2017,2011,funding released
AC-17-28,Acomb,Citizens Advice Bureau,A grant to Citizens Advice Bureau towards weekly advice and budgeting sessions in the ward.,"Reducing social isolation, improving health and wellbeing, increased community involvement",13/12/2017,22/12/2017,4330,grant released
Bi-17-01,Bishopthorpe,Lower Wharfe Canoe Club,Purchase of a speciality kayak ,Reduce social Isolation,23/03/2017,24/03/2017,429,Funding Agreed
Bi-17-02,Bishopthorpe,Brunswick organic nursery,Annual grounds maintenance in Bishopthorpe Ward,Improve the enviroment,23/03/2017,31/03/2017,4150,Funding Agreed
BI-17-03,Bishopthorpe,Vernon House Mens Shed,Grant to the new mens group at Vernon House to purchase a shed to help store tools and equipment for the projects,1: Encourage community involvement.  2: Reduce social isolation,29/06/2017,29/06/2017,500,Paid
BI-17-04,Bishopthorpe,Friends of Bishopthorpe Infant School,"Grant to provide sheds, gravel, paving to help set up the new garden area for the kids gardening club",Encouraging commuity involvement,17/07/2017,19/07/2017,1500,Funding Agreed
Bi-17-05,Bishopthorpe,Highways,New Sign at Acaster Malbis,Enhance and improve the local environment,29/07/2017,29/07/2017,1246.14,Paid
BI-17-07,Bishopthorpe,Brunswick Organic Nursery,"Grant to Brunswick Organic Nursery for general maintenance work; to tidy up and replant planters, plant trees, provide extra planters, trim hedges, strim weeds and remove rubbish when required",1: Enhance and improve the local environment. 2: Encourage community involvement. 3: Reduce social isolation,04/10/2017,04/10/2017,5500,Paid
CL-16-19 ,Clifton ,CYC ,Purchase 750 lavender plants along Kingsway North to continue the Colourful Clifton Project with volunteers across the ward ,Cleaner and greener Clifton (2016/17 priority),15/04/2017,15/04/2017,1087.5,Plants on order
CL-17-01,Clifton,York City Football Club Foundation ,We host a weekly coffee morning called Sporting Memories every Friday at the stadium. Currently the event is free to attend and those that come down are offered a complimentary hot drink and general sustenance to enjoy whilst they reminisce about sporting nostalgia that is personal to them. ,An Inclusive ward,04/04/2017,04/04/2017,1985,released to the group
Cl-17-02,Clifton,Clifton Parish Church,Clifton parish church to Purchase of stackable chairs and tables,An Inclusive ward,30/03/2017,20/03/2017,1839.9,released to the group
CL-17-04,Clifton,Clifton Parish Church,"Ready steady mums, an opportunity for new and vulnerable mums to meet, socialise and wark around Homestead Park ",Improving opportunities and facilities for young people. Reducing social isolation for a more inclusive Clifton ,04/07/2017,04/07/2017,800,released to the group
CL-17-05 ,Clifton,City of York Football Club Foundation,"York City Football Club Foundation will offer Free football holiday coaching activities for the Summer of 2017. The project  will involve the local community and the bringing of all 3 schools in the area together. 

The sessions will run as a holiday provision using a local community venue, which will allow the residents and families of Clifton to access a free holiday provision. This will run as a daytime and early evening sessions (appropriate to age group) of 2 hours each and are looking to run one day a week in the school holidays over the 2017 summer programme. 

The sessions will be for 7-11, 11+ year olds and we will have a maximum of 32 places per age group.",Improving opportunities and facilities for young people,04/07/2017,04/07/2017,2998,released to the group
CL-17-06,Clifton,St Lukes Church ,"Create a  Project Coordinator post. The person would have three key roles in Coordination of St Luke’s Community Project

To include 
• Friday Cafe 
• Forget Me Not Service:
• Burton Green Outreach.",Engagement with residents for a more cohesive Clifton ,04/07/2017,04/07/2017,3500,released to the group
CL-17-07 ,Clifton,CYC,"To run the 3 activities below 1. Activity week
2. Coffee Morning
3. Grapevine magazine. 
4. After-school club at Burton Green Primary School.
",Improving opporutnities and facilities for young people.,04/07/2017,04/07/2017,3827,released to the group
CL-17-08,Clifton,Citizens Advice Bureau,"CAB will run  a regular Information and Budgeting Support at the St Lukes cafe on Friday mornings, to increase people’s financial capability and money managing.


",Reducing soical isolation for a more cohesive Clifton. ,20/07/2017,20/07/2017,4098,released to the group
CL-17-09,Clifton ,Clifton Elderberries,Grant support for the running cost of Clifton Elderbbieries day trips. Most reisdnets are un able to leave the ward and these trips provide some much needed restbite. ,Reducing social isolation for a more cohesive ward.,06/07/2017,06/07/2017,450,released to the group
CL-17-15 ,Clifton,CYC ,Purchase of 1700 lavender plants along Kingsway North to continue the Colurful Clifton Project with volunteers across the ward,A greener cleaner Clifton. Engagement with residents for a more cohesive Clifton.,08/08/2017,08/08/2017,2465,Paid
CL-17-18 ,Clifton,Vale of York Society,To purchase music equipment and increase music engagement across Clifton Ward. To work on providing some services to support primary schools. Liasing with the elderly within the community and providing community wide engagements throughout the year.,Improving opportunites and facilities for young people,08/11/2017,08/11/2017,600,released to the group
CL-17-20,Clifton ,Clifton Residents Association,"Funding the projects below, in conjuntion with CLifton RA/Clifton Green Primary and Burton Green Primary friends:                                                      1. Dads’ breakfast scheme
2. Family Fun Day – This has become an annual trip for Clifton families to enjoy a trip out to the seaside. This year we would like to pay for an additional bus, so the trip would facilitate over 200 people from our area, enjoying a day at Scarborough together. 
3. Allotment  project – We would like to continue to enhance the allotment spaces/outdoor learning spaces in the area, making them more accessible for all families, encouraging children to grow their own fruit and veg and learn skills for the outdoors that would help them in the future. 
4.  ‘Food to share’ project – This would be an opportunity to celebrate diversity. People from different cultures would bring a traditional dish to the event. People from the area would be invited to join together, in sharing the different foods from around the world. The event would also include some entertainment and information symbolic of some of the cultures on show. 
5. Snack Shack – a charitable enterprise where we can salvage food destined for landfill and prepare healthy snacks for the children to eat after school. The idea being to try and replace crisps and biscuits with healthy food.  ",Improving opportunites and facilities for young people,08/11/2017,08/11/2017,5212,released to the group
CL-17-21 ,Clifton,Accessible Arts and Media,"Funding to support Accessible Arts and Media Creative Community project, by:                                                                                                      • providing creative sessions for older people and those living with dementia in Clifton and in residential care homes based in Clifton using digital technology
• helping residents put together living memory films which they can access online or through iPads
• providing training for learning disabled adults and volunteers accessing mental health services to enable them to co-deliver these activities
• providing training for community groups and residential care home staff to continue these creative activities once this project ends",Reducing soical isolation for a more cohesive Clifton ,26/11/2017,26/11/2017,1000,released to the group
CL-17-22,Clifton,Clifton Timebank,"Set up of a new Clifton Timebank. Residents can access practical help and support from volunteers, who in return can offer support. ",Reducing soical isolation for a more cohesive Clifton ,25/01/2018,25/01/2018,490,released to the group
CO-17-01,Copmanthorpe,Panda playgroup,"A grant towards play equipment, training and expenes for volunteers incl first aid and DBS's.",supporting activities for young people,21/06/2017,21/06/2017,1500,released to the group
CO-17-03,Copmanthorpe ,CYC ,Installation of a street light on the junction of Horseman Close and Horseman Drive.,HEIP - Physical environment improvements to benefit Council tenants,28/06/2017,21/08/2017,1000,commisioned
CO-17-08,Copmanthorpe,CYC,Merchant Way / Flaxman Croft junction road resurfacing,Highways,27/07/2017,20/09/2017,5000,work ordered
CO-17-09,Copmanthorpe,CYC highways,Slurry Sealing 1-25 Gardener's Close,highways,03/08/2017,03/08/2017,1400,completed
CO-17-10,Copmanthorpe,Copmanthorpe WI,A grant to purchase and install HDMI projector with ceiling mount bracket and electric projection screen.,"supporting older people, supporting activities for younger people",02/11/2017,20/12/2017,3202,Funding released to group 
CO-17-11,Copmanthorpe,Copmanthorpe Bowling Club,A grant to Copmanthorpe Bowling Club to purchase a sprayer to apply liquid fertilisers etc. to maintain their bowling green,supporting older people ,13/11/2017,16/11/2017,780,funding released
CO-17-13,Copmanthorpe,CYC Public Protection,"To introduce Cold Calling Zone on Temple Lane, Tadcaster Road and Manor Heath in Copmanthorpe",community safety projects,30/11/2017,20/12/2017,2220,funding released
CO-17-14 ,Copmanthorpe,Copmanthorpe Parish Council,A grant towards commemoration of WW1 end - Beacons of Light on 11 November 2018,"supporting older people, supporting activities for younger people",20/12/2017,06/02/2018,1000,grant released
CO-17-15,Copmanthorpe,Copmanthorpe Tennis Club,A grant towards purchase of junior sized racquets and lvl 1coaching course for a volunteer. ,supporting activities for young people,09/01/2018,06/02/2018,500,grant released
CO-17-16,Copmanthorpe,Copmanthorpe Scout Group,"A grant towards painting a mural on the Scout Hut walls, This is to celebrate 50 years of scouting in Copmanthorpe and provide permanent legacy for future generations.",supporting activities for young people,17/01/2018,06/02/2018,500,grant released
CO-17-17,Copmanthorpe,Copmanthorpe Youth Club,A grant towards replacing kitchen units and worktops at the Club.,"supporting activities for young people, supporting older people",17/01/2018,06/02/2018,1008,grant released
CO-17-19,Copmanthorpe,The Good Companions,A grant towards board games and equipment to be used during group's weekly sessions,Supporting older people,30/01/2017,06/02/2018,200,grant approved
CO-17-20,Copmanthorpe,Copmanthorpe Recreation Centre,A grant towards accessible play equipment for children with special needs or disabilities to be installed within the Recreation Centre play area,Supporting activities for young people,31/01/2017,06/02/2018,4000,grant released
CO-17-21,Copmanthorpe,Panda playgroup,A grant towards purchase and installation of a nappy changing table at Howell Hall.,Supporting activities for young people,01/02/2018,06/02/2018,200,grant approved
DW-15-27,Dringhouses & Woodthorpe,CYC Highways,"Resurface part of Old Moor Lane footpath, near junction with Tadcaster Road , upto £8000",Highways,01/01/2016,09/03/2016,8000,Commissioned to Highways
DW-16-24,Dringhouses & Woodthorpe,CYC,Feasibility study for a pedestrian refuge on on Tadcaster Road between the junction with Nelson’s Lane and existing pedestrian crossing leading to Hob Moor allotments.,Highways,01/09/2016,19/10/2016,1500,commisioned
DW-16-28,Dringhouses & Woodthorpe,CYC Highways,Cycle path surface improvements on Little Hob Moor - upper part,Ward highways/capital pot,08/11/2016,11/11/2016,1750,Commisioned to highways
DW-16-29,Dringhouses & Woodthorpe,CYC,"Vehicle Activated Sign to address vehicle speeding on Chalenors Road, between the junctions with Thanet Road and Eason View.",Highways,01/02/2016,15/11/2016,3500,commisioned
DW-16-38,Dringhouses & Woodthorpe,CYC Parks and Open Spaces,Nelson's Lane play area improvements,"improving the local environment, increasing community involvement, improving assess to services and support  ",01/02/2017,12/02/2017,4381,Commisioned
DW-16-39,Dringhouses & Woodthorpe,CYC Parks and Open Spaces,Woodthorpe Green play area improvements,"improving the local environment, increasing community involvement, improving assess to services and support  ",01/02/2017,12/02/2017,4381,Commisioned
DW-16-41,Dringhouses & Woodthorpe,CYC commisioned an external contractor,To replace out of date contact details on the front panel of the ward notice board on Middlethorpe Grove,"Priorities: Increase community involvement, improving access to services and support. Outcome: enhanced  means of communication to local residents to make them aware of local issues and opportunities",23/03/2017,23/03/2017,65,Completed
DW-17-01,Dringhouses & Woodthorpe,CYC parks and Open Spaces,Nelson's Lane play area improvements,"improving the local environment, increasing community involvement, improving assess to services and support  ",24/01/2017,15/02/2017,5109,Commisioned
DW-17-02,Dringhouses & Woodthorpe,CYC Parks and Open Spaces,Woodthorpe Green play area improvements,"improving the local environment, increasing community involvement, improving assess to services and support  ",24/01/2017,15/02/2017,6624,Commisioned
DW-17-03,Dringhouses & Woodthorpe,Woodthorpe pre-school Playgroup,A grant towards the fence around the playgroup outdoor area to enhance children's safety,Access to services and support,04/05/2017,15/05/2017,0,Funding returned
DW-17-04,Dringhouses & Woodthorpe,York Neighbours,"To sustain and expand York Neighbours activities in Dringhouses and Woodthorpe Ward over the 9 months of 2017-18 before they are able to apply for funding from other streams i.e. the Big Lottery. Funding required to cover costs associated with recruitment and training of new local volunteers, and arranging new referrals/identifying new neighbours.","Access to services and support, Increasing community involvement",04/05/2017,15/05/2017,1000,Funding released
DW-17-05,Dringhouses & Woodthorpe,West Thorpe Pre School,A grant towards outdoor water play equipment and a storage container.,Increasing community involvement,04/05/2017,15/05/2017,264,Funding released
DW-17-06,Dringhouses & Woodthorpe,Dringhouses Bowling Club,A grant to purchase and automated external defibrillator to be mounted outside the club house which will make it available to members of the public.,Promoting community safety ,04/05/2017,15/05/2017,1600,Funding released
DW-17-09,Dringhouses & Woodthorpe,Older Citizens Advocacy York,"A grant towards the postcard project to identify older people who are suffering from loneliness or social isolation. The project will incorporate door to door work in the area of the ward to be confirmed between the Ward Committee and OCAY, ‘pop up’ social hubs in differing areas of the ward and recruitment of community friend volunteers.","increasing community involvement, improving access to services and support",04/05/2017,15/05/2017,1000,Funding released
DW-17-10,Dringhouses & Woodthorpe,Mayfields Community Trust,"A grant for additional and replacement tools and safety equipment  to enable the group to work effectively. The equipment will include  an electric mower battery, brushcutter, heavy duty rubber gloves, hats with visors, secateurs and replacement saw blades","increasing community involvement, improving the local environment",04/05/2017,15/05/2017,810,Funding released
DW-17-11,Dringhouses & Woodthorpe,Friends of Hob Moor,A grant towards purchase and installation of 5 leaflet dispensers at the location of existing notice boards.,"improving the local environment, increasing community involvement, improving assess to services and support  ",04/05/2017,15/05/2017,1628,funding released 
DW-17-12,Dringhouses & Woodthorpe,CYC ,Bench for Chaloners Road Park,improving the local environment  ,12/04/2017,15/05/2017,550,Commisioned
DW-17-13,Dringhouses & Woodthorpe,Dringhouses PC Scout Group,A grant towards purchase of camping equipment to enable the group to cope with increased membership and cater for groups ranging between 30 and 200 people,"Increased community involvement, improved access to services and support",04/05/2017,15/05/2017,1975,Funding released
DW-17-14,Dringhouses & Woodthorpe,Friends of Chapman's Pond,"A grant towards tree work, purchase of 1 year insurance cover for volunteers, grass strimmer, fleece jackets and card payment device to ebable the group to maintain and enhance the quality of the pond and woodland.","Improving local environment, increasing community involvement",04/05/2017,15/05/2017,1006,Funding released
DW-17-15,Dringhouses & Woodthorpe,Dementia Yorkshire,"A grant towards monthly themed sessions for people living with Dementia, their families and carers to attend at St James the Deacon Church in Woodthorpe. The session will aim to promote reminiscence through the use of all 5 senses (where possible). Activities will be chosen specifically for the benefit of those living with dementia and will be person centred. ","Improving access to services and support, increasing community involvement, promoting community safety",04/05/2017,15/05/2017,1500,Funding released
DW-17-16,Dringhouses & Woodthorpe,Woodthorpe York Community Group,A grant towards family fun day on 12 August 2017 on Woodthorpe Green. ,Increasing community involvement,04/05/2017,15/05/2017,1117,Funding released
DW-17-17,Dringhouses & Woodthorpe,Revival Estate Community Association,A grant towards family fund day on 16 July 2017 on the Revival Estate.,Increasing community involvement,04/05/2017,15/05/2017,1200,Funding released
DW-17-18,Dringhouses & Woodthorpe,Woodthorpe Wanderers Junior Football Club,"A grant for additional training materials (balls, nets, cones, bibs) and new kits (shirts, shorts, reading materials) for U6s, U7s, U8s and U9s.","Increasing community involvement, improving access to services and support",04/05/2017,15/05/2017,900,released to the group
DW-17-25,Dringhouses & Woodthorpe,CYC,To reinstate / strengthen the verge at the junction of Nidd Grove and Don Avenue. Currently verge suffers damage due to vehicles driving over.,improving the local environment  ,30/06/2017,27/11/2017,4500,commisioned
DW-17-26A,Dringhouses & Woodthorpe,CYC,Large patching of the road surface atthe junction of Dringthorpe Road with Lycett Road. The ward would like to obtain cost estimate for this potential work.,improving the local environment  ,30/06/2017,15/11/2017,5500,commisioned
DW-17-26B,Dringhouses & Woodthorpe,CYC,Large patching of the road surface at the junction of Lawson Road with Lycett Road.  The ward would like to obtain cost estimate for this potential work.,improving the local environment  ,30/06/2017,15/11/2017,5500,commisioned
DW-17-29,Dringhouses & Woodthorpe,CYC,Ward contribution towards purchase and installation of an accessible roundabout at Woodthorpe Green play area,"improving the local environment, increasing community involvement, improving assess to services and support  ",27/09/2017,19/10/2017,500,released
DW-17-31,Dringhouses & Woodthorpe,CYC,Install light to illuminate the path between Moor Lane and the old Park and Ride car park,improve the local environment ,15/11/2017,15/11/2017,912,commisioned
DW-17-33,Dringhouses & Woodthorpe,CYC,Planting and aftercare of trees at 4 locations suggested by the Council's Arboricultural Manager,Improving the local environment,16/01/2018,30/01/2018,1000,commissioned
DW-17-34,Dringhouses & Woodthorpe,CYC,Painting Woodthorpe Green play area equipment,Improving the local environment,16/01/2018,12/02/2018,1000,commisioned
DW-17-35,Dringhouses & Woodthorpe,Woodward Arborists,"Trees work on Silverdale Court by a contractor incl: crown lifting and crown cleaning of Kansan Cherry trees and the Weeping Willow + re-pollarding down to just above the previous pollard points, removing small side stems from the Birch tree and planting 2 new trees to either side of the dying Cherry tree.",Improving the local environment,16/01/2018,19/02/2018,1600,commissioned
